,Sentiment,URL,Title,Description,Date
77,0.0,https://finance.yahoo.com/news/hedge-funds-piling-cadence-bancorporation-163150857.html,Hedge Funds Are Piling Into Cadence Bancorporation (CADE),After several tireless days we have finished crunching the numbers from nearly 900 13F filings issued by the elite hedge funds and other investment firms...,2021-07-13
78,0.0,https://finance.yahoo.com/news/where-hedge-funds-stand-nmi-123825286.html,Where Do Hedge Funds Stand On NMI Holdings Inc (NMIH)?,"Hedge funds and large money managers usually invest with a focus on the long-term horizon and, therefore, short-lived dips or bumps on the charts usually...",2021-07-13
79,0.7096,https://finance.yahoo.com/news/hedge-funds-crazy-southern-copper-133442034.html,Hedge Funds Are Crazy About Southern Copper Corporation (SCCO),Insider Monkey has processed numerous 13F filings of hedge funds and successful value investors to create an extensive database of hedge fund holdings. The...,2021-07-13
80,0.34,https://finance.yahoo.com/news/hedge-funds-love-echostar-corporation-150331173.html,Do Hedge Funds Love Echostar Corporation (SATS)?,Last year we predicted the arrival of the first US recession since 2009 and we told in advance that the market will decline by at least 20% in (Recession is ...,2021-07-13
81,0.7096,https://finance.yahoo.com/news/hedge-funds-crazy-omega-healthcare-163134724.html,Hedge Funds Are Crazy About Omega Healthcare Investors Inc (OHI),Insider Monkey has processed numerous 13F filings of hedge funds and successful value investors to create an extensive database of hedge fund holdings. The...,2021-07-13
82,0.8885,https://finance.yahoo.com/news/global-markets-china-data-tech-065256306.html,"GLOBAL MARKETS-China data, tech drive Asian shares higher - Yahoo Finance",Asian shares headed for their best session in more than a fortnight on Tuesday after better than expected Chinese economic data and a rebound in China tech...,2021-07-13
83,0.9552,https://www.reuters.com/article/global-markets-int-idUSKBN2EJ05I,"China data, tech drive Asian shares higher - Reuters",Asian shares headed for their best session in more than a fortnight on Tuesday after better than expected Chinese economic data and a rebound in China tech shares extended after Tencent secured regulatory approval for a major deal.,2021-07-13
84,0.296,https://www.reuters.com/article/global-markets-idUSL1N2OP0DV,"GLOBAL MARKETS-China data, tech drive Asian shares higher - Reuters","* World FX rates http://tmsnrt.rs/2egbfVh (Adds context, udpates futures)",2021-07-13
85,0.6705,https://finance.yahoo.com/news/headwaters-capital-top-detractor-inspire-164546883.html,Headwaters Capital’s Top Detractor: Inspire Medical Systems Inc. (INSP),"Headwaters Capital, an investment management firm, published its second quarter 2021 investor letter – a copy of which can be downloaded here. A quarterly...",2021-07-13
86,0.0,https://finance.yahoo.com/news/why-headwaters-capital-sold-masimo-164118690.html,Here’s Why Headwaters Capital Sold its Masimo Corp. (MASI) Position,"Headwaters Capital, an investment management firm, published its second quarter 2021 investor letter – a copy of which can be downloaded here. A quarterly...",2021-07-13
87,0.6908,https://finance.yahoo.com/news/public-storage-psa-fell-favor-130735310.html,Public Storage (PSA) Fell Out Of Favor With Hedge Funds,"While the market driven by short-term sentiment influenced by the accommodative interest rate environment in the US, virus news and stimulus spending, many...",2021-07-13
88,0.0,https://finance.yahoo.com/news/where-hedge-funds-stand-american-134808491.html,Where Do Hedge Funds Stand On American Homes 4 Rent (AMH)?,"Hedge funds and large money managers usually invest with a focus on the long-term horizon and, therefore, short-lived dips or bumps on the charts usually...",2021-07-13
89,0.4588,https://finance.yahoo.com/news/hedge-funds-think-terminix-global-132243037.html,"Here is What Hedge Funds Think About Terminix Global Holdings, Inc. (TMX)","While the market driven by short-term sentiment influenced by the accommodative interest rate environment in the US, virus news and stimulus spending, many...",2021-07-13
90,0.34,https://finance.yahoo.com/news/brown-brown-inc-bro-fell-172223262.html,"Brown & Brown, Inc. (BRO) Fell Out Of Favor With Hedge Funds","Many prominent investors, including Warren Buffett, David Tepper and Stan Druckenmiller, have been cautious regarding the current bull market and missed out ...",2021-07-13
91,-0.1027,https://finance.yahoo.com/news/where-hedge-funds-stand-allegion-140957033.html,Where Do Hedge Funds Stand On Allegion plc (ALLE)?,"Most investors tend to think that hedge funds and other asset managers are worthless, as they cannot beat even simple index fund portfolios. In fact, most...",2021-07-13
92,-0.0772,https://finance.yahoo.com/news/hedge-funds-selling-westrock-company-133431822.html,Hedge Funds Are Selling WestRock Company (WRK),"Many prominent investors, including Warren Buffett, David Tepper and Stan Druckenmiller, have been cautious regarding the current bull market and missed out ...",2021-07-13
93,0.128,https://finance.yahoo.com/news/hedge-funds-crazy-group-1-190505804.html,"Hedge Funds Are Crazy About Group 1 Automotive, Inc. (GPI)","In this article we will take a look at whether hedge funds think Group 1 Automotive, Inc. (NYSE:GPI) is a good investment right now. We check hedge fund and ...",2021-07-13
94,0.128,https://finance.yahoo.com/news/hedge-funds-crazy-b-riley-175114132.html,"Hedge Funds Are Crazy About B. Riley Financial, Inc. (RILY)","In this article we will analyze whether B. Riley Financial, Inc. (NASDAQ:RILY) is a good investment right now by following the lead of some of the best...",2021-07-13
95,-0.6808,https://finance.yahoo.com/news/hedge-funds-never-more-bullish-174141514.html,Hedge Funds Have Never Been More Bullish On Green Plains Inc. (GPRE),"Although the masses and most of the financial media blame hedge funds for their exorbitant fee structure and disappointing performance, these investors have ...",2021-07-13
96,-0.4215,https://finance.yahoo.com/news/hedge-funds-nibbling-ingredion-incorporated-163829146.html,Hedge Funds Are Nibbling On Ingredion Incorporated (INGR),Last year we predicted the arrival of the first US recession since 2009 and we told in advance that the market will decline by at least 20% in (Recession is ...,2021-07-13
97,-0.7096,https://finance.yahoo.com/news/hedge-funds-crazy-tc-energy-163816658.html,Hedge Funds Are Crazy About TC Energy Corporation (TRP),"Although the masses and most of the financial media blame hedge funds for their exorbitant fee structure and disappointing performance, these investors have ...",2021-07-13
98,0.6597,https://finance.yahoo.com/news/hedge-funds-think-quidel-corporation-150326411.html,Here is What Hedge Funds Think About Quidel Corporation (QDEL),In this article you are going to find out whether hedge funds think Quidel Corporation (NASDAQ:QDEL) is a good investment right now. We like to check what...,2021-07-13
