,Sentiment,URL,Title,Description,Date
0,-0.0258,https://www.reuters.com/business/futures-mixed-ahead-earnings-big-banks-inflation-data-2021-07-13/,"Futures mixed ahead of earnings from big banks, inflation data - Reuters","U.S. stock index futures traded mixed on Tuesday, as investors awaited earnings updates from big banks and a reading on inflation data for early clues on the health of the domestic economy.",2021-07-13
1,-0.7541,https://www.businessinsider.com/elon-musk-solarcity-tesla-acquisition-court-takeaways-2021-7,5 of the most ridiculous moments from Elon Musk's first day in court,"Things got heated between Musk and the attorney for the shareholders suing him. ""I do not respect you,"" Musk said.",2021-07-13
2,0.0258,https://www.reuters.com/breakingviews/elon-musk-is-stuck-an-alternate-past-2021-07-13/,Elon Musk is stuck in an alternate past - Reuters,"For a man who wants to create a better future, Elon Musk seems stuck in the past, and an alternate version at that. During testimony in a shareholder lawsuit over Tesla’s <a href=""https://www.reuters.com/companies/TSLA.O"" target=""_blank"">(TSLA.O)</a> 2016 acq…",2021-07-13
3,0.0,https://www.reuters.com/business/musk-set-take-stand-second-day-trial-over-solarcity-deal-2021-07-13/,Musk set to take stand for second day in trial over SolarCity deal - Reuters,"Elon Musk will return to the witness stand on Tuesday for a second day to defend Tesla Inc's $2.6 billion acquisition of SolarCity in 2016, a deal that shareholders say benefited the CEO at the electric vehicle maker's expense.",2021-07-13
4,-0.9168,https://thenextweb.com/news/musk-tragedy-he-hates-being-tesla-ceo-but-company-will-die-without-him-trial-solar-city-deal,Musk’s tragedy: I ‘hate’ being Tesla’s CEO but the company will ‘die’ without me,"Folks, brace yourselves for what’s about to come… Elon Musk has revealed that he hates being the CEO of Tesla. Oh boy! Specifically, The Wall Street Journal reports the following words: I rather hate it and I would much prefer to spend my time on design and e…",2021-07-13
5,0.5719,https://www.reuters.com/business/global-markets-wrapup-1-2021-07-13/,Asia shares track Wall Street higher as investors await earnings - Reuters,"Asian shares climbed in early trade on Tuesday after Wall Street hit record highs overnight, as investors awaited the second-quarter earnings season and a batch of economic data, including key U.S. inflation figures later in the day.",2021-07-13
6,0.9371,https://www.reuters.com/article/australia-stocks-midday-idUSL4N2OP02K,"Miners, banks help Australian shares extend gains - Reuters","Australian shares rose on Tuesday for a second straight session, as heavyweight miners and banks advanced while strong cues from Wall Street also aided investor sentiment.",2021-07-13
7,0.296,https://www.reuters.com/business/global-markets-wrapup-5-pix-2021-07-13/,Stocks slip after US inflation data - Reuters,"Global shares dipped back from record highs on Tuesday as investors digested news of U.S. consumer prices rising by the most in 13 years, reinforcing expectations of tapering by the U.S. Federal Reserve.",2021-07-13
8,0.6124,https://www.reuters.com/world/china/global-markets-wrapup-4-pix-2021-07-13/,Stocks simmer near record highs ahead of U.S. inflation data - Reuters,"Global shares hung near record highs on Tuesday, buoyed by better than expected Chinese export data as markets awaited the release of U.S. inflation data for further clues about the global economic recovery.",2021-07-13
9,0.5994,https://www.reuters.com/business/global-markets-wrapup-3-pix-2021-07-13/,"Stocks edge up on China exports, U.S. inflation data awaited - Reuters","Global shares pushed to a record high on Tuesday, buoyed by better than expected Chinese export data as markets awaited the release of U.S. inflation data for further clues about the global economic recovery.",2021-07-13
10,0.0,https://www.bloomberg.com/news/newsletters/2021-07-13/elon-musk-never-wanted-to-be-tesla-ceo-kr2a7l70,Money Stuff: Elon Musk Never Wanted to Be CEO,"In 2016, Elon Musk was the chief executive officer, chairman of the board, chief product officer, co-founder[1] and largest shareholder of Tesla Inc. He was also the co-founder, chairman and largest shareholder of SolarCity Corp. He decided that Tesla, which …",2021-07-13
11,-0.0777,https://www.fool.com/investing/2021/07/13/why-tesla-stock-just-gave-back-half-its-gains/,Why Tesla Stock Just Gave Back Half of Yesterday's Gains,FSD v.9.0 Beta may not be as impressive as advertised.,2021-07-13
12,0.2023,https://www.fool.com/investing/2021/07/13/2-things-tesla-shareholders-need-to-know/,2 Things Tesla Shareholders Need to Know,Two recent developments suggest this month could be a significant one for Tesla.,2021-07-13
13,0.5106,https://www.investors.com/market-trend/stock-market-today/dow-jones-futures-fall-as-goldman-sachs-jpmorgan-report-earnings-tesla-stock-set-to-rally/,"Dow Jones Futures Fall As Goldman, JPMorgan Report Strong Earnings Results; Tesla Stock Set To Rally","Dow Jones futures fell 50 points, as Goldman Sachs and JPMorgan reported earnings. Tesla stock again rallied in premarket trade.",2021-07-13
14,0.8779,https://www.fool.com/investing/2021/07/13/4-growth-stocks-to-buy-this-week/,4 Growth Stocks to Buy This Week,Four stocks in different markets that could be providing investors with strong growth opportunities.,2021-07-13
15,0.2732,https://www.forbes.com/sites/greatspeculations/2021/07/13/borgwarner-amphenol-how-is-our-ev-supplier-stocks-theme-faring/,"BorgWarner, Amphenol: How Is Our EV Supplier Stocks Theme Faring?","Our theme of Electric Vehicle Component Supplier Stocks has done well this year, rising by about 17% year-to-date, compared to the S&P 500 which is up by about 16% over the same period. The theme has also considerably outperformed EV OEM stocks, such as Tesla…",2021-07-13
16,0.3182,https://www.foxbusiness.com/lifestyle/elon-musk-tells-court-i-think-im-funny,Elon Musk tells court: 'I think I'm funny' - Fox Business,"Elon Musk told a Delaware court ""I think I'm funny"" while he defended Tesla's 2016 acquisition of Solar City. The Tesla CEO told the plaintiffs' attorney, Randall Baron, that he is ""a bad human.""",2021-07-13
17,0.0,https://www.wsj.com/articles/elon-musk-returns-to-court-to-defend-teslas-solarcity-purchase-11626186836,Elon Musk Returns to Court to Defend Tesla’s SolarCity Purchase - The Wall Street Journal,"<ol><li>Elon Musk Returns to Court to Defend Tesla’s SolarCity Purchase  The Wall Street Journal
</li><li>Tesla: Elon Musk ‘rather hates’ being company boss  BBC News
</li><li>Elon Musk set to testify over Tesla's SolarCity buy  Yahoo Finance
</li><li>Elon…",2021-07-13
18,0.0,https://abnormalreturns.com/2021/07/13/tuesday-links-ceo-power/,Tuesday links: CEO power,,2021-07-13
19,0.0,https://www.forbes.com/sites/greatspeculations/2021/07/13/down-20-over-the-last-month-is-it-time-to-buy-quantumscape-stock/,"Down 20% Over The Last Month, Is It Time To Buy QuantumScape Stock?","QuantumScape, a startup that is working on solid-state lithium metal batteries for electric vehicles, has seen its stock price decline by close to 9% over the last week (five trading days) and remains down by about 19% over the last month (21 trading days). A…",2021-07-13
20,0.1779,https://www.businessinsider.com/lucid-rivian-toughest-competition-to-become-next-tesla-peter-rawlinson-2021-7,Lucid's CEO explains why he sees Rivian as his only real rival in the race to become the next Tesla,"Summary List PlacementElectric-vehicle startups have jumped at the opportunity to go public through mergers with special-purpose acquisition companies, or SPACs, over the past year. Some are already experiencing growing pains: Canoo, Nikola, and Lordstown Mot…",2021-07-13
21,-0.2023,https://www.forbes.com/sites/emilsayegh/2021/07/13/superstonks-crypto-and-discord-the-age-of-gamified-investment/,"Superstonks, Crypto, And Discord: The Age Of “Gamified” Investment","Viral investments have been dominating the news in 2021, as ""gamified investments"" have surged in popularity. From GameStop to AMC to Doge, these types of ""meme stock"" investments have illuminated issues within the market.",2021-07-13
22,-0.128,https://finance.yahoo.com/news/investors-shining-light-microvision-stock-064851829.html,Investors Shining a Light on Microvision Stock,The meme stock hysteria which has gripped the market in recent months has certainly taken specific stocks on wild rides. Among the companies that have been...,2021-07-13
23,0.3182,https://www.moneycontrol.com/news/technology/auto/elon-musk-tells-court-that-tesla-would-die-if-he-wasnt-ceo-7165091.html,Elon Musk tells court that Tesla would #39;die#39; if he wasn#39;t CEO,The lawsuit by union pension funds and asset managers alleges the celebrity CEO strong-armed Tesla#39;s board of directors into depleting the company#39;s assets with the $2.6 billion all-stock deal for SolarCity.,2021-07-13
24,0.0,https://www.gizmodo.com.au/2021/07/elon-musk-will-take-the-stand/,Elon Musk Will Take The Stand,"Elon Musk will take the stand on Monday in a court in Delaware, where some Tesla shareholders have sued to...
The post Elon Musk Will Take The Stand appeared first on Gizmodo Australia.

  Related Stories
<ul><li>Volvo Spins Off Combustion Engine Production<…",2021-07-13
25,-0.0258,https://news.yahoo.com/futures-mixed-ahead-earnings-big-103705916.html,"Futures mixed ahead of earnings from big banks, inflation data","U.S. stock index futures traded mixed on Tuesday, as investors awaited earnings updates from big banks and a reading on inflation data for early clues on the...",2021-07-13
26,0.34,https://www.fool.com/investing/2021/07/13/1-ipo-im-excited-about-in-2021/,1 IPO I'm Excited About in 2021,This electric vehicle company has hired advisors and could be heading towards a 2021 IPO.,2021-07-13
27,0.6124,https://www.fool.com/investing/2021/07/13/3-stocks-id-avoid-at-all-costs/,3 Stocks I'd Avoid at All Costs,"On the surface, these companies seem like underpriced investments, but look a little closer and there's a good reason to stay away.",2021-07-13
28,0.0,https://finance.yahoo.com/news/musk-set-stand-second-day-100312637.html,Musk set to take stand for second day in trial over SolarCity deal,"Elon Musk will return to the witness stand on Tuesday for a second day to defend Tesla Inc's $2.6 billion acquisition of SolarCity in 2016, a deal that...",2021-07-13
29,-0.753,https://seekingalpha.com/article/4438906-5-ways-its-really-different-this-timewhat-could-possibly-go-wrong,5 Ways It's Really Different This Time: What Could Possibly Go Wrong?,“It’s different this time” is usually not true. This time it is. A feasible scenario spells disaster.,2021-07-13
30,-0.802,https://www.foxbusiness.com/markets/elon-musk-tesla-solarcity-court-hearing,Elon Musk's Tesla-SolarCity hearing halted after someone pukes in court - Fox Business,"<ol><li>Elon Musk's Tesla-SolarCity hearing halted after someone pukes in court  Fox Business
</li><li>Elon Musk wraps testimony in SolarCity trial after denying he set acquisition price  CNBC
</li><li>Elon Musk set to testify over Tesla's SolarCity buy  Ya…",2021-07-13
31,0.6096,https://finance.yahoo.com/news/cogent-biosciences-inc-cogt-good-151142644.html,"Is Cogent Biosciences, Inc. (COGT) A Good Stock To Buy?","Out of thousands of stocks that are currently traded on the market, it is difficult to identify those that will really generate strong returns. Hedge funds...",2021-07-13
32,0.7003,https://finance.yahoo.com/news/porch-group-inc-prch-good-130748052.html,"Is Porch Group, Inc. (PRCH) A Good Stock To Buy?","In this article we will take a look at whether hedge funds think Porch Group, Inc. (NASDAQ:PRCH) is a good investment right now. We check hedge fund and...",2021-07-13
33,0.8807,https://finance.yahoo.com/news/pulmonx-corporation-lung-good-stock-174134073.html,Is Pulmonx Corporation (LUNG) A Good Stock To Buy Now?,Insider Monkey has processed numerous 13F filings of hedge funds and successful value investors to create an extensive database of hedge fund holdings. The...,2021-07-13
34,0.7964,https://finance.yahoo.com/news/oscar-health-inc-oscr-good-141021601.html,"Is Oscar Health, Inc. (OSCR) A Good Stock To Buy?",With the first-quarter round of 13F filings behind us it is time to take a look at the stocks in which some of the best money managers in the world preferred...,2021-07-13
35,0.7964,https://finance.yahoo.com/news/sutro-biopharma-inc-stro-good-151147896.html,"Is Sutro Biopharma, Inc. (STRO) A Good Stock To Buy?","As we already know from media reports and hedge fund investor letters, hedge funds delivered their best returns in a decade. Most investors who decided to...",2021-07-13
36,0.8807,https://finance.yahoo.com/news/rockwell-automation-inc-rok-good-123828125.html,Is Rockwell Automation Inc. (ROK) A Good Stock To Buy?,Insider Monkey has processed numerous 13F filings of hedge funds and successful value investors to create an extensive database of hedge fund holdings. The...,2021-07-13
37,0.4404,https://finance.yahoo.com/news/ultragenyx-pharmaceutical-inc-rare-good-171632426.html,Is Ultragenyx Pharmaceutical Inc (RARE) A Good Stock To Buy?,"Hedge funds and large money managers usually invest with a focus on the long-term horizon and, therefore, short-lived dips or bumps on the charts usually...",2021-07-13
38,0.7964,https://finance.yahoo.com/news/campbell-soup-company-cpb-good-163140903.html,Is Campbell Soup Company (CPB) A Good Stock To Buy?,With the first-quarter round of 13F filings behind us it is time to take a look at the stocks in which some of the best money managers in the world preferred...,2021-07-13
39,0.7351,https://finance.yahoo.com/news/vornado-realty-trust-vno-good-163137897.html,Is Vornado Realty Trust (VNO) A Good Stock To Buy?,"The latest 13F reporting period has come and gone, and Insider Monkey is again at the forefront when it comes to making use of this gold mine of data. We at ...",2021-07-13
40,0.0,https://finance.yahoo.com/news/first-bancorp-fbp-hedge-funds-132247234.html,First Bancorp (FBP): Are Hedge Funds Right About This Stock?,"The 800+ hedge funds and famous money managers tracked by Insider Monkey have already compiled and submitted their 13F filings for the first quarter, which...",2021-07-13
41,0.4404,https://finance.yahoo.com/news/arcus-biosciences-inc-rcus-good-130729016.html,"Is Arcus Biosciences, Inc. (RCUS) A Good Stock To Buy?","The latest 13F reporting period has come and gone, and Insider Monkey is again at the forefront when it comes to making use of this gold mine of data. We...",2021-07-13
42,0.4588,https://finance.yahoo.com/news/qiagen-nv-qgen-hedge-funds-133424702.html,Qiagen NV (QGEN): Are Hedge Funds Right About This Stock?,"While the market driven by short-term sentiment influenced by the accommodative interest rate environment in the US, virus news and stimulus spending, many...",2021-07-13
43,0.875,https://finance.yahoo.com/news/fastly-inc-fsly-good-stock-140954590.html,"Is Fastly, Inc. (FSLY) A Good Stock To Buy?","In this article we will analyze whether Fastly, Inc. (NYSE:FSLY) is a good investment right now by following the lead of some of the best investors in the...",2021-07-13
44,0.4939,https://finance.yahoo.com/news/univar-solutions-inc-unvr-good-171651687.html,Is Univar Solutions Inc (UNVR) A Good Stock To Buy?,"Most investors tend to think that hedge funds and other asset managers are worthless, as they cannot beat even simple index fund portfolios. In fact, most...",2021-07-13
45,0.3612,https://finance.yahoo.com/news/buy-teradata-corporation-tdc-123834332.html,Should I Buy Teradata Corporation (TDC)?,"Before we spend countless hours researching a company, we like to analyze what insiders, hedge funds and billionaire investors think of the stock first. This...",2021-07-13
46,0.3612,https://finance.yahoo.com/news/hedge-funds-buying-west-fraser-165536475.html,Hedge Funds Are Buying West Fraser Timber Co. Ltd. (WFG),"Before we spend countless hours researching a company, we like to analyze what insiders, hedge funds and billionaire investors think of the stock first. This...",2021-07-13
47,0.4696,https://finance.yahoo.com/news/assurant-inc-aiz-fell-favor-141009800.html,"Assurant, Inc. (AIZ) Fell Out Of Favor With Hedge Funds?","How do you pick the next stock to invest in? One way would be to spend days of research browsing through thousands of publicly traded companies. However, an ...",2021-07-13
48,0.3612,https://finance.yahoo.com/news/hedge-funds-never-bullish-par-175048095.html,"Hedge Funds Have Never Been This Bullish On Par Pacific Holdings, Inc. (PARR)","Before we spend countless hours researching a company, we like to analyze what insiders, hedge funds and billionaire investors think of the stock first. This...",2021-07-13
49,0.0258,https://finance.yahoo.com/news/hedge-funds-crazy-primoris-services-144827064.html,Hedge Funds Are Crazy About Primoris Services Corp (PRIM),"Before we spend countless hours researching a company, we like to analyze what insiders, hedge funds and billionaire investors think of the stock first. This...",2021-07-13
50,0.0,https://finance.yahoo.com/news/coty-inc-coty-hedge-funds-123822719.html,Coty Inc (COTY): Hedge Funds Are Snapping Up,"How do you pick the next stock to invest in? One way would be to spend days of research browsing through thousands of publicly traded companies. However, an ...",2021-07-13
51,0.3612,https://finance.yahoo.com/news/robert-half-international-inc-rhi-180554336.html,Robert Half International Inc. (RHI): Hedge Fund Sentiment Unchanged,"Before we spend countless hours researching a company, we like to analyze what insiders, hedge funds and billionaire investors think of the stock first. This...",2021-07-13
52,0.0,https://finance.yahoo.com/news/where-hedge-funds-stand-potlatchdeltic-174127560.html,Where Do Hedge Funds Stand On PotlatchDeltic Corporation (PCH)?,"How do you pick the next stock to invest in? One way would be to spend days of research browsing through thousands of publicly traded companies. However, an ...",2021-07-13
53,-0.34,https://finance.yahoo.com/news/hedge-funds-crazy-carlyle-group-123847046.html,Hedge Funds Are Crazy About The Carlyle Group Inc (CG),"How do you pick the next stock to invest in? One way would be to spend days of research browsing through thousands of publicly traded companies. However, an ...",2021-07-13
54,0.3612,https://finance.yahoo.com/news/where-hedge-funds-stand-contextlogic-133427550.html,Where Do Hedge Funds Stand On ContextLogic Inc. (WISH)?,"Before we spend countless hours researching a company, we like to analyze what insiders, hedge funds and billionaire investors think of the stock first. This...",2021-07-13
55,0.3612,https://finance.yahoo.com/news/where-hedge-funds-stand-simpson-141521328.html,"Where Do Hedge Funds Stand On Simpson Manufacturing Co, Inc. (SSD)?","Before we spend countless hours researching a company, we like to analyze what insiders, hedge funds and billionaire investors think of the stock first. This...",2021-07-13
56,0.0,https://finance.yahoo.com/news/air-lease-corp-al-going-135626720.html,Is Air Lease Corp (AL) Going to Burn These Hedge Funds?,"How do you pick the next stock to invest in? One way would be to spend days of research browsing through thousands of publicly traded companies. However, an ...",2021-07-13
57,0.0,https://finance.yahoo.com/news/hedge-funds-piling-nordson-corporation-174139268.html,Hedge Funds Are Piling Into Nordson Corporation (NDSN),"How do you pick the next stock to invest in? One way would be to spend days of research browsing through thousands of publicly traded companies. However, an ...",2021-07-13
58,-0.7584,https://www.independent.co.uk/news/musk-clashes-again-with-opposing-lawyer-in-solarcity-lawsuit-elon-musk-solarcity-tesla-wilmington-witness-b1883401.html,Musk clashes again with opposing lawyer in SolarCity lawsuit,CEO Elon Musk pushed back again Tuesday against a lawsuit that blames him for engineering Tesla’s 2016 acquisition of a financially precarious company called SolarCity that was marred by conflicts of interest and never generated the profits Musk insisted it w…,2021-07-13
59,0.4404,https://finance.yahoo.com/news/warner-music-group-corp-wmg-135556175.html,Is Warner Music Group Corp. (WMG) A Good Stock To Buy?,"The 800+ hedge funds and famous money managers tracked by Insider Monkey have already compiled and submitted their 13F filings for the first quarter, which...",2021-07-13
60,-0.1027,https://finance.yahoo.com/news/arch-resources-inc-arch-hedge-180548282.html,"Arch Resources, Inc. (ARCH): Are Hedge Funds Right About This Stock?","Most investors tend to think that hedge funds and other asset managers are worthless, as they cannot beat even simple index fund portfolios. In fact, most...",2021-07-13
61,0.3818,https://finance.yahoo.com/news/hayward-holdings-inc-hayw-good-162140296.html,"Is Hayward Holdings, Inc. (HAYW) A Good Stock To Buy Now?","Many prominent investors, including Warren Buffett, David Tepper and Stan Druckenmiller, have been cautious regarding the current bull market and missed out ...",2021-07-13
62,0.6249,https://finance.yahoo.com/news/tri-pointe-homes-inc-tph-174130026.html,"Is Tri Pointe Homes, Inc. (TPH) A Good Stock To Buy?","Hedge Funds and other institutional investors have just completed filing their 13Fs with the Securities and Exchange Commission, revealing their equity...",2021-07-13
63,0.5719,https://finance.yahoo.com/news/asia-shares-track-wall-street-022216221.html,Asia shares track Wall Street higher as investors await earnings,"Asian shares climbed in early trade on Tuesday after Wall Street hit record highs overnight, as investors awaited the second-quarter earnings season and a...",2021-07-13
64,0.8625,https://finance.yahoo.com/news/hedge-funds-love-mid-america-130720778.html,Do Hedge Funds Love Mid America Apartment Communities Inc (MAA)?,In this article you are going to find out whether hedge funds think Mid America Apartment Communities Inc (NYSE:MAA) is a good investment right now. We like ...,2021-07-13
65,0.8074,https://finance.yahoo.com/news/hedge-funds-buying-foot-locker-151154357.html,"Hedge Funds Are Buying Foot Locker, Inc. (FL)",Insider Monkey has processed numerous 13F filings of hedge funds and successful value investors to create an extensive database of hedge fund holdings. The...,2021-07-13
66,0.8541,https://finance.yahoo.com/news/slm-corp-slm-going-burn-141006304.html,Is SLM Corp (SLM) Going to Burn These Hedge Funds?,Is SLM Corp (NASDAQ:SLM) a good place to invest some of your money right now? We can gain invaluable insight to help us answer that question by studying the ...,2021-07-13
67,0.34,https://seekingalpha.com/article/4438971-fdis-consumer-discretionary-dashboard-for-july,FDIS: Consumer Discretionary Dashboard For July,"A dashboard with metrics in consumer cyclical subsectors. Value and quality scores, and their evolution since last month. Focus on FDIS.",2021-07-13
68,0.3182,https://finance.yahoo.com/news/hedge-funds-think-gray-television-190454020.html,"Here is What Hedge Funds Think About Gray Television, Inc. (GTN)",We at Insider Monkey have gone over 866 13F filings that hedge funds and prominent investors are required to file by the SEC. The 13F filings show the funds’...,2021-07-13
69,0.5423,https://finance.yahoo.com/news/hedge-funds-warming-fox-corporation-171654831.html,Hedge Funds Are Warming Up To Fox Corporation (FOX),In this article we will take a look at whether hedge funds think Fox Corporation (NASDAQ:FOX) is a good investment right now. We check hedge fund and...,2021-07-13
70,0.8271,https://finance.yahoo.com/news/hedge-funds-love-rapid7-inc-190448965.html,Do Hedge Funds Love Rapid7 Inc (RPD)?,"Our extensive research has shown that imitating the smart money can generate significant returns for retail investors, which is why we track nearly 900...",2021-07-13
71,-0.5574,https://jalopnik.com/elon-musk-hates-running-tesla-1847280705,Elon Musk 'Hates' Running Tesla,"Elon Musk gets relatable, the U.K. wants to ban diesel trucks, and Lordstown. That and more in The Morning Shift for July 13, 2021.Read more...",2021-07-13
72,0.3612,https://finance.yahoo.com/news/hedge-funds-never-bullish-meredith-132230290.html,Hedge Funds Have Never Been This Bullish On Meredith Corporation (MDP),The financial regulations require hedge funds and wealthy investors that exceeded the $100 million holdings threshold to file a report that shows their...,2021-07-13
73,-0.3182,https://finance.yahoo.com/news/hedge-funds-dumping-glaxosmithkline-plc-172235310.html,Hedge Funds Are Dumping GlaxoSmithKline plc (GSK),"The 800+ hedge funds and famous money managers tracked by Insider Monkey have already compiled and submitted their 13F filings for the first quarter, which...",2021-07-13
74,0.34,https://finance.yahoo.com/news/hedge-funds-love-netapp-inc-175057746.html,Do Hedge Funds Love NetApp Inc. (NTAP)?,Last year we predicted the arrival of the first US recession since 2009 and we told in advance that the market will decline by at least 20% in (Recession is ...,2021-07-13
75,0.0,https://finance.yahoo.com/news/hedge-funds-selling-western-union-163822836.html,Hedge Funds Are Selling The Western Union Company (WU),"Hedge funds and large money managers usually invest with a focus on the long-term horizon and, therefore, short-lived dips or bumps on the charts usually...",2021-07-13
76,0.0,https://finance.yahoo.com/news/hedge-funds-think-borgwarner-inc-133448408.html,Here is What Hedge Funds Think About BorgWarner Inc. (BWA),"The latest 13F reporting period has come and gone, and Insider Monkey is again at the forefront when it comes to making use of this gold mine of data...",2021-07-13
