,Sentiment,URL,Title,Description,Date
74,-0.6369,https://www.businessinsider.in/cryptocurrency/news/elon-musk-hints-that-tesla-may-dump-its-billion-dollar-bitcoin-investment/articleshow/82699553.cms,Elon Musk hints that Tesla may dump its billion dollar Bitcoin investment — here’s why his tweets have so much - Business Insider India,"<ol><li>Elon Musk hints that Tesla may dump its billion dollar Bitcoin investment — here’s why his tweets have so much  Business Insider India
</li><li>'Tesla has not sold any Bitcoin', says Elon Musk to end speculations on company's position  Mint
</li><li…",2021-05-17
75,0.7506,https://seekingalpha.com/news/3697291-tesla-stock-now-down-more-than-35-from-high-as-selling-pressure-persists,Tesla stock now down more than 35% from high as selling pressure persists,Shares of Tesla (TSLA) are having a rough session despite Elon Musk talking positive about the Gigafactory progress in Berlin. Read details.,2021-05-17
76,0.0,https://www.barrons.com/articles/cathie-woods-ark-questions-elon-musks-call-on-bitcoin-51621274261,Cathie Wood’s ARK Questions Elon Musk’s Call on Bitcoin,Cathie Wood's ARK Invest believes the concern about Bitcoin mining's impact on the environment is misguided.,2021-05-17
77,0.6597,https://seekingalpha.com/news/3697293-michael-burrys-scion-goes-bearish-on-tesla-bullish-on-facebook-and-alphabet,"Michael Burry's Scion goes bearish on Tesla, bullish on Facebook and Alphabet","Scion Asset Management, run by investor Michael Burry of &quot;The Big Short&quot; fame, discloses a bet that Tesla &lt;&lt;TSLA&gt;&gt; stock will fall in its latest 13F filing.The...",2021-05-17
78,0.296,https://markets.businessinsider.com/news/stocks/big-short-michael-burry-put-options-elon-musk-tesla-stock-2021-5-1030437431,'Big Short' investor Michael Burry reveals his bet against Tesla stock — and discloses an unexpected SPAC stake,"Summary List Placement<ul>
<li>Michael Burry held put options on over 800,000 Tesla shares at the end of March.</li>
<li>""The Big Short"" investor has blasted Elon Musk's automaker for its ""ridiculous"" valuation.</li>
<li>Burry's Scion fund also bet on oil and…",2021-05-17
79,0.34,https://cointelegraph.com/news/cash-candy-or-bitcoin-paying-minors-in-2021,"'Cash, candy or Bitcoin': Paying minors in 2021",Eddie Yoon said he wants his kids to have the tools for financial security in the future.,2021-05-17
80,0.3612,https://finance.yahoo.com/news/consider-investing-aercap-holdings-aer-161023944.html,Should You Consider Investing in AerCap Holdings (AER)?,"Horos Asset Management, an investment management firm, published its first quarter 2021 investor letter – a copy of which can be downloaded here. A return of...",2021-05-17
81,0.5423,https://news.yahoo.com/asian-markets-mixed-traders-weigh-031519749.html,Asian markets mixed as traders weigh recovery and new infections,Asian markets were mixed Monday as optimism about the global recovery was offset by concerns about a spike in new infections in several countries that have...,2021-05-17
82,0.25,https://www.usatoday.com/story/money/markets/2021/05/17/inflation-fears-cause-us-stock-take-tumble/5136210001/,'We've had such a strong start to the year we tend to take a break': US stocks slip further from records amid inflation fears,"The S&P 500 dipped 10.56, or 0.3%, to 4,163.29, with tech stocks and other former market darlings once again taking the brunt of the losses.",2021-05-17
83,0.7184,https://www.marketwatch.com/story/the-painful-tech-selloff-is-an-opportunity-to-own-these-secular-growth-winners-analyst-says-11621250949,"The painful tech selloff is an opportunity to own these secular winners, analyst says - MarketWatch","The painful tech selloff is an opportunity to own these secular winners, analyst says  MarketWatch",2021-05-17
84,0.3612,https://finance.yahoo.com/news/baron-small-cap-fund-e2open-161532791.html,Baron Small Cap Fund: “E2open (ETWO) Will Be a Steady Earnings Compounder”,"Baron Funds, an asset management firm, published its “Baron Small Cap Fund” first quarter 2021 investor letter – a copy of which can be downloaded here. A...",2021-05-17
85,0.8555,https://finance.yahoo.com/news/10-best-alternative-fuel-stocks-200920946.html,10 Best Alternative Fuel Stocks to Buy Now,"In this article, we will take a look at the 10 best alternative fuel stocks to buy now. You can skip our detailed analysis of the fuel sector’s outlook for...",2021-05-17
86,0.6124,https://finance.yahoo.com/news/why-horos-asset-management-sold-164631377.html,Here’s Why Horos Asset Management Sold its Baidu (BIDU) Stake,"Horos Asset Management, an investment management firm, published its first quarter 2021 investor letter – a copy of which can be downloaded here. A return of...",2021-05-17
87,0.6369,https://finance.yahoo.com/news/shoals-technologies-group-shls-smart-161351784.html,Is Shoals Technologies Group (SHLS) A Smart Long-Term Buy?,"Baron Funds, an asset management firm, published its “Baron Small Cap Fund” first quarter 2021 investor letter – a copy of which can be downloaded here. A...",2021-05-17
88,0.0,https://finance.yahoo.com/news/why-polen-capital-exited-check-160138055.html,Here’s Why Polen Capital Exited its Check Point Software (CHKP) Position,"Polen Capital, an investment management firm, published its “Polen International Growth” first quarter 2021 investor letter – a copy of which can be...",2021-05-17
89,0.25,https://finance.yahoo.com/news/polen-capital-oriental-edu-remains-160013146.html,Polen Capital: “New Oriental (EDU) Remains Poised to Grow Earnings at 25% Annual Rate”,"Polen Capital, an investment management firm, published its “Polen International Growth” first quarter 2021 investor letter – a copy of which can be...",2021-05-17
90,0.8068,https://seekingalpha.com/news/3696910-sp-dow-nasdaq-futures-dip-slightly-after-tough-week-for-risk-assets-crypto-still-under-pressure,"S&P, Dow, Nasdaq futures dip slightly after tough week for risk assets; crypto still under pressure","The stock market is indicated to open just slightly down. The major averages enjoyed a strong rally Friday, but it wasn't enough to push them into positive territory for the week.",2021-05-17
91,0.0258,https://www.independent.co.uk/voices/bitcoin-cost-crypto-dogecoin-elon-musk-b1849082.html,I’ve reported on bitcoin since the beginning. Here’s the harsh truth about crypto,"The ultimate crypto buyer is likely to be one of the greater fools on Robinhood or Reddit, all of which are basically just updated versions of the Yahoo Finance message boards, which loved Overstock 17 profitless years ago",2021-05-17
92,0.7184,https://finance.yahoo.com/news/aon-contributed-positively-polen-international-155844442.html,AON Contributed Positively in Polen International Growth Fund’s Q1 Results,"Polen Capital, an investment management firm, published its “Polen International Growth” first quarter 2021 investor letter – a copy of which can be...",2021-05-17
93,0.743,https://www.engadget.com/the-morning-after-tesla-model-s-prototype-with-retractable-spoiler-spotted-113004556.html,The Morning After: Tesla Model S prototype with retractable spoiler spotted,"Today’s headlines: Amazon debuts another free video streaming service in India, Sharp is still making smartphones and its latest device has a huge one-inch...",2021-05-17
94,0.1027,https://bgr.com/tech/bitcoin-price-drop-elon-musk-weekend-tesla-doge-tweets-5925897/,Elon Musk just tanked bitcoin… again,Tesla CEO Elon Musk revealed on Twitter a few days ago that his company will no longer accept bitcoin payments for electric cars. The announcement came just as suddenly as the revelation earlier this year that Tesla had purchased bitcoin and planned to suppor…,2021-05-17
95,0.5423,https://www.cnn.com/2021/05/17/investing/tesla-bitcoin-musk-cryptocurrencies/index.html,Musk's mixed messages on bitcoin stoke anxieties about cryptos in Corporate America,"Bitcoin, it seemed, was finally ready for prime time. Prices were surging, big payments firms were accepting it, and billionaires such as Paul Tudor Jones and Stanley Druckenmiler were endorsing it as an investment.",2021-05-17
96,-0.6808,https://finance.yahoo.com/news/us-stocks-wall-st-ends-211429217.html,"US STOCKS-Wall St ends lower, pulled down by tech stocks","Of the 11 major S&P sectors that declined, technology , utilities and communication services were the biggest losers, each down between 0.7% and 0.9%.  ""What...",2021-05-17
