,Sentiment,URL,Title,Description,Date
79,0.0,https://finance.yahoo.com/news/where-hedge-funds-stand-nordstrom-130523611.html,"Where Do Hedge Funds Stand On Nordstrom, Inc. (JWN)?",After several tireless days we have finished crunching the numbers from nearly 900 13F filings issued by the elite hedge funds and other investment firms...,2021-06-28
80,0.2023,https://247wallst.com/investing/2021/06/28/cramers-stock-picks-at-the-market-top/,Cramer’s Stock Picks at the Market Top,24/7 Wall St. takes a look at famed market personality Jim Cramer’s latest buy and sell recommendations and overall analysis.,2021-06-28
81,0.4404,https://finance.yahoo.com/news/hedge-funds-selling-ralph-lauren-120915899.html,Hedge Funds Are Selling Ralph Lauren Corporation (RL),In this article we are going to use hedge fund sentiment as a tool and determine whether Ralph Lauren Corporation (NYSE:RL) is a good investment right now...,2021-06-28
82,-0.4215,https://finance.yahoo.com/news/where-hedge-funds-stand-popular-121941414.html,Where Do Hedge Funds Stand On Popular Inc (BPOP)?,"Although the masses and most of the financial media blame hedge funds for their exorbitant fee structure and disappointing performance, these investors have ...",2021-06-28
83,0.9062,https://finance.yahoo.com/news/hedge-funds-love-xpo-logistics-141309448.html,Do Hedge Funds Love XPO Logistics Inc (XPO)?,In this article we will analyze whether XPO Logistics Inc (NYSE:XPO) is a good investment right now by following the lead of some of the best investors in...,2021-06-28
84,0.0,https://finance.yahoo.com/news/where-hedge-funds-stand-theratechnologies-174906913.html,Where Do Hedge Funds Stand On Theratechnologies Inc. (THTX)?,"Hedge funds and large money managers usually invest with a focus on the long-term horizon and, therefore, short-lived dips or bumps on the charts usually...",2021-06-28
85,0.0,https://finance.yahoo.com/news/hedge-funds-never-bullish-international-180744353.html,Hedge Funds Have Never Been This Bullish On International Paper Company (IP),"Hedge funds and large money managers usually invest with a focus on the long-term horizon and, therefore, short-lived dips or bumps on the charts usually...",2021-06-28
86,-0.6808,https://finance.yahoo.com/news/hedge-funds-never-bullish-pegasystems-191910756.html,Hedge Funds Have Never Been This Bullish On Pegasystems Inc. (PEGA),"Although the masses and most of the financial media blame hedge funds for their exorbitant fee structure and disappointing performance, these investors have ...",2021-06-28
87,0.5106,https://finance.yahoo.com/news/hedge-funds-think-coupang-inc-141315876.html,"Here is What Hedge Funds Think About Coupang, Inc. (CPNG)","We know that hedge funds generate strong, risk-adjusted returns over the long run, therefore imitating the picks that they are collectively bullish on can be...",2021-06-28
88,0.4404,https://finance.yahoo.com/news/cannae-holdings-inc-cnne-going-141735346.html,"Is Cannae Holdings, Inc. (CNNE) Going to Burn These Hedge Funds?","In this article we will take a look at whether hedge funds think Cannae Holdings, Inc. (NYSE:CNNE) is a good investment right now. We check hedge fund and...",2021-06-28
89,0.0,https://finance.yahoo.com/news/hedge-funds-selling-fleetcor-technologies-132501650.html,"Hedge Funds Are Selling FleetCor Technologies, Inc. (FLT)","Hedge funds and large money managers usually invest with a focus on the long-term horizon and, therefore, short-lived dips or bumps on the charts usually...",2021-06-28
90,0.0,https://finance.yahoo.com/news/maverix-metals-inc-mmx-going-180127718.html,Is Maverix Metals Inc. (MMX) Going to Burn These Hedge Funds?,"Hedge funds and large money managers usually invest with a focus on the long-term horizon and, therefore, short-lived dips or bumps on the charts usually...",2021-06-28
91,0.2682,https://finance.yahoo.com/news/buy-qualtrics-international-inc-xm-194743492.html,Should I Buy Qualtrics International Inc. (XM)?,"Out of thousands of stocks that are currently traded on the market, it is difficult to identify those that will really generate strong returns. Hedge funds...",2021-06-28
92,-0.0258,https://finance.yahoo.com/news/live-nation-entertainment-inc-lyv-191907559.html,"Live Nation Entertainment, Inc. (LYV) Fell Out Of Favor With Hedge Funds","Although the masses and most of the financial media blame hedge funds for their exorbitant fee structure and disappointing performance, these investors have ...",2021-06-28
93,0.0,https://finance.yahoo.com/news/hedge-funds-think-insulet-corporation-133140291.html,Here is What Hedge Funds Think About Insulet Corporation (PODD),"Hedge funds and large money managers usually invest with a focus on the long-term horizon and, therefore, short-lived dips or bumps on the charts usually...",2021-06-28
94,0.8074,https://finance.yahoo.com/news/hedge-funds-think-te-connectivity-133153284.html,Here is What Hedge Funds Think About TE Connectivity Ltd. (TEL),Insider Monkey has processed numerous 13F filings of hedge funds and successful value investors to create an extensive database of hedge fund holdings. The...,2021-06-28
95,0.7964,https://finance.yahoo.com/news/hedge-funds-never-bullish-tronox-180751897.html,Hedge Funds Have Never Been This Bullish On Tronox Holdings Plc (TROX),In this article we will analyze whether Tronox Holdings Plc (NYSE:TROX) is a good investment right now by following the lead of some of the best investors in...,2021-06-28
96,0.6597,https://finance.yahoo.com/news/hedge-funds-never-bullish-celanese-120849156.html,Hedge Funds Have Never Been This Bullish On Celanese Corporation (CE),In this article you are going to find out whether hedge funds think Celanese Corporation (NYSE:CE) is a good investment right now. We like to check what the ...,2021-06-28
97,0.6597,https://finance.yahoo.com/news/hedge-funds-never-bullish-novavax-130543955.html,"Hedge Funds Have Never Been This Bullish On Novavax, Inc. (NVAX)","In this article you are going to find out whether hedge funds think Novavax, Inc. (NASDAQ:NVAX) is a good investment right now. We like to check what the...",2021-06-28
98,0.0516,https://finance.yahoo.com/news/hedge-funds-dumping-stoneco-ltd-133149710.html,Hedge Funds Are Dumping StoneCo Ltd. (STNE),A whopping number of 13F filings filed with U.S. Securities and Exchange Commission has been processed by Insider Monkey so that individual investors can...,2021-06-28
99,0.0,https://finance.yahoo.com/news/hedge-funds-never-bullish-fate-133159520.html,Hedge Funds Have Never Been This Bullish On Fate Therapeutics Inc (FATE),"The latest 13F reporting period has come and gone, and Insider Monkey is again at the forefront when it comes to making use of this gold mine of data. We at ...",2021-06-28
