,Sentiment,URL,Title,Description,Date
0,0.5859,https://kotaku.com/apparently-tesla-cars-have-enough-graphical-horsepower-1847018750,Apparently Tesla Cars Have Enough Graphical Horsepower To Play Cyberpunk 2077,"You shouldn’t take a call while driving, you shouldn’t text while driving, and you certainly shouldn’t game while driving. And yet, that’s exactly what you might be able to do with the Tesla Models X and S. As spotted by The Gamer, bazillionaire Tesla CEO and…",2021-06-02
1,0.9042,https://stockmarket.com/featured/best-growth-stocks-to-buy-now-electric-vehicle-stocks-to-watch-2021-06-02,Best Growth Stocks To Buy Now? 5 Electric Vehicle Stocks To Watch,"EV stocks are on fire, fueled by optimism from strong delivery numbers.",2021-06-02
2,0.128,https://thenextweb.com/news/tesla-roadster-space-x-acceleration-simulation,This Tesla Roadster simulation with the SpaceX thruster pack shows its insane speed,"Tesla is claiming that its upcoming Roadster sports car will accelerate from zero to 60 quicker than pretty much anything else on the planet — 1.9 seconds to be precise. It’s so fast that there isn’t much out there to compare it to, so we don’t really have a …",2021-06-02
3,0.6486,https://www.reuters.com/technology/dogecoin-jumps-news-launch-coinbase-pro-2021-06-02/,Dogecoin jumps on news of launch on Coinbase Pro - Reuters,"Dogecoin, a meme-based cryptocurrency popular among retail investors, surged on Wednesday, benefiting from news that digital asset exchange Coinbase (COIN.O) will make the crypto unit available to its users on its trading platform.",2021-06-02
4,0.3612,https://www.businessinsider.com/jeremy-grantham-housing-bubble-nasdaq-spacs-peak-bear-2021-6,Legendary investor Jeremy Grantham sees a housing bubble in almost every market – and says the Nasdaq and SPACs have likely peaked,"Summary List PlacementJeremy Grantham has said real estate bubbles are popping up in almost every market around the world, and that eventually there'll be a ""day of reckoning.""
The legendary investor, who cofounded the GMO asset management firm, also said on …",2021-06-02
5,0.2263,https://www.marketwatch.com/story/elon-musk-tweeted-and-this-stock-jumped-after-report-that-regulators-told-tesla-his-twitter-account-broke-court-order-11622639029,": Elon Musk tweeted and this stock jumped, after report that regulators told Tesla his Twitter account broke court order","On Wednesday, shares in Samsung Publishing moved higher following new tweets from the chief executive of the electric-vehicle company, while crypto asset dogecoin soared after Musk posted a related meme.",2021-06-02
6,0.6808,https://www.marketbeat.com/originals/ford-stakes-its-future-on-evs-commercial-sales-and-services/?utm_source=entrepreneurcom&amp;amp;utm_medium=entrepreneurcom,"Ford Stakes Its Future On EVs, Commercial Sales, And Services","Ford Motor is staking its future on electric vehicles, with plans to have 40% of its fleet battery powered by 2030. Shares are up more than 6% since the company shared its vision on investors' day on May 26.",2021-06-02
7,0.3182,https://www.reuters.com/business/wall-st-treads-water-ahead-key-economic-data-amc-soars-2021-06-02/,Wall St treads water ahead of key economic data; AMC soars - Reuters,"The S&P 500 (.SPX) was little changed on Wednesday ahead of key U.S. economic data due later in the week as investors weighed inflation concerns and a fresh surge in so-called ""meme stocks.""",2021-06-02
8,0.7351,https://www.marketwatch.com/story/amc-entertainments-stock-surge-ripples-through-these-etfs-11622655451,Market Extra: AMC Entertainment’s stock surge ripples through these ETFs,"Shares of AMC Entertainment Holdings are locked in an unprecedented year-to-date rally that has the movie chain's shares up over 2,300% in 2021, and the surge has a batch of exchange-traded funds on for the wild stratospheric ride.",2021-06-02
9,0.6059,https://www.marketwatch.com/story/amcs-new-free-popcorn-for-retail-investors-plan-is-just-latest-move-by-increasingly-flirty-meme-stock-execs-11622650216,": AMC’s new free popcorn for retail investors plan is just latest move by increasingly 
flirty meme stock execs","Meme stock players have been positively Muskian in their careful pursuit of retail traders attention in 2021, but AMC CEO Adam Aron's new ""AMC Investor Connect"" plan might forge a new middle ground.",2021-06-02
10,-0.802,https://hypebeast.com/2021/6/elon-musk-tweets-sec-court-order-violated-news,SEC Reveals Elon Musk's Tweets Have Twice Violated Court Order,"Tesla CEO Elon Musk is no stranger to his casual use of Twitter. However, a recent report by the Wall Street Journal has revealed that Elon Musk has twice violated a court-ordered policy that would require the company to approve of his tweets prior to them be…",2021-06-02
11,-0.3535,https://www.vox.com/recode/22464702/regulators-sec-elon-musk-tesla-tweets,Regulators are trying to get Musk to run his tweets by lawyers. It’s not working.,What can the SEC really do to stop Musk’s market-moving tweets?,2021-06-02
12,0.6705,https://www.bloomberg.com/news/newsletters/2021-06-02/money-stuff-amc-brings-out-the-popcorn,Money Stuff: AMC Brings Out the Popcorn,"The famous George Soros quote is “When I see a bubble forming, I rush in to buy, adding fuel to the fire.” If you watched the stock of AMC Entertainment Holdings Inc. go up 116% last week, on not much news, you might rationally think “boy I wish I had a ton o…",2021-06-02
13,-0.296,https://www.theregister.com/2021/06/02/sec_to_tesla_were_not/,You were supposed to be watching him. Letters from SEC claim Tesla breached deal to police Elon Musk's tweets,"2020 missives from American securities regulator to car firm revealed
The SEC has repeatedly found itself frustrated by the bombastic tweets of Tesla CEO Elon Musk. And letters from the regulator have revealed that two of Musk’s postings were in breach of a p…",2021-06-02
14,-0.743,https://www.fool.com/investing/2021/06/02/tesla-failed-to-rein-in-musk-on-twitter-sec/,SEC Alleges Tesla Failed to Rein In Musk on Twitter,The securities regulator said that the controversial CEO twice violated a court order.,2021-06-02
15,0.34,https://www.fool.com/investing/2021/06/02/why-amd-investors-should-be-excited/,Why AMD Investors Should Be Excited,Is it time for the stock price of this semiconductor company to run up?,2021-06-02
16,-0.7506,https://deadline.com/2021/06/elon-musk-tweets-violated-court-order-sec-lawsuit-settlement-1234767604/,Elon Musk Tweets Violated Court Order Enacted In SEC Lawsuit Settlement – Report,"Elon Musk twice violated a court order meant to prevent the Tesla CEO from allegedly using Twitter to manipulate the stock market, according to documents obtained by the Wall Street Journal on Tuesday. The Securities and Exchange Commission alleged in a lawsu…",2021-06-02
17,-0.6705,https://www.bbc.co.uk/news/technology-57332399,"Tesla failed to stop Musk tweets, says regulator",A court order requires the automotive giant's lawyers to pre-approve some of the CEO's tweets.,2021-06-02
18,0.5267,https://www.fool.com/investing/2021/06/02/why-chargepoint-stock-can-keep-winning-with-or-wit/,"Why ChargePoint Stock Can Keep Winning, With or Without Biden's Infrastructure Plan",The case for ChargePoint ahead of its first-quarter earnings announcement.,2021-06-02
19,0.7096,https://www.fool.com/investing/2021/06/02/2-top-stocks-you-can-buy-on-sale/,2 Top Stocks You Can Buy on Sale,Not all stocks are hitting new highs these days. Some great bargains are trading at least 30% below their recent peaks.,2021-06-02
20,-0.6369,https://www.businessinsider.com/tesla-elon-musk-tweets-sec-says-violated-court-order-markets-2021-6,The SEC told Tesla twice that Elon Musk's tweets violated court orders requiring preapproval from company lawyers (TSLA),"Summary List PlacementThe Securities and Exchange Commission told Tesla last year that CEO Elon Musk twice violated a court order requiring the company to preapprove his tweets, The Wall Street Journal reported Tuesday.
In 2018, Musk and Tesla reached an agre…",2021-06-02
21,0.1779,https://www.forbes.com/sites/greatspeculations/2021/06/02/after-nvidias-stock-split-announcement-are-adobe-alphabet-and-amazon-next/,"After Nvidia's Stock Split Announcement, Are Adobe, Alphabet And Amazon Next?","Nvidia (NVDA) stock rallied by almost 10% over the last week, after the company announced its first stock split in almost two decades. The stock is expected to trade on a split-adjusted basis from July 20. Now it's looking quite likely that we will see more h…",2021-06-02
22,0.8705,https://www.fool.com/investing/2021/06/02/3-bargain-stocks-you-can-buy-today/,3 Bargain Stocks You Can Buy Today,"Not all cheap stocks are necessarily worth owning, but a stock worth owning that's also cheap makes for a great buy.",2021-06-02
23,-0.5267,https://www.businessinsider.com/elon-musk-says-chip-shortage-is-like-toilet-paper-frenzy-2021-6,"Tesla CEO Elon Musk says the auto chip shortage is like the toilet paper frenzy last year, only worse (TSLA)","Summary List PlacementTesla CEO Elon Musk said the biggest issue the electric carmaker is facing is ongoing supply chain issues.
He pointed to the global shortage of semiconductor chips that have cost automakers billions this year.
""Never seen anything like i…",2021-06-02
24,-0.5423,https://www.forbes.com/sites/joewalsh/2021/06/01/sec-reportedly-warned-tesla-to-stop-letting-elon-musk-tweet-without-permission/,SEC Reportedly Warned Tesla To Stop Letting Elon Musk Tweet Without Permission,"Federal regulators faulted Musk for tweeting last year that Tesla’s share price was “too high imo,” the Wall Street Journal reported Tuesday.",2021-06-02
25,-0.5106,https://www.carscoops.com/2021/06/sec-alleges-that-tesla-failed-to-oversee-elon-musks-tweets-as-required-in-settlement/,SEC Alleges That Tesla Failed To Oversee Elon Musk’s Tweets As Required In Settlement,The SEC wrote in communications with the company that Tesla has abdicated the duties required of it by the court's order.,2021-06-02
26,0.0,https://www.barrons.com/articles/tesla-stock-elon-musk-51622642759,Tesla CEO Elon Musk Explains Price Increases. Hint: It Isn’t All Demand.,Tesla CEO Elon Musk explained in a tweet the reasons behind recent price increases for Tesla vehicles. The answer probably isn't what bullish investors wanted to hear.,2021-06-02
27,0.4404,https://www.thestreet.com/markets/5-things-you-must-know-before-market-opens-wednesday-060221,"BlackBerry, Amazon, Elon Musk, Splunk - 5 Things You Must Know Wednesday",Stock futures waver as investors look ahead to U.S. jobs data and remain concerned about rising inflation; BlackBerry shares soar; Amazon's Prime Day will be June 21-22.,2021-06-02
28,0.0,https://www.aljazeera.com/economy/2021/6/2/dogecoin-boosted-by-launch-of-coinbase-pro,Dogecoin surges after Coinbase launch news,Dogecoin vaulted more than 30 percent on Wednesday after Coinbase said it will make it available to users.,2021-06-02
29,-0.5574,https://finance.yahoo.com/news/tesla-recalls-nearly-6-000-102627072.html,"Tesla recalls nearly 6,000 U.S. cars over potentially loose bolts - Yahoo Finance","<ol><li>Tesla recalls nearly 6,000 U.S. cars over potentially loose bolts  Yahoo Finance
</li><li>Watch Parking Near Fremont With Hundreds of Refreshed Model S  Torque News
</li><li>View Full Coverage on Google News</li></ol>",2021-06-02
30,0.0,https://www.investors.com/market-trend/stock-market-today/dow-jones-rallies-as-amc-stock-soars-tesla-stock-slides-on-recall-zoom-video-reverses-on-earnings/,"Dow Jones Rallies As AMC Stock Soars 30%; Tesla Slides On Recall, Zoom Video Reverses On Earnings","The Dow Jones Industrial Average rallied 75 points Wednesday, as AMC stock soared as much as 30%. Zoom Video climbed on earnings results.",2021-06-02
31,0.0516,https://finance.yahoo.com/news/tesla-heads-biggest-drop-3-160725168.html,Tesla Heads for Biggest Drop in 3 Weeks on Market-Share Loss,"(Bloomberg) -- Tesla Inc. shares headed for their biggest decline in three weeks, sitting out the broader market’s gains, after electric-vehicle sales...",2021-06-02
32,0.0,https://www.bloomberg.com/news/newsletters/2021-06-02/bloomberg-s-evening-briefing-reddit-retail-traders-send-amc-soaring-95,Your Evening Briefing: AMC Is the New GameStop as Retail Traders Pounce,Get caught up.,2021-06-02
33,-0.4939,https://www.wsj.com/articles/dogecoin-price-jumps-on-coinbase-debut-prospect-11622633019,Dogecoin Price Jumps...,"Dogecoin Price Jumps...

 
 
 
 (First column, 5th story, link)

 

 

 
 Related stories:WSJ: Musk Tweets Violate SEC Agreement...",2021-06-02
34,0.3818,https://economictimes.indiatimes.com/markets/cryptocurrency/dogecoin-jumps-on-news-of-launch-on-coinbase-pro/articleshow/83183692.cms,Dogecoin jumps on news of launch on Coinbase Pro,"Coinbase said on Tuesday it will immediately accept inbound transfers of dogecoin Coinbase Pro, a trading venue for professional traders.",2021-06-02
35,0.743,https://finance.yahoo.com/news/amc-stock-will-fall-hard-because-the-company-isnt-changing-the-world-like-tesla-strategist-185421153.html,AMC stock will 'fall hard' because the company isn't changing the world like Tesla: strategist,Wall Street pros suggest retail traders need to be careful with shares of movie theater chain AMC after its latest one-day surge in value.,2021-06-02
36,-0.5994,https://news.yahoo.com/wsj-sec-says-elon-musk-030943372.html,WSJ: SEC accuses Elon Musk of violating settlement agreement with 2 tweets,"Securities regulators told Tesla Elon Musk twice violated court orders requiring company lawyers to approve his tweets before he posts, according to records ...",2021-06-02
37,-0.5106,https://www.moneycontrol.com/news/business/tesla-failed-to-oversee-elon-musks-tweets-us-sec-letters-claim-report-6975821.html,"Tesla failed to oversee Elon Musk#39;s tweets, US SEC letters claim: Report",The US SEC had earlier ordered Tesla to vet any public communications Musk made regarding the company.,2021-06-02
38,0.872,https://hypebeast.com/2021/6/nick-sisombath-1997-bmw-m3-e36-drivers,DRIVERS: Nick Sisombath and His 1997 BMW M3 E36,"DRIVERS is a series highlighting influential individuals in the HYPEBEAST sphere and their passion towards all things automotive. The approach is simple: what is car culture to you, and why do you have a passion for it? Each contributor is given a chance to s…",2021-06-02
39,0.0,https://finance.yahoo.com/news/too-buy-yandex-nv-yndx-165418632.html,Is It Too Late to Buy Yandex NV (YNDX) Stock?,"Polen Capital Management recently released its Q1 2021 Investor Letter, a copy of which you can download here. During the first quarter of 2021, the Polen...",2021-06-02
40,0.902,https://investorplace.com/2021/06/tsla-msft-leading-unicorns-but-more-large-cap-tech-magic-to-be-had/,TSLA and MSFT Are Tech’s Leading Unicorns. But There's More Large-Cap Magic to Be Had. - InvestorPlace,"The debate between growth and value investing rages on. But the stocks in between -- tech's ""mature unicorns"" -- are really winning this year.",2021-06-02
41,0.1749,https://www.investors.com/news/tesla-stock-elon-musk-off-the-hook-despite-sec-warnings/,"Elon Musk, Tesla Appear To Be Off The Hook Despite SEC Warnings: Report",Tesla's feud with the Securities and Exchange Commission over CEO Elon Musk's tweets appears to have ended in a stalemate. Tesla stock fell.,2021-06-02
42,0.875,https://qz.com/africa/2016030/the-coronavirus-pandemic-has-revealed-where-capitalism-fails/,The coronavirus pandemic has revealed capitalism’s greatest weakness,A new book by a South African academic describes inequality of opportunity as the greatest challenging facing the world right now.,2021-06-02
43,0.7783,https://www.investors.com/market-trend/stock-market-today/dow-jones-targets-new-high-as-stock-market-advance-moderna-leads-key-breakouts/,Dow Jones Erases 100-Point Gain As Market Falters; AMC Up 90% As Meme Stocks Soar - Investor's Business Daily,Dow Jones Erases 100-Point Gain As Market Falters; AMC Up 90% As Meme Stocks Soar  Investor's Business DailyView Full Coverage on Google News,2021-06-02
44,-0.5719,https://www.rt.com/usa/525475-elon-musk-chips-toilet-paper-shortage/,‘Like the toilet paper shortage’: Elon Musk compares microchip panic-buying to early pandemic rush to stock up on essentials,"Elon Musk has complained that a global chip shortage is disrupting Tesla’s supply chain, saying companies over-ordering microcontrollers is comparable to when people hoarded toilet paper in the early days of the pandemic. Read Full Article at RT.com",2021-06-02
45,-0.7269,https://www.breitbart.com/tech/2021/06/02/sec-tesla-failed-to-control-elon-musks-social-media-usage/,SEC: Tesla Failed to Control Elon Musk's Social Media Usage,"The SEC has reportedly told Tesla that the company violated a court-ordered policy to oversee tweets by CEO Elon Musk. According to a court decision, Musk's tweets about Tesla were supposed to be approved by a company lawyer, which Musk critics labeled his ""T…",2021-06-02
46,0.3818,https://www.barrons.com/articles/tesla-elon-musk-baby-shark-tweet-51622638343,Regulators Warned Tesla Over Musk’s Twitter. This Stock Just Moved After a New Tweet.,"Shares in Samsung Publishing rose after new tweets from Elon Musk, while crypto asset dogecoin soared after the CEO posted a related meme.",2021-06-02
47,0.0,https://www.cnn.com/business/live-news/stock-market-news-060221/index.html,US stock futures are flat as a pancake,Here's the latest news on what stocks are doing.,2021-06-02
48,0.0,https://techcrunch.com/2021/06/01/tesla-files-trademark-hinting-at-elon-musks-restaurant-concept-plans/,"Tesla files trademark, hinting at Elon Musk’s restaurant concept plans","Tesla has recently filed a new trademark for its brand under restaurant services, a sign the company might be finally gearing up to deliver on an idea that...",2021-06-02
49,0.0,https://finance.yahoo.com/news/too-buy-alibaba-group-holding-171154382.html,Is It Too Late to Buy Alibaba Group Holding (BABA) Stock?,"Polen Capital Management recently released its Q1 2021 Investor Letter, a copy of which you can download here. During the first quarter of 2021, the Polen...",2021-06-02
50,0.8658,https://finance.yahoo.com/news/10-best-pharmaceutical-stocks-buy-134006280.html,10 Best Pharmaceutical Stocks to Buy According to Cathie Wood,In this article we discuss the 10 best pharmaceutical stocks to buy according to Cathie Wood. If you want to skip our detailed analysis of Cathie Wood’s...,2021-06-02
51,0.0,https://www.forbes.com/sites/qai/2021/06/02/apple-and-facebook-among-todays-trending-stocks/,Apple And Facebook Among Today’s Trending Stocks,"Q.ai runs daily factor models to get the most up-to-date reading on stocks and ETFs. Today, our deep-learning algorithms have identified Apple and Facebook among others.",2021-06-02
52,-0.8934,https://finance.yahoo.com/news/elon-musks-reputation-hits-low-on-twitter-after-attacking-bitcoin-212836943.html,Elon Musk's reputation hits a low on Twitter after attacking bitcoin,"Since he attacked bitcoin in May, Elon Musk's sentiment on Twitter has fallen by about 25% on a relative basis to a new low.",2021-06-02
53,0.5423,https://www.independent.co.uk/life-style/gadgets-and-tech/musk-twitter-baby-shark-song-b1858438.html,Elon Musk’s ‘Baby Shark’ tweet boosts publisher’s share price by 10%,More than 8bn people have now watched the tune on YouTube,2021-06-02
54,0.8807,https://www.investors.com/market-trend/stock-market-today/dow-jones-futures-amc-stock-doubles-as-meme-stocks-rule-market-rally-tesla-stock-tests-support/,"Dow Jones Futures: AMC Nearly Doubles As Meme Stocks Rule Market Rally, But Here's A Winning Long-Term Strategy","Don't sleep on this market rally. AMC spiked 95% as meme stocks rule, but is it a winning strategy long term?",2021-06-02
55,0.0,https://seekingalpha.com/article/4432568-how-to-buy-stocks,How To Buy Stocks: A Guide For Beginner Investors,Wondering how to buy stocks? This is a normal question for new investors. Click here to learn what stocks are and what steps you should take to begin investing today.,2021-06-02
56,-0.4019,https://www.mediaite.com/news/sec-claims-elon-musk-violated-agreement-requiring-tesla-to-approve-his-tweets/,SEC Claims Elon Musk Violated Agreement Requiring Tesla to Approve His Tweets,"The Securities and Exchange Commission informed Tesla last year that CEO Elon Musk violated an agreement by failing to have company attorneys sign off on his Twitter commentary.
The post SEC Claims Elon Musk Violated Agreement Requiring Tesla to Approve His T…",2021-06-02
57,0.6486,https://www.kiplinger.com/investing/602903/electric-vehicle-ev-stocks-to-consider,Time to Buy the Dip in EV Stocks? Here's 7 to Consider,"If you're looking to gain exposure to electric vehicle stocks following their recent pullback, here are some names worth watching.",2021-06-02
58,0.7906,https://www.investors.com/news/amc-stock-tries-to-harness-new-superpower-tops-gamestop-stock-market-cap/,AMC Tries To Harness Its New Superpower As Market Cap Tops GameStop's,AMC will engage directly with its army of retail investors after the company raised more than $230 million from a stock sale to expand. AMC stock jumped.,2021-06-02
59,0.5667,https://www.cnbc.com/2021/06/02/what-to-watch-today-june-begins-with-muted-trading-on-wall-street.html,What to watch today: June begins with muted trading on Wall Street,U.S. stock futures were relatively flat after the Dow gave up most of a 300-point gain by Tuesday's close.,2021-06-02
60,0.7269,https://www.investors.com/news/price-of-dogecoin-jumps-coinbase-support/,Price Of Dogecoin Jumps As Joke Cryptocurrency Gets This Serious Support,The price of Dogecoin jumped Wednesday after cryptocurrency exchange Coinbase said the meme digital asset could begin trading on Thursday.,2021-06-02
61,0.0,https://finance.yahoo.com/news/consider-investing-signature-bank-sbny-161841416.html,Should You Consider Investing in Signature Bank (SBNY)?,"ClearBridge Investments, an investment management firm, published its “Value Equity Strategy” first quarter 2021 investor letter – a copy of which can be...",2021-06-02
62,0.4019,https://finance.yahoo.com/news/southwest-airlines-co-luv-smart-165834628.html,Is Southwest Airlines Co. (LUV) A Smart Long-Term Buy?,"ClearBridge Investments, an investment management firm, published its “Value Equity Strategy” first quarter 2021 investor letter – a copy of which can be...",2021-06-02
63,0.3818,https://finance.yahoo.com/news/why-clearbridge-disposed-mimecast-mime-162300114.html,Here’s Why ClearBridge Disposed its Mimecast (MIME) Stake,"ClearBridge Investments, an investment management firm, published its “SMID Cap Growth Strategy” first quarter 2021 investor letter – a copy of which can be ...",2021-06-02
64,0.3818,https://finance.yahoo.com/news/why-clearbridge-sold-biomarin-pharmaceutical-161950148.html,Here’s Why ClearBridge Sold its BioMarin Pharmaceutical (BMRN) Position,"ClearBridge Investments, an investment management firm, published its “SMID Cap Growth Strategy” first quarter 2021 investor letter – a copy of which can be ...",2021-06-02
65,0.3818,https://finance.yahoo.com/news/consider-investing-cloudera-cldr-162912498.html,Should You Consider Investing in Cloudera (CLDR)?,"ClearBridge Investments, an investment management firm, published its “SMID Cap Growth Strategy” first quarter 2021 investor letter – a copy of which can be ...",2021-06-02
66,0.6486,https://finance.yahoo.com/news/api-group-apg-smart-long-162113747.html,Is APi Group (APG) A Smart Long-Term Buy?,"ClearBridge Investments, an investment management firm, published its “SMID Cap Growth Strategy” first quarter 2021 investor letter – a copy of which can be ...",2021-06-02
67,0.6486,https://finance.yahoo.com/news/houlihan-lokey-hli-smart-long-163012806.html,Is Houlihan Lokey (HLI) A Smart Long-Term Buy?,"ClearBridge Investments, an investment management firm, published its “SMID Cap Growth Strategy” first quarter 2021 investor letter – a copy of which can be ...",2021-06-02
68,0.0,https://www.tweaktown.com/news/79745/sec-puts-elon-musk-in-hot-water-again-over-tweets-that-werent-vetted/index.html,SEC puts Elon Musk in hot water again over Tweets that weren't vetted,Elon Musk has been thrown back into hot water by the SEC after the regulatory agency says Musk has posted unvetted tweets. Continue reading at TweakTown >,2021-06-02
69,0.8658,https://finance.yahoo.com/news/10-best-cryptocurrencies-invest-according-163627560.html,10 Best Cryptocurrencies to Invest in According to Hedge Funds,"In this article we discuss the 10 best cryptocurrencies to invest in according to hedge funds. If you want to skip our detailed analysis of these currencies,...",2021-06-02
70,0.8173,https://www.investors.com/etfs-and-funds/sectors/amc-stock-five-investors-hit-billion-amc-stock-jackpot/,Five Investors Hit $2.3 Billion AMC Stock Jackpot,"What's more amazing than watching communication services AMC stock jump more than 1,400% in just five months? Making $2.3 billion on the gain.",2021-06-02
71,-0.7845,https://www.valuewalk.com/tesla-vehicle-recall-musk-sec/,Tesla recalls 6k vehicles as the spat between Elon Musk and the SEC continues,"Tesla Inc (NASDAQ:TSLA) has recalled almost 6,000 Model 3 and Model Y vehicles in the U.S. According to Reuters, the automaker warned in official documents that some brake caliper bolts could be loose, causing a loss of pressure. Q1 2021 hedge fund letters, c…",2021-06-02
