,Sentiment,URL,Title,Description,Date
82,0.886,https://www.kiplinger.com/investing/602940/best-green-energy-stocks-2021,The 7 Best Green Energy Stocks to Buy,Investments in green energy stocks are on the rise. These seven names could benefit from a long-term trend toward sustainability.,2021-06-21
83,-0.4019,https://nypost.com/2021/06/21/lordstown-motors-executives-sold-stock-before-reporting-financial-troubles/,"Lordstown Motors execs sold stock before financial results, troubles disclosed",Top executives at Lordstown Motors sold millions of dollars in shares of the company earlier this year before reporting financial results and disclosing trouble at the firm.,2021-06-21
84,-0.1027,https://www.newsbtc.com/crypto/elon-musk-go-to-prison/,Can Elon Musk Go To Prison For Manipulating Prices And Shilling Shitcoins?,"Elon Musk’s tweets have been a bone of contention for a while now. Every time the billionaire tweeted about a coin, the price of that coin skyrockets. The CEO of Tesla has been promoting coins that are fondly referred to as “shitcoins” on Twitter. Musk has st…",2021-06-21
85,0.9391,https://www.businesswire.com/news/home/20210621005051/en/Kantar-Economic-Optimism-Drives-Brand-Values-to-Record-Levels,Kantar: Economic Optimism Drives Brand Values to Record Levels,LONDON--(BUSINESS WIRE)-- #kantarbrandz--The world’s most valuable brands have experienced record growth according to the Kantar BrandZ Most Valuable Global Brands 2021 ranking.,2021-06-21
86,0.8625,https://finance.yahoo.com/news/richest-person-every-state-110044918.html,The Richest Person From Every State,"The United States is the richest country in the world with a GDP of over $22 trillion as of April 2021, according to IMF data. With so much wealth...",2021-06-21
87,0.0,https://www.consumerismcommentary.com/news/the-weekly-commentary-06-21-2021/,The Weekly Commentary – 06/21/2021,Keep yourself informed and up-to-date on everything there is to know about what's happening in the world and how it will affect your wallet.Keep yourself informed and up-to-date on everything there is to know about what's happening in the world and how it wil…,2021-06-21
88,0.6369,https://techcrunch.com/2021/06/21/the-station-waymo-nabs-more-capital-cruise-taps-a-5b-credit-line-and-hints-about-argos-future/,"The Station: Waymo nabs more capital, Cruise taps a $5B credit line and hints about Argo's future","This week, we published an interview with Refraction AI co-founder and CTO Matthew Johnson-Roberson as part of an ongoing series focused on transportation...",2021-06-21
89,-0.6249,https://jalopnik.com/lordstown-motors-executives-cashed-out-a-lot-of-stock-b-1847140374,Lordstown Motors Executives Cashed Out A Lot Of Stock Before The Doom: Report,"Executives at Lordstown Motors, the flailing electric truck startup, sold a lot of stock in February, according to a new report, not long before a short-seller issued a damning report on the company. Read more...",2021-06-21
90,-0.6486,https://www.dailymail.co.uk/news/article-9710389/Lordstown-dealt-blow-stock-selloff-five-executives-revealed.html,Lordstown dealt another blow after a stock selloff by five executives is revealed,Five top executives at troubled electric truck startup Lordstown Motors sold off their stock in the company ahead of the its poor first financial performance report since going public.,2021-06-21
91,0.2617,https://www.forbes.com/sites/georgecalhoun/2021/06/20/inflation--the-media-screams-but-the-market-is-unfazed/,"Inflation: The Media Screams, But The Market Is Unfazed","The media's inflation narrative is breaking down. The markets are voting for a return to normalcy, a strong recovery. So is the Fed. So are most economists. There will be some stress-points and bottlenecks, but no lurch back to the sustained inflation of the …",2021-06-21
92,0.0,https://seekingalpha.com/article/4435877-will-disney-stock-split,Will Disney Stock Split This Year?,The Walt Disney Company could consider another stock split to 'get more people in the stock.' Read more to see the possibility of another DIS stock split.,2021-06-21
93,0.3818,https://www.bloomberg.com/news/articles/2021-06-21/merkel-bloc-to-outline-program-to-counter-challenge-from-greens,"Merkel Bloc Pitches Stability, Growth to Check German Greens",Chancellor Angela Merkel’s conservative bloc is pitching itself as the guarantor of German stability and affluence as it seeks to retain control of Europe’s largest economy.,2021-06-21
94,0.9493,https://www.stuff.co.nz/motoring/125492803/five-things-the-best-clean-car-discount-deals,Five things: the best Clean Car Discount deals,"The Clean Car Discount scheme means there are now some truly decent electrified bargains around, so today we take a look at what we think are the five best deals.",2021-06-21
95,0.5789,https://www.thestar.com/business/thestreet/2021/06/21/teslas-profitability-and-the-surprising-thing-that-could-threaten-it.html,Tesla’s profitability and the surprising thing that could threaten it,"Rising competition in the electric vehicle space could not only put a crimp in Tesla’s growth rate, but diminish a big source of income as well.",2021-06-21
96,-0.4404,https://seekingalpha.com/article/4435786-plug-power-this-stock-fails-to-get-us-charged-up,Plug Power: This Stock Fails To Get Us Charged Up,"Plug Power, the producer of hydrogen fuel cell solutions, has had a turbulent history, with the stock trading at just a fraction of its 1999 tech boom price.",2021-06-21
97,0.2732,https://www.prnewswire.com/news-releases/thinking-about-trading-options-or-stock-in-amc-microstrategy-american-airlines-royal-caribbean-cruises-or-tesla-301316305.html,"Thinking about trading options or stock in AMC, MicroStrategy, American Airlines, Royal Caribbean Cruises, or Tesla?","NEW YORK, June 21, 2021 /PRNewswire/ -- InvestorsObserver issues critical PriceWatch Alerts for AMC, MSTR, AAL, RCL, and TSLA. Click a link below then choose between in-depth options trade idea report or a stock score report. Options Report – Ideal trade idea…",2021-06-21
98,0.836,https://seekingalpha.com/article/4435859-schd-vs-sdy-this-might-be-best-dividend-etf,SCHD Vs. SDY: This Might Be The Best Dividend ETF,SCHD has a better dividend yield. SDY holds higher graded dividend stocks. Which comes out on top?,2021-06-21
