,Sentiment,URL,Title,Description,Date
0,0.4215,https://insideevs.com/news/516842/tesla-25k-hot-hatch-2023/,"Report: $25,000 Tesla Hot Hatch Coming In 2023 To Rival VW ID.3 - InsideEVs","<ol><li>Report: $25,000 Tesla Hot Hatch Coming In 2023 To Rival VW ID.3  InsideEVs 
</li><li>In latest blow to Tesla, China orders safety fix to all its cars  Aljazeera.com
</li><li>Tesla to recall 285000 vehicles in China  CNBC Television
</li><li>Tesla M…",2021-06-28
1,0.7579,https://www.entrepreneur.com/article/375928,Tesla rebounds and Elon Musk adds $ 10 billion to his fortune in just one week,"Thanks to an electric vehicle infrastructure plan announced by US President Joe Biden, Tesla shares jumped 9%, immediately boosting Elon Musk's fortune.",2021-06-28
2,0.4404,https://www.fool.com/investing/2021/06/28/why-tesla-stock-jumped-on-monday/,Why Tesla Stock Jumped on Monday,Could the electric car maker's recall in China actually be a good thing?,2021-06-28
3,0.0,https://www.autoblog.com/2021/06/28/daimler-truck-spinoff/,Daimler on track to spin off its truck unit by the end of the year,"Filed under:
 Mercedes-Benz,Truck,Commercial Vehicles
 Continue reading Daimler on track to spin off its truck unit by the end of the year
Daimler on track to spin off its truck unit by the end of the year originally appeared on Autoblog on Mon, 28 Jun 2021 0…",2021-06-28
4,0.0,https://jalopnik.com/tesla-recalls-almost-every-car-it-has-sold-in-china-1847184724,Tesla Recalls Almost Every Car It Has Sold In China,"A regulator is actually regulating Tesla for once, Volvo, and VW’s internal-combustion engines get a sell-by date. All that and more in The Morning Shift for June 28, 2021.Read more...",2021-06-28
5,0.34,https://www.forbes.com/sites/greatspeculations/2021/06/28/what-are-the-catalysts-for-tesla-stocks-next-big-rally/,What Are The Catalysts For Tesla Stock’s Next Big Rally?,"Tesla stock has underperformed this year, declining by almost 10% year-to-date, compared to the S&P 500 which is up by over 15% this year. Even Ford and GM are up by about 80% and 50% respectively thus far in 2021. The underperformance comes as investors move…",2021-06-28
6,0.3182,https://www.investors.com/news/tesla-stock-rallies-despite-latest-black-eye-in-china-as-q2-deliveries-report-looms/,Tesla Rallies Despite Latest 'Black Eye' In China - Investor's Business Daily,"<ol><li>Tesla Rallies Despite Latest 'Black Eye' In China  Investor's Business Daily
</li><li>Tesla hits another 'bump in the road' in China with huge recall  CNN 
</li><li>Tesla Recalls Almost Every Car It Has Sold In China  Jalopnik
</li><li>BMW X7 vs. T…",2021-06-28
7,0.6369,https://www.thestreet.com/markets/5-things-you-must-know-before-market-opens-monday-062821,"Binance, Tesla, Boeing, Bed Bath & Beyond - 5 Things You Must Know","Stock futures waver after the S&P 500's best weekly performance since February; Tesla to recall 285,000 vehicles in China; Binance barred from operating in the U.K.",2021-06-28
8,0.3167,https://www.aljazeera.com/economy/2021/6/28/in-latest-blow-to-tesla-china-orders-safety-fix-to-all-its-cars,"In latest blow to Tesla, China orders safety fix to all its cars",China is Tesla's most important market after the US and this is its latest in a string of embarrassing setbacks there.,2021-06-28
9,-0.357,https://www.thestreet.com/jim-cramer/tesla-bellwether-for-high-growth-tech-stock-cramer-says,"Tesla Stock Remains Bellwether of High-Growth Tech, Jim Cramer Says - TheStreet",Jim Cramer explains why a software glitch hasn't shaken his confidence in Tesla stock.,2021-06-28
10,0.3612,https://www.thestreet.com/jim-cramer/cramers-mad-money-recap-june-28-2021,"Cramer's Mad Money Recap: Boeing, Intellia, Tesla","Jim Cramer says on days like this, investors are going after what's new or exciting, searching for what he calls 'coolness-per-share.'",2021-06-28
11,0.4019,https://finance.yahoo.com/news/bitcoin-acting-proxy-coin-stock-081603401.html,Bitcoin Acting as a Proxy for COIN Stock Movement,"As one of the stocks that provide investors with a sentiment gauge on cryptocurrencies markets, Coinbase (COIN) is an interesting case study to examine...",2021-06-28
12,0.765,https://www.wsj.com/articles/persistent-advance-in-stocks-and-commodities-shows-investor-confidence-11624819947,Persistent Advance in Stocks and Commodities Shows Investor Confidence - The Wall Street Journal,"<ol><li>Persistent Advance in Stocks and Commodities Shows Investor Confidence  The Wall Street Journal
</li><li>Stock futures are little changed as the S&P 500 looks to hold on to record  CNBC
</li><li>Stocks Gear Up for Monday After Record-Setting Perform…",2021-06-28
13,-0.2732,https://www.marketwatch.com/story/buy-these-stocks-as-s-p-500-heads-for-11-correction-and-bitcoin-risks-fall-to-12-000-say-strategists-11624879133,"Need to Know: Buy these stocks as S&P 500 heads for 11% correction and bitcoin risks fall to $12,000, say strategists.","Stocks are set for a mixed day ahead while crypto is surging, as even the slow days of summer trading continue to keep the black clouds away from financial markets. It may not last for long.",2021-06-28
14,0.1027,https://www.investors.com/market-trend/stock-market-today/dow-jones-futures-covid-fears-shake-up-market-rally-facebook-tops-1-trillion-tesla-rival-nio-flashes-buy-signal/,Dow Jones Futures: Covid Fears Shake Up Market Rally; Facebook Tops $1 Trillion; Tesla Rival Nio Flashes Buy Signal,Delta Covid fears shook up the market rally. Facebook topped $1 trillion on antitrust win. Nio leads new stocks in buy range.,2021-06-28
15,0.5994,https://medium.com/change-your-mind/the-reign-of-introverts-is-here-e713d5c774a6,The Reign of Introverts Is Here,"For the first time in human history, introverts have the advantage thanks to new careers, new modes of work, and new dating rules.",2021-06-28
16,0.4939,https://www.marketwatch.com/story/the-no-1-asset-in-my-portfolio-is-a-2017-hyundai-sonata-hybrid-some-americans-are-making-tidy-profits-selling-their-used-cars-11624902455,: ‘The No. 1 asset in my portfolio is a 2017 Hyundai Sonata Hybrid’: Some Americans are making tidy profits selling their used cars,"The average used vehicle cost an all-time high of $26,457 this month, according to Edmunds.com.",2021-06-28
17,0.7351,https://www.thestreet.com/jim-cramer/cramer-feds-are-fueling-infrastructure-tech-stocks,"Cramer: Feds Are Fueling Infrastructure, Tech Stocks - TheStreet","Cramer says this market action, supported by recent regulatory moves, are fueling gains for stocks like Lily, Caterpillar, Tesla and even the FAANG stocks",2021-06-28
18,0.8519,https://www.analyticsinsight.net/top-5-tech-stocks-to-buy-on-june-28/,Top 5 Tech Stocks to Buy on June 28 - Analytics Insight,Tech stocks are growing in popularity. Technology stocks have been in demand among stock investors. Buyers are looking for the best tech stocks to buy. Here is a list of the tech stocks to invest in today.,2021-06-28
19,0.4404,https://finance.yahoo.com/news/tesla-fixes-vehicle-safety-issue-085313833.html,Tesla Fixes Vehicle Safety Issue in China – Report,"Tesla (TSLA) has issued a software update to address a safety problem linked to the cruise-control system in its vehicles in China, according to a Wall...",2021-06-28
20,-0.3612,https://www.bbc.co.uk/news/business-57466918,Why small investors are piling into share-trading apps,"A boom in cheaper trading is tempting some inexperienced investors to take big risks, warn experts.",2021-06-28
21,0.0,https://finance.yahoo.com/news/options-traders-speculate-surging-tesla-164020937.html,Options Traders Speculate on Surging Tesla Competitor,NIO weekly options are being scooped up at a rapid clip,2021-06-28
22,0.7783,https://www.bloomberg.com/news/newsletters/2021-06-28/money-stuff-investors-will-buy-anything-now,Money Stuff: Investors Will Buy Anything Now,A model of corporate finance  that I like and find helpful goes like this:,2021-06-28
23,-0.1027,https://www.forbes.com/sites/jonathanponciano/2021/06/28/sp-500-nasdaq-hit-new-record-highs-as-experts-warn-about-absurd-investor-expectations/,"S&P 500, Nasdaq Hit New Record Highs As Experts Warn About 'Absurd' Investor Expectations",Individual investors expect a 17.5% long-term return—more than double what financial professionals say is realistic.,2021-06-28
24,0.5267,https://www.forbes.com/sites/brendanahern/2021/06/28/growth-rebound-didi-may-price-at-top-of-range/,"Growth Rebound, Didi May Price At Top Of Range",Key News Asia had a mixed night as Pakistan underperformed following MSCI’s announcement last week that the country would be downgraded out of its emerging markets index.,2021-06-28
25,0.2449,https://finance.yahoo.com/news/the-company-tesla-booted-from-the-sp-500-is-outperforming-it-over-50-202435898.html,The company Tesla booted from the S&P 500 is outperforming it,"Index investors often buy high and sell low, at least in the near-term. And for Tesla's entry to the S&P 500, that especially held true.",2021-06-28
26,0.0,https://finance.yahoo.com/news/constellium-se-cstm-hedge-funds-183454262.html,Constellium SE (CSTM): Are Hedge Funds Right About This Stock?,"The latest 13F reporting period has come and gone, and Insider Monkey is again at the forefront when it comes to making use of this gold mine of data...",2021-06-28
27,0.7964,https://finance.yahoo.com/news/mastec-inc-mtz-good-stock-180758767.html,"Is MasTec, Inc. (MTZ) A Good Stock To Buy?",With the first-quarter round of 13F filings behind us it is time to take a look at the stocks in which some of the best money managers in the world preferred...,2021-06-28
28,0.6369,https://finance.yahoo.com/news/points-international-ltd-pcom-good-182654019.html,Is Points International Ltd (PCOM) A Good Stock To Buy?,We at Insider Monkey have gone over 866 13F filings that hedge funds and prominent investors are required to file by the SEC. The 13F filings show the funds’...,2021-06-28
29,0.875,https://finance.yahoo.com/news/moderna-inc-mrna-good-stock-133143273.html,"Is Moderna, Inc. (MRNA) A Good Stock To Buy?","In this article we will analyze whether Moderna, Inc. (NASDAQ:MRNA) is a good investment right now by following the lead of some of the best investors in the...",2021-06-28
30,0.7506,https://finance.yahoo.com/news/rattler-midstream-lp-rtlr-good-170505600.html,Is Rattler Midstream LP (RTLR) A Good Stock To Buy?,"Our extensive research has shown that imitating the smart money can generate significant returns for retail investors, which is why we track nearly 900...",2021-06-28
31,0.7003,https://finance.yahoo.com/news/herbalife-nutrition-ltd-hlf-good-140707241.html,Is Herbalife Nutrition Ltd. (HLF) A Good Stock To Buy?,In this article we will analyze whether Herbalife Nutrition Ltd. (NYSE:HLF) is a good investment right now by following the lead of some of the best...,2021-06-28
32,0.7003,https://finance.yahoo.com/news/yumanity-therapeutics-inc-ymtx-good-191525726.html,"Is Yumanity Therapeutics, Inc. (YMTX) A Good Stock To Buy?","In this article we will analyze whether Yumanity Therapeutics, Inc. (NASDAQ:YMTX) is a good investment right now by following the lead of some of the best...",2021-06-28
33,0.7269,https://finance.yahoo.com/news/brooge-energy-limited-brog-good-174856738.html,Is Brooge Energy Limited (BROG) A Good Stock To Buy?,"While the market driven by short-term sentiment influenced by the accommodative interest rate environment in the US, virus news and stimulus spending, many...",2021-06-28
34,0.9054,https://finance.yahoo.com/news/iovance-biotherapeutics-inc-iova-good-191916819.html,"Is Iovance Biotherapeutics, Inc. (IOVA) A Good Stock To Buy?","Is Iovance Biotherapeutics, Inc. (NASDAQ:IOVA) a good place to invest some of your money right now? We can gain invaluable insight to help us answer that...",2021-06-28
35,0.2682,https://finance.yahoo.com/news/olin-corporation-oln-hedge-funds-120909172.html,Olin Corporation (OLN): Are Hedge Funds Right About This Stock?,"Out of thousands of stocks that are currently traded on the market, it is difficult to identify those that will really generate strong returns. Hedge funds...",2021-06-28
36,0.6369,https://finance.yahoo.com/news/pvh-corp-pvh-good-stock-120906621.html,Is PVH Corp (PVH) A Good Stock To Buy?,We at Insider Monkey have gone over 866 13F filings that hedge funds and prominent investors are required to file by the SEC. The 13F filings show the funds’...,2021-06-28
37,0.8807,https://finance.yahoo.com/news/regeneron-pharmaceuticals-inc-regn-good-132500455.html,Is Regeneron Pharmaceuticals Inc (REGN) A Good Stock To Buy?,Insider Monkey has processed numerous 13F filings of hedge funds and successful value investors to create an extensive database of hedge fund holdings. The...,2021-06-28
38,0.7964,https://finance.yahoo.com/news/agile-therapeutics-inc-agrx-good-174832810.html,Is Agile Therapeutics Inc (AGRX) A Good Stock To Buy?,"As we already know from media reports and hedge fund investor letters, hedge funds delivered their best returns in a decade. Most investors who decided to...",2021-06-28
39,0.6096,https://finance.yahoo.com/news/tracon-pharmaceuticals-inc-tcon-good-170454172.html,Is TRACON Pharmaceuticals Inc (TCON) A Good Stock To Buy?,"Out of thousands of stocks that are currently traded on the market, it is difficult to identify those that will really generate strong returns. Hedge funds...",2021-06-28
40,0.8225,https://finance.yahoo.com/news/spark-networks-se-lov-good-171122602.html,Is Spark Networks SE (LOV) A Good Stock To Buy?,In this article we will check out the progression of hedge fund sentiment towards Spark Networks SE (NYSE:LOV) and determine whether it is a good investment ...,2021-06-28
41,0.7003,https://finance.yahoo.com/news/logicbio-therapeutics-inc-logc-good-171116362.html,"Is LogicBio Therapeutics, Inc. (LOGC) A Good Stock To Buy?","In this article we will analyze whether LogicBio Therapeutics, Inc. (NASDAQ:LOGC) is a good investment right now by following the lead of some of the best...",2021-06-28
42,0.5719,https://finance.yahoo.com/news/galiano-gold-inc-gau-good-182711895.html,Is Galiano Gold Inc. (GAU) A Good Stock To Buy?,"At Insider Monkey, we pore over the filings of nearly 866 top investment firms every quarter, a process we have now completed for the latest reporting period...",2021-06-28
43,0.6096,https://finance.yahoo.com/news/msci-inc-msci-good-stock-122001248.html,Is MSCI Inc (MSCI) A Good Stock To Buy?,"Out of thousands of stocks that are currently traded on the market, it is difficult to identify those that will really generate strong returns. Hedge funds...",2021-06-28
44,0.6096,https://finance.yahoo.com/news/weyerhaeuser-co-wy-good-stock-121954870.html,Is Weyerhaeuser Co. (WY) A Good Stock To Buy?,"Out of thousands of stocks that are currently traded on the market, it is difficult to identify those that will really generate strong returns. Hedge funds...",2021-06-28
45,0.8625,https://finance.yahoo.com/news/kinder-morgan-inc-kmi-good-130520285.html,Is Kinder Morgan Inc (KMI) A Good Stock To Buy?,"Our extensive research has shown that imitating the smart money can generate significant returns for retail investors, which is why we track nearly 900...",2021-06-28
46,0.4404,https://finance.yahoo.com/news/hostess-brands-inc-twnk-good-130517813.html,"Is Hostess Brands, Inc. (TWNK) A Good Stock To Buy?","The latest 13F reporting period has come and gone, and Insider Monkey is again at the forefront when it comes to making use of this gold mine of data. We...",2021-06-28
47,0.4404,https://finance.yahoo.com/news/northwest-pipe-company-nwpx-good-174859051.html,Is Northwest Pipe Company (NWPX) A Good Stock To Buy?,After several tireless days we have finished crunching the numbers from nearly 900 13F filings issued by the elite hedge funds and other investment firms...,2021-06-28
48,0.7003,https://finance.yahoo.com/news/northfield-bancorp-inc-nfbk-good-174839790.html,Is Northfield Bancorp Inc (NFBK) A Good Stock To Buy?,In this article we will take a look at whether hedge funds think Northfield Bancorp Inc (NASDAQ:NFBK) is a good investment right now. We check hedge fund and...,2021-06-28
49,0.7351,https://finance.yahoo.com/news/kroger-co-kr-good-stock-180737436.html,Is The Kroger Co. (KR) A Good Stock To Buy?,"We know that hedge funds generate strong, risk-adjusted returns over the long run, therefore imitating the picks that they are collectively bullish on can be...",2021-06-28
50,0.6478,https://www.barrons.com/articles/after-facebooks-surge-there-are-now-5-tech-stocks-worth-at-least-1-trillion-51624922591,5 Tech Stocks Are Now Worth at Least $1 Trillion - Barron's,"Apple is still the world's most valuable company, with a market cap of $2.2 trillion. After rallying Monday, Facebook joined the trillion-dollar club.",2021-06-28
51,0.3612,https://finance.yahoo.com/news/hedge-funds-buying-jefferies-financial-121957848.html,Hedge Funds Are Buying Jefferies Financial Group Inc. (JEF),"Before we spend countless hours researching a company, we like to analyze what insiders, hedge funds and billionaire investors think of the stock first. This...",2021-06-28
52,0.3612,https://finance.yahoo.com/news/hedge-funds-never-bullish-wix-135546546.html,Hedge Funds Have Never Been This Bullish On Wix.Com Ltd (WIX),"Before we spend countless hours researching a company, we like to analyze what insiders, hedge funds and billionaire investors think of the stock first. This...",2021-06-28
53,0.7717,https://finance.yahoo.com/news/hedge-funds-love-formula-one-191913939.html,Do Hedge Funds Love Formula One Group (FWONK)?,"Before we spend countless hours researching a company, we like to analyze what insiders, hedge funds and billionaire investors think of the stock first. This...",2021-06-28
54,0.3612,https://finance.yahoo.com/news/hedge-funds-think-lincoln-national-120249084.html,Here is What Hedge Funds Think About Lincoln National Corporation (LNC),"Before we spend countless hours researching a company, we like to analyze what insiders, hedge funds and billionaire investors think of the stock first. This...",2021-06-28
55,-0.3182,https://finance.yahoo.com/news/hedge-funds-dumping-bioxcel-therapeutics-191518880.html,"Hedge Funds Are Dumping BioXcel Therapeutics, Inc. (BTAI)","How do you pick the next stock to invest in? One way would be to spend days of research browsing through thousands of publicly traded companies. However, an ...",2021-06-28
56,0.0772,https://finance.yahoo.com/news/avoid-atn-international-inc-atni-170449319.html,"Should I Avoid ATN International, Inc. (ATNI)?","Before we spend countless hours researching a company, we like to analyze what insiders, hedge funds and billionaire investors think of the stock first. This...",2021-06-28
57,0.0,https://finance.yahoo.com/news/hedge-funds-selling-corteva-inc-194746617.html,"Hedge Funds Are Selling Corteva, Inc. (CTVA)","How do you pick the next stock to invest in? One way would be to spend days of research browsing through thousands of publicly traded companies. However, an ...",2021-06-28
58,0.5859,https://finance.yahoo.com/news/duke-energy-corporation-duk-fell-132433894.html,Duke Energy Corporation (DUK) Fell Out Of Favor With Hedge Funds,"How do you pick the next stock to invest in? One way would be to spend days of research browsing through thousands of publicly traded companies. However, an ...",2021-06-28
59,-0.3736,https://finance.yahoo.com/news/avoid-nvr-inc-nvr-132451510.html,"Should I Avoid NVR, Inc. (NVR)?","How do you pick the next stock to invest in? One way would be to spend days of research browsing through thousands of publicly traded companies. However, an ...",2021-06-28
60,0.3612,https://finance.yahoo.com/news/cm-life-sciences-inc-cmlfu-174842560.html,"Is CM Life Sciences, Inc. (CMLFU) Going to Burn These Hedge Funds?","Before we spend countless hours researching a company, we like to analyze what insiders, hedge funds and billionaire investors think of the stock first. This...",2021-06-28
61,-0.1779,https://seekingalpha.com/article/4436967-daimler-stock-bear-case-with-30-percent-downside,Daimler: Bear Case With 30% Downside,"Daimler has set itself up for a narrow strike zone, aiming to cut R&D and Capex while having to innovate in an increasingly competitive industry. DCF analysis indicates 30% downside.",2021-06-28
62,0.7003,https://finance.yahoo.com/news/norwegian-cruise-line-holdings-ltd-132440887.html,Is Norwegian Cruise Line Holdings Ltd (NCLH) A Good Stock To Buy?,In this article we will take a look at whether hedge funds think Norwegian Cruise Line Holdings Ltd (NASDAQ:NCLH) is a good investment right now. We check...,2021-06-28
63,0.4404,https://finance.yahoo.com/news/yum-china-holdings-inc-yumc-120912361.html,"Is Yum China Holdings, Inc. (YUMC) A Good Stock To Buy?",The Insider Monkey team has completed processing the quarterly 13F filings for the March quarter submitted by the hedge funds and other money managers...,2021-06-28
64,0.8481,https://finance.yahoo.com/news/gran-tierra-energy-inc-gte-174836471.html,Is Gran Tierra Energy Inc. (GTE) A Good Stock To Buy?,"As we already know from media reports and hedge fund investor letters, hedge funds delivered their best returns in a decade. Most investors who decided to...",2021-06-28
65,0.4404,https://finance.yahoo.com/news/computer-task-group-inc-ctg-182707186.html,"Is Computer Task Group, Inc. (CTG) A Good Stock To Buy?","In this article we will check out the progression of hedge fund sentiment towards Computer Task Group, Inc. (NASDAQ:CTG) and determine whether it is a good...",2021-06-28
66,0.6369,https://finance.yahoo.com/news/westinghouse-air-brake-technologies-corporation-141302683.html,Is Westinghouse Air Brake Technologies Corporation (WAB) A Good Stock To Buy?,We at Insider Monkey have gone over 866 13F filings that hedge funds and prominent investors are required to file by the SEC. The 13F filings show the funds’...,2021-06-28
67,0.8541,https://finance.yahoo.com/news/lamb-weston-holdings-inc-lw-183458548.html,"Lamb Weston Holdings, Inc. (LW): Are Hedge Funds Right About This Stock?","Is Lamb Weston Holdings, Inc. (NYSE:LW) a good place to invest some of your money right now? We can gain invaluable insight to help us answer that question...",2021-06-28
68,0.8271,https://finance.yahoo.com/news/brookfield-asset-management-inc-bam-120903541.html,Is Brookfield Asset Management Inc. (BAM) A Good Stock To Buy?,"We know that hedge funds generate strong, risk-adjusted returns over the long run, therefore imitating the picks that they are collectively bullish on can be...",2021-06-28
69,0.8611,https://finance.yahoo.com/news/loma-negra-compania-industrial-argentina-170501105.html,Is Loma Negra Compania Industrial Argentina Sociedad Anonima (LOMA) A Good Stock To Buy?,Is Loma Negra Compania Industrial Argentina Sociedad Anonima (NYSE:LOMA) a good place to invest some of your money right now? We can gain invaluable insight ...,2021-06-28
70,0.0,https://finance.yahoo.com/news/enable-midstream-partners-lp-enbl-182641247.html,Enable Midstream Partners LP (ENBL): Are Hedge Funds Right About This Stock?,"The latest 13F reporting period has come and gone, and Insider Monkey is again at the forefront when it comes to making use of this gold mine of data...",2021-06-28
71,0.0,https://www.cnbc.com/2021/06/28/what-to-watch-today-sp-500-looks-to-add-to-friday-record-high-close.html,What to watch today: S&P 500 looks to add to Friday's record high close,U.S stock futures were mixed after the S&P 500 closed at another record high Friday.,2021-06-28
72,0.0,https://finance.yahoo.com/news/where-hedge-funds-stand-crescent-171109324.html,"Where Do Hedge Funds Stand On Crescent Capital BDC, Inc. (CCAP)?","The latest 13F reporting period has come and gone, and Insider Monkey is again at the forefront when it comes to making use of this gold mine of data...",2021-06-28
73,0.7783,https://finance.yahoo.com/news/hedge-funds-never-bullish-mgm-132436341.html,Hedge Funds Have Never Been This Bullish On MGM Growth Properties LLC (MGP),"As we already know from media reports and hedge fund investor letters, hedge funds delivered their best returns in a decade. Most investors who decided to...",2021-06-28
74,0.3182,https://finance.yahoo.com/news/where-hedge-funds-stand-stonemor-155149759.html,Where Do Hedge Funds Stand On StoneMor Inc. (STON)?,We at Insider Monkey have gone over 866 13F filings that hedge funds and prominent investors are required to file by the SEC. The 13F filings show the funds’...,2021-06-28
75,0.3612,https://finance.yahoo.com/news/where-hedge-funds-stand-vontier-122005602.html,Where Do Hedge Funds Stand On Vontier Corporation (VNT)?,A whopping number of 13F filings filed with U.S. Securities and Exchange Commission has been processed by Insider Monkey so that individual investors can...,2021-06-28
76,0.8541,https://finance.yahoo.com/news/equifax-inc-efx-going-burn-180747293.html,Is Equifax Inc. (EFX) Going to Burn These Hedge Funds?,Is Equifax Inc. (NYSE:EFX) a good place to invest some of your money right now? We can gain invaluable insight to help us answer that question by studying...,2021-06-28
77,0.6369,https://finance.yahoo.com/news/hedge-funds-think-northrop-grumman-135557381.html,Here is What Hedge Funds Think About Northrop Grumman Corporation (NOC),"As we already know from media reports and hedge fund investor letters, hedge funds delivered their best returns in a decade. Most investors who decided to...",2021-06-28
78,-0.0772,https://finance.yahoo.com/news/stealthgas-inc-gass-hedge-funds-174903665.html,StealthGas Inc. (GASS): Hedge Funds In Wait-and-See Mode,"Many prominent investors, including Warren Buffett, David Tepper and Stan Druckenmiller, have been cautious regarding the current bull market and missed out ...",2021-06-28
