,Sentiment,URL,Title,Description,Date
72,0.4497,https://investorplace.com/2021/06/crypto-rumors-pltr-stock-wont-help-fundamentals/,Crypto Rumors Could Bump Palantir Stock but Won’t Help Its Fundamentals,"Meme status is a terrible reason for buying PLTR stock Q1 2021 hedge fund letters, conferences and more The meme stock rally is in full force right now, and as investors in Palantir Technologies (NYSE:PLTR) stock have seen, retail investor support is everythi…",2021-06-02
73,0.6249,https://observer.com/2021/06/elon-musk-managed-to-violate-teslas-sec-settlement-agreement-with-just-two-tweets/,Elon Musk Managed to Violate Tesla’s SEC Settlement Agreement With Just Two Tweets,Here’s a great financial tip for billionaire Elon Musk: Just log off.,2021-06-02
74,-0.4215,https://arstechnica.com/tech-policy/2021/06/sec-is-struggling-to-rein-in-elon-musks-tweets-letters-reveal/,"SEC struggling to rein in Elon Musk’s tweets, letters reveal",Regulator concerned that Tesla's lawyers were not reviewing CEO's tweets.,2021-06-02
75,-0.7994,https://siliconangle.com/2021/06/02/elon-musk-twice-violated-court-order-not-tweet-tesla-business-online-without-approval/,Elon Musk twice violated court order not to tweet about Tesla business online without approval,"Tesla Inc. Chief Executive Elon Musk twice violated a court order which said his tweets should be vetted before he hit the button, The Wall Street Journal reported today. The Securities and Exchange Commission and the sometimes trigger-happy Musk had made an …",2021-06-02
76,-0.0498,https://www.shtfplan.com/headline-news/go-to-the-stores-and-stock-up-now-because-things-are-about-to-get-really-crazy,Go To The Stores And Stock Up Now Because Things Are About To Get Really Crazy,"If there are things that you need to stock up on, you should do it right away.  For weeks, I have been writing articles about the rampant inflation that we are witnessing right now.  We haven’t seen anything like this since the Jimmy Carter era of the 1970s, …",2021-06-02
77,-0.7783,https://nypost.com/2021/06/02/elon-musks-tesla-tweets-violated-sec-settlement-report/,Elon Musk’s Tesla tweets violated SEC settlement: report,US regulators alerted Tesla last year that Elon Musk’s use of Twitter had twice violated a court-ordered policy that required company lawyers to pre-approve some of his tweets.,2021-06-02
78,-0.8519,http://www.hideoutnow.com/2021/06/elon-musk-twice-violated-sec-court.html,"Elon Musk TWICE violated SEC court order requiring Tesla to review his tweets following $20m fraud settlement, records reveal","Regulators at the Securities and Exchange Commission said Tesla had twice failed to review Chief Executive Officer Elon Musk's tweets as required in a 2018 settlement, emails have revealed.",2021-06-02
79,0.0,https://www.investmentwatchblog.com/doge-is-skyrocketing-again-after-elon-tweet/,DOGE is SKYROCKETING again after ELON TWEET,,2021-06-02
80,-0.128,https://www.newsweek.com/male-millennials-dominate-crypto-investing-elon-musk-tweets-getting-sec-attention-1596988,Male Millennials Dominate Crypto Investing; Elon Musk Tweets Getting SEC Attention,"Males outnumber females about 86% to 14% in the crypto market, while millennials, ages 25 to 35, make up 41.5% of Bitcoin investors. Meanwhile, Elon Musk keeps tweeting, and the SEC is taking notice.",2021-06-02
81,0.7579,https://www.fool.com/investing/2021/06/02/8-ways-to-rescue-your-retirement/,8 Ways to Rescue Your Retirement,Advice on how you can optimize your finances and accelerate your savings.,2021-06-02
82,0.5267,https://www.business-standard.com/article/international/elon-musk-s-baby-shark-tweet-sends-shares-of-samsung-publishing-soaring-121060200214_1.html,Elon Musk's 'Baby Shark' tweet sends shares of publishing firm soaring,Shares in the Seoul-based company that owns 19.43% in the song's producer SmartStudy Co. climbed as much as 10%,2021-06-02
83,0.4215,https://www.carandbike.com/news/u-s-securities-watchdog-letters-claim-tesla-failed-to-oversee-musks-tweets-report-2454358,U.S. Securities Watchdog Letters Claim Tesla Failed To Oversee Musk's Tweets: Report,"The U.S. Securities and Exchange Commission had ordered the electric car maker to vet any material public communications Musk made regarding Tesla, following Musk's August 2018 tweet that he had ""funding secured"" to possibly take Tesla private in a $72 billio…",2021-06-02
84,-0.0,https://www.livemint.com/companies/news/tesla-shares-drop-most-in-three-weeks-on-market-share-loss-11622677750899.html,Tesla shares drop most in three weeks on market-share loss,"The shares fell as much as 4% in New York on Wednesday, before closing down 3%, restraining the advance in the S&amp;P 500 Index. It was the stock’s biggest one-day decline since May 13.",2021-06-02
85,-0.872,https://www.autoblog.com/2021/06/02/elon-musk-tweets-not-preapproved-sec/,SEC letters say Tesla failed to oversee Musk's tweets as ordered,"Filed under:
Government/Legal,Green,Tesla

Continue reading SEC letters say Tesla failed to oversee Musk's tweets as ordered

SEC letters say Tesla failed to oversee Musk's tweets as ordered originally appeared on Autoblog on Wed, 2 Jun 2021 08:55:00 EDT. Ple…",2021-06-02
86,0.0,https://www.valuewalk.com/high-beta-hotties-come-back-down-earth/,High-Beta Hotties Come Back Down To Earth,"In his Daily Market Notes report to investors, while commenting on high-beta hotties, Louis Navellier wrote: Q1 2021 hedge fund letters, conferences and more More Fed Officials are Talking about “Tapering” Due to the surge in inflation and other indicators of…",2021-06-02
87,0.3818,https://www.newyorker.com/news/annals-of-a-warming-planet/automakers-start-to-figure-out-the-climate-future,Automakers Start to Figure Out the Climate Future,"Bill McKibben writes about the rollout of the new electric Ford F-150 and about the continued reticence of investment managers to make a clear break from fossil fuels. He also interviews Ana Teresa Fernández, an artist specializing in “social sculpture.”",2021-06-02
88,0.3612,https://www.cnbc.com/2021/06/02/nio-stock-outpaces-tesla-in-past-month-two-traders-on-which-has-edge.html,"Nio and other EV players outpace Tesla in past month, but market strategist says industry leader still holds advantage",The electric vehicle space is getting crowded and Tesla has recently been left behind.,2021-06-02
89,0.3597,https://cleantechnica.com/2021/06/02/jeep-wrangler-4xe-first-impressions-it-does-what-no-other-electrified-vehicle-can-do-review/,Jeep Wrangler 4xe First Impressions: It Does What No Other Electrified Vehicle Can Do (Review),"Today, Stellantis (the company formerly known as Fiat-Chrysler before a merger with Peugeot) sent me something really cool to review: a 2021 Jeep Wrangler 4xe (pronounced “four by E”), in Rubicon trim. Like many readers, I was skeptical, too. The vehicle only…",2021-06-02
90,-0.0258,https://www.independent.co.uk/life-style/gadgets-and-tech/tesla-elon-musk-tweets-sec-b1857934.html,"Tesla failed to oversee Elon Musk’s tweets as agreed in SEC settlement, report says",Electric car company had agreed to social media policy as part of SEC settlement,2021-06-02
91,0.296,https://nypost.com/2021/06/02/dogecoin-soars-as-coinbase-adds-token-to-platform-elon-musk-posts-meme/,Dogecoin soars as crypto-giant Coinbase adds token to platform,Dogecoin prices skyrocketed on Wednesday after crypto-trading giant Coinbase said it would start allowing users to trade the joke cryptocurrency on its platform.,2021-06-02
92,0.0516,https://www.cnbc.com/2021/06/02/tesla-faces-pressure-as-ev-competition-heats-up-ex-ford-ceo-says.html,"Tesla faces pressure as EV competition heats up, ex-Ford CEO says","Elon Musk pushed the auto industry to adopt electric vehicles, but the shift has since turned into a major challenge for Tesla, ex-Ford CEO Mark Fields said.",2021-06-02
93,-0.7003,https://www.livemint.com/companies/news/tesla-failed-to-oversee-elon-musk-s-tweets-sec-argued-in-letters-11622638217522.html,"Tesla failed to oversee Elon Musk’s tweets, SEC argued in letters","SEC said Musk flouted court-ordered policy in 2019 and 2020, records show",2021-06-02
94,0.5859,https://seekingalpha.com/article/4432647-clean-edge-green-energy-etf-a-long-term-bet,Clean Edge Green Energy ETF: A Long-Term Bet,"Even after dropping 30% from all-time highs, the ETF has still mightily outperformed the broader stock market.",2021-06-02
