,Sentiment,URL,Title,Description,Date
80,0.5423,https://finance.yahoo.com/news/were-hedge-funds-franchise-group-172324625.html,"Were Hedge Funds Right About Franchise Group, Inc. (FRG)?","Our extensive research has shown that imitating the smart money can generate significant returns for retail investors, which is why we track nearly 900...",2021-07-30
81,-0.4215,https://finance.yahoo.com/news/were-hedge-funds-modine-manufacturing-161612617.html,Were Hedge Funds Right About Modine Manufacturing Company (MOD)?,Last year we predicted the arrival of the first US recession since 2009 and we told in advance that the market will decline by at least 20% in (Recession is ...,2021-07-30
82,0.2682,https://finance.yahoo.com/news/were-hedge-funds-choice-hotels-154621011.html,"Were Hedge Funds Right About Choice Hotels International, Inc. (CHH)?","Out of thousands of stocks that are currently traded on the market, it is difficult to identify those that will really generate strong returns. Hedge funds...",2021-07-30
83,0.0,https://finance.yahoo.com/news/were-hedge-funds-sonic-automotive-162430562.html,Were Hedge Funds Right About Sonic Automotive Inc (SAH)?,After several tireless days we have finished crunching the numbers from nearly 900 13F filings issued by the elite hedge funds and other investment firms...,2021-07-30
84,0.4588,https://finance.yahoo.com/news/were-hedge-funds-m-homes-162425716.html,Were Hedge Funds Right About M/I Homes Inc (MHO)?,"While the market driven by short-term sentiment influenced by the accommodative interest rate environment in the US, virus news and stimulus spending, many...",2021-07-30
85,0.6369,https://finance.yahoo.com/news/were-hedge-funds-fulcrum-therapeutics-151429302.html,"Were Hedge Funds Right About Fulcrum Therapeutics, Inc. (FULC)?","As we already know from media reports and hedge fund investor letters, hedge funds delivered their best returns in a decade. Most investors who decided to...",2021-07-30
86,0.5106,https://finance.yahoo.com/news/were-hedge-funds-kimco-realty-151459145.html,Were Hedge Funds Right About Kimco Realty Corp (KIM)?,"We know that hedge funds generate strong, risk-adjusted returns over the long run, therefore imitating the picks that they are collectively bullish on can be...",2021-07-30
87,0.2682,https://finance.yahoo.com/news/were-hedge-funds-magenta-therapeutics-151455647.html,"Were Hedge Funds Right About Magenta Therapeutics, Inc. (MGTA)?","Out of thousands of stocks that are currently traded on the market, it is difficult to identify those that will really generate strong returns. Hedge funds...",2021-07-30
88,0.7269,https://finance.yahoo.com/news/were-hedge-funds-harmonic-inc-140529132.html,Were Hedge Funds Right About Harmonic Inc (HLIT)?,"We know that hedge funds generate strong, risk-adjusted returns over the long run, therefore imitating the picks that they are collectively bullish on can be...",2021-07-30
89,0.5423,https://finance.yahoo.com/news/were-hedge-funds-mbia-inc-140531636.html,Were Hedge Funds Right About MBIA Inc. (MBI)?,"Our extensive research has shown that imitating the smart money can generate significant returns for retail investors, which is why we track nearly 900...",2021-07-30
90,-0.3182,https://finance.yahoo.com/news/were-hedge-funds-dumping-universal-172315252.html,Were Hedge Funds Right About Dumping Universal Display Corporation (OLED)?,After several tireless days we have finished crunching the numbers from nearly 900 13F filings issued by the elite hedge funds and other investment firms...,2021-07-30
91,0.7351,https://finance.yahoo.com/news/hedge-funds-love-heidrick-struggles-161559452.html,"Do Hedge Funds Love Heidrick & Struggles International, Inc. (HSII)?","Our extensive research has shown that imitating the smart money can generate significant returns for retail investors, which is why we track nearly 900...",2021-07-30
92,0.4404,https://finance.yahoo.com/news/were-hedge-funds-invacare-corporation-161545599.html,Were Hedge Funds Right About Invacare Corporation (IVC)?,In this article we will take a look at whether hedge funds think Invacare Corporation (NYSE:IVC) is a good investment right now. We check hedge fund and...,2021-07-30
93,0.3182,https://finance.yahoo.com/news/were-hedge-funds-hudson-pacific-140519295.html,Were Hedge Funds Right About Hudson Pacific Properties Inc (HPP)?,We at Insider Monkey have gone over 866 13F filings that hedge funds and prominent investors are required to file by the SEC. The 13F filings show the funds’...,2021-07-30
94,0.8541,https://finance.yahoo.com/news/were-hedge-funds-sogou-inc-140511459.html,Were Hedge Funds Right About Sogou Inc. (SOGO)?,Is Sogou Inc. (NYSE:SOGO) a good place to invest some of your money right now? We can gain invaluable insight to help us answer that question by studying the...,2021-07-30
95,0.0,https://finance.yahoo.com/news/were-hedge-funds-hawaiian-holdings-162428275.html,"Were Hedge Funds Right About Hawaiian Holdings, Inc. (HA)?",After several tireless days we have finished crunching the numbers from nearly 900 13F filings issued by the elite hedge funds and other investment firms...,2021-07-30
96,0.8074,https://finance.yahoo.com/news/were-hedge-funds-accuray-incorporated-154624553.html,Were Hedge Funds Right About Accuray Incorporated (ARAY)?,Insider Monkey has processed numerous 13F filings of hedge funds and successful value investors to create an extensive database of hedge fund holdings. The...,2021-07-30
97,-0.7188,https://www.valuewalk.com/tesla-surviving-global-chip-shortage/,How is Tesla Surviving The Global Chip Shortage?,"Tesla Inc (NASDAQ:TSLA) is not only surviving the semiconductor shortage, but in fact, it keeps announcing upcoming models. How does Elon Musk’s company manage such feat amid one of car industry’s darkest days? Q2 2021 hedge fund letters, conferences and more…",2021-07-30
