,Sentiment,URL,Title,Description,Date
70,0.802,https://247wallst.com/business/2021/05/18/honda-is-americas-favorite-car-company/,This Is America’s Favorite Car Company,A new poll shows that Honda is the car company with the best reputation among Americans.,2021-05-18
71,-0.34,https://www.carandbike.com/news/elon-musk-drops-to-no-3-in-the-richest-list-overtaken-by-lvmh-chairman-2444239,Elon Musk Drops To No.3 In The 'Richest Man In The World' List,Tesla's stock has been surging -- increased more than 750 per cent but its stocks have started to drop because of the global semiconductor shortage,2021-05-18
72,0.0,https://www.cityam.com/the-big-short-investor-reveals-534m-bet-against-tesla/,'The Big Short' investor reveals $534m bet against Tesla,"One of the hedge fund managers made famous by the Oscar-winning film The Big Short has taken out a sizeable
The post 'The Big Short' investor reveals $534m bet against Tesla appeared first on CityAM.",2021-05-18
73,0.0536,https://www.newsweek.com/following-elon-musk-another-electric-car-maker-announces-it-will-not-accept-bitcoin-1592671,"Following Elon Musk, Another Electric Car Maker Announces It Will Not Accept Bitcoin","Henrik Fisker, CEO of the Los Angeles-based company, said he will not invest in Bitcoin or accept the cryptocurrency as payment. He didn't rule out future use of a cryptocurrency, but told CNBC that Bitcoin isn't a ""sustainable solution.""",2021-05-18
74,0.0196,https://www.independent.ie/irish-news/big-read-despite-all-the-warnings-people-in-ireland-are-piling-money-into-high-risk-cryptocurrencies-40438244.html,"Big read: Despite all the warnings, people in Ireland are piling money into high-risk cryptocurrencies",Thousands of Irish people are buying cryptocurrencies despite warnings they could lose everything.,2021-05-18
75,0.0,https://nypost.com/2021/05/18/lamborghini-to-debut-first-fully-electric-car-by-2030/,Lamborghini to debut first fully-electric car by 2030,"Italian supercar maker Lamborghini will give up the roar of a combustion engine for the purr of an electric motor. The Volkswagen-owned luxury brand announced Tuesday that it will transition its fleet of cars to hybrid vehicles this decade, culminating with t…",2021-05-18
76,0.5719,https://www.cnbc.com/2021/05/18/5-things-to-know-before-the-stock-market-opens-tuesday-may-18.html,5 things to know before the stock market opens Tuesday,"The Dow was set to rise nearly 100 points Tuesday, supported by gains in Walmart and Home Depot.",2021-05-18
77,0.0,https://www.bitchmedia.org/article/bitcoin-astrology-for-men,Bitcoin Is Astrology for Men,"<ul><li>bitcoin</li>
<li>Astrology</li>
</ul>
 


 
 
 Jess Thomson 


 
 Illustration by Colleen Tighe

 Everybody is at least a little bit superstitious. There’s always something not entirely rooted in the cold math equations of physics—something that doe…",2021-05-18
78,0.4939,https://www.cnn.com/2021/05/18/business/cryptocurrency-consulting/index.html,Want to invest in crypto? There's a consultant for that,"Cryptocurrency enthusiasm is skyrocketing, and while information surrounding digital currency is becoming more attainable, there's still a big gap between access and knowledge. That's where cryptocurrency consultants come in.",2021-05-18
79,-0.8555,https://inc42.com/buzz/cybersecurity-firm-tracks-down-one-sixty-seven-fake-android-and-ios-trading-apps/,How 167 Fake Android And iOS Apps Exploited People’s Rising Interest In Crypto And Trading - Inc42 Media,UK based cybersecurity firm Sophos has tracked down 167 fake applications impersonating popular financial trading applications to scam victims out,2021-05-18
80,0.25,https://www.businessinsider.com/stock-market-news-today-disappointing-housing-data-economic-reopening-hopes-2021-5,US stocks edge higher as investors weigh economic-reopening hopes against disappointing housing data,Major US stock indexes pare gains after data showed weaker-than-expect data for US housing starts in April.,2021-05-18
81,-0.296,https://www.independent.co.uk/life-style/gadgets-and-tech/elon-musk-second-richest-tesla-b1849177.html,Elon Musk loses ranking as world’s second-richest person as Tesla value drops,SpaceX founder loses second spot to LVMH chairman Bernard Arnault,2021-05-18
82,0.4939,https://www.cnbc.com/2021/05/18/bitcoin-price-falls-again-trader-shares-a-crypto-stock-pair-trade.html,"With bitcoin under pressure again, trader offers one crypto stock to buy and one to sell","As bitcoin falls again, Mark Tepper of Strategic Wealth Partners shares one way to trade the crypto space.",2021-05-18
83,0.6997,https://www.fool.com.au/2021/05/18/here-are-the-us-shares-asx-investors-were-buying-last-week-2/,Here are the US shares ASX investors were buying last week,"GameStop Corp (NYSE: GME) was one of the most popular US shares for ASX investors last week. Here are some of the others. 
The post Here are the US shares ASX investors were buying last week appeared first on The Motley Fool Australia.",2021-05-18
84,0.0,https://www.fool.com/earnings/call-transcripts/2021/05/18/tata-motors-ttm-q4-2021-earnings-call-transcript/,Tata Motors (TTM) Q4 2021 Earnings Call Transcript,"TTM earnings call for the period ending March 31, 2021.",2021-05-18
85,0.0,https://www.businessinsider.com/opening-bell-may-18-2021-5,10 things you need to know before the opening bell,This is what traders are talking about.,2021-05-18
86,0.6124,https://seekingalpha.com/article/4429633-tesla-forget-shorts-for-now,Tesla: Forget Shorts For Now,Short interest has dropped to a multi-year low. Less than 5.4% of float and outstanding count short. See the status of Tesla stock on a technical basis.,2021-05-18
87,-0.7184,https://www.fool.com.au/2021/05/18/if-bitcoin-investing-isnt-risky-enough-for-you-try-this/,"If Bitcoin investing isn’t risky enough for you, try this","If Bitcoin investing isn't risky enough for you then maybe you want to try to squeeze some yield out of your crypto holdings.
The post If Bitcoin investing isn’t risky enough for you, try this appeared first on The Motley Fool Australia.",2021-05-18
88,-0.4939,https://www.fool.com.au/2021/05/19/56-of-aussies-think-elon-musk-invented-bitcoin/,56% of Aussies think Elon Musk invented Bitcoin,"Here are 8 myths about cryptocurrencies that Australians actually believe to be true, and why they're wrong.
The post 56% of Aussies think Elon Musk invented Bitcoin appeared first on The Motley Fool Australia.",2021-05-18
89,0.0196,https://www.independent.ie/irish-news/despite-all-the-warnings-people-here-are-piling-money-into-high-risk-cryptocurrencies-40438244.html,"Despite all the warnings, people here are piling money into high-risk cryptocurrencies",Thousands of Irish people are buying cryptocurrencies despite warnings they could lose everything.,2021-05-18
90,0.7184,https://www.thestar.com/business/thestreet/2021/05/18/tesla-shares-slide-as-michael-big-short-burry-takes-aim-at-elon-musk.html,Tesla shares slide as Michael ‘Big Short’ Burry takes aim at Elon Musk,"Michael Burry, the hedge fund investor made famous by Christian Bale’s portrayal in “The Big Shot,” unveiled a $534 million bet against the clean energy carmaker late Monday.",2021-05-18
91,-0.3818,https://www.thisismoney.co.uk/money/investing/article-9592289/Are-fears-rising-inflation-hot-air-protect-savings.html,Are fears over rising inflation hot air? How to protect your savings,"Britain expects a spending boom as lockdown restrictions ease. Last week, Bank of England chief economist, Andy Haldane, predicted the economy will grow at its fastest since World War II.",2021-05-18
92,0.6808,https://www.thestar.com/business/thestreet/2021/05/18/walmart-amazon-home-depot-fisker-wells-fargo-5-things-you-must-know.html,"Walmart, Amazon, Home Depot, Fisker, Wells Fargo — 5 things you must know",Stock futures rise and tech shares power higher following a slide that was spurred by inflation concerns; Walmart and Home Depot report earnings; Amazon reportedly is in talks to buy Metro-Goldwyn-Mayer Studios for $9 billion.,2021-05-18
93,0.296,https://www.independent.co.uk/life-style/gadgets-and-tech/big-short-movie-tesla-prediction-b1849731.html,"‘Big Short’ investor Michael Burry, who was portrayed by Christian Bale, bets against Tesla","Investment firm has $534m put options against Tesla shares, SEC filing reveals",2021-05-18
