,Sentiment,URL,Title,Description,Date
0,-0.0258,https://www.reuters.com/article/us-tesla-bitcoin-idUSKCN2CX0KY,Bitcoin price lower after Musk tweet - Reuters,"The price of Bitcoin traded below $45,000 on Sunday after a tweet by Tesla CEO Elon Musk, an outspoken supporter of cryptocurrency, suggested Tesla may be considering or may have sold off its bitcoin holdings.",2021-05-16
1,-0.0772,https://www.reuters.com/world/china/global-markets-wrapup-1-pix-2021-05-17/,Asia shares cautious ahead of China data test - Reuters,"Asian shares edged cautiously higher on Monday catching the tailwind from a bounce on Wall Street and ahead of what are expected to be upbeat readings on the Chinese economy, though any disappointment could quickly chill the mood.",2021-05-16
2,0.3818,https://www.marketwatch.com/story/dont-be-a-sitting-duck-when-this-stock-market-rally-fades-heres-what-to-do-now-2021-05-16-1710305,NewsWatch: Don’t be a sitting duck when this stock market rally fades — here’s what to do now,"6 tips for a stronger, all-weather investment portfolio.",2021-05-16
3,-0.3804,https://www.fool.com/investing/2021/05/16/buy-the-dip-3-stocks-to-buy-today-and-hold-for-the/,Buy the Dip: 3 Stocks to Buy Today and Hold for the Next 3 Years,Some of the market's most disruptive companies are trading for at least 35% below their highs. Let's go shopping.,2021-05-16
4,-0.6124,https://www.bloomberg.com/news/articles/2021-05-16/no-pipeline-no-problem-as-energy-leads-the-stock-market-higher,"No Pipeline, No Problem as Energy Leads the Stock Market Higher",,2021-05-16
5,0.2263,https://www.forbes.com/sites/jemimamcevoy/2021/05/16/heres-why-gamestop-excitement-is-surging-again-on-reddit/,Here’s Why GameStop Excitement Is Surging Again On Reddit,"Four months after the initial trading frenzy, many Redditors believe the GameStop stock is due for a major short squeeze any time soon.",2021-05-16
6,0.5106,https://www.fool.com/investing/2021/05/16/2-electric-vehicle-stocks-to-put-on-your-radar/,2 Electric Vehicle Stocks to Put on Your Radar,Here are two stocks that could deliver strong returns for years to come.,2021-05-16
7,0.0173,https://www.dailymail.co.uk/news/article-9585365/Elon-Musk-hints-Tesla-DUMPED-rest-Bitcoin-holdings-cryptic-tweet.html,Elon Musk hints Tesla may have DUMPED the rest of its Bitcoin holdings in cryptic tweet,"Tesla bought about $1.5 billion worth of Bitcoin back in February, around the time it announced it would accept the cryptocurrency as payment for its products.",2021-05-16
8,-0.7195,https://finance.yahoo.com/news/bitcoin-dumps-elon-musk-fails-201139388.html,Bitcoin Dumps After Elon Musk Fails to Deny That Tesla Could Sell All Its Bitcoin Holdings,Elon Musk cannot stop talking about bitcoin and doge.,2021-05-16
9,0.4574,http://www.the-sun.com/lifestyle/tech/2857977/bitcoin-latest-news-elon-musk-dogecoin-support-crypto-market/,Dogecoin founder bashes Musk as 'self-absorbed grifter'...,"Dogecoin founder bashes Musk as 'self-absorbed grifter'...

 
 
 
 (First column, 18th story, link)

 

 

 
 Related stories:Bequia: Caribbean island home to world's first Bitcoin community...

 

 
 
 Drudge Report Feed needs your support!   Become a …",2021-05-16
10,-0.7184,https://www.rt.com/sport/523961-ufc262-beneil-dariush-elon-musk-callout/,"‘Elon, where’s my car?’: UFC’s Dariush targets Tesla boss in post-fight tirade, labels beaten rival Ferguson a ‘zombie’ (VIDEO)","Beneil Daruish cemented his status as a rising lightweight contender with a dominant decision victory over a fading Tony Ferguson at UFC 262, before calling out billionaire businessman Elon Musk in a bizarre post-fight rant. Read Full Article at RT.com",2021-05-16
11,0.6597,https://bgr.com/tech/dogecoin-price-elon-musk-system-transaction-efficiency-comment-5925717/,Elon Musk says he’s working with dogecoin to improve transaction efficiency,"If you see dogecoin price surging yet again on cryptocurrency exchanges, social media, and the news, that’s because Tesla CEO Elon Musk has been propping the meme coin on Twitter again. Musk has had a massive influence on doge, which rose spectacularly from l…",2021-05-16
12,-0.7845,https://www.cnbc.com/2021/05/16/stock-market-open-to-close-news.html,Stock futures are flat after Wall Street's worst week since February,Wall Street came off one of the wildest weeks of 2021 amid heightened inflation fears.,2021-05-16
13,0.8316,https://finance.yahoo.com/news/one-best-ways-play-electric-210000308.html,Is This One Of The Best Ways To Play The Electric Vehicle Boom?,"In the not-so-distant future, a majority of drivers probably won’t even own the cars they drive in, instead they may join the rising phenomenon of car...",2021-05-16
14,0.1877,https://sports.yahoo.com/andre-muniz-addresses-breaking-jacare-043347038.html,Andre Muniz addresses breaking Jacare Souza’s arm | UFC 262 video,"Andre Muniz talks about not only beating the legend, Jacare Souza, but breaking his arm while submitting him at UFC 262. UFC 262 video: Andre Muniz (Subscribe to MMAWeekly.com on YouTube) UFC 262 live results: Charles Oliveira vs. Michael Chandler",2021-05-16
15,0.7269,https://cointelegraph.com/news/inflation-winds-stiffen-as-bitcoin-ballast-on-balance-sheets-proves-its-value,Inflation winds stiffen as Bitcoin ballast on balance sheets proves its value,"Firms with iconoclastic leaders, like Musk and Dorsey, “would be the most likely to take the plunge” and commit sizable cash balances to crypto.",2021-05-16
16,0.0,https://seekingalpha.com/news/3696883-google-remains-standout-megacap-i-o-conference-approaches,Google remains the standout megacap as I/O Conference approaches: Sector Watch,"The Google I/O Conference starts on Tuesday, with expectations for a possible unveiling of a new smartphone, the Google Pixel 5A.",2021-05-16
17,-0.5859,https://economictimes.indiatimes.com/markets/cryptocurrency/bitcoin-jumps-5-6-to-49337/articleshow/82678181.cms,"Bitcoin recovers losses after Musk's tweet; jumps 5.6% to trade above $49,000","Bitcoin, the world's biggest and best-known cryptocurrency is up 77.9% from the year's low of $27,734 on Jan. 4, and down 24% from the year's high of $64,895.22 hit on April 14.",2021-05-16
18,-0.6808,https://economictimes.indiatimes.com/markets/stocks/news/no-pipeline-no-problem-as-energy-leads-the-stock-market-higher/articleshow/82681010.cms,Old warhorse beats Tesla and meme stocks on Wall Street,"The cyberattack on Colonial Pipeline Co.’s fuel distribution line along the U.S. Eastern Seaboard didn’t do much damage to refining stocks, as a prolonged shutdown was avoided.",2021-05-16
19,-0.5849,https://seekingalpha.com/article/4429101-lemonade-naysayers-utterly-wrong,Lemonade: The Naysayers Are Utterly Wrong,Lemonade is getting flak from the bears due to its huge losses and declining revenue. Read more to see the company's long-term investment thesis and valuation.,2021-05-16
20,-0.8442,https://www.fool.com.au/2021/05/17/bitcoin-suffers-largest-correction-since-march-2020/,Bitcoin suffers largest correction since March 2020,"The bitcoin (CRYPTO: BTC) hype train has taken a sharp turn away from destination moon back to earth. Here's why bitcoin is tumbling.
The post Bitcoin suffers largest correction since March 2020 appeared first on The Motley Fool Australia.",2021-05-16
21,-0.7269,https://www.dailyfx.com/forex/fundamental/forecast/weekly/title/2021/05/16/Markets-Week-Ahead-Dow-Jones-Gold-Bitcoin-US-Dollar-Still-Dovish-Fed-FOMC-Minutes.html,"Markets Week Ahead: Dow Jones, Gold, Bitcoin, US Dollar, Still Dovish Fed, FOMC Minutes",The Dow Jones wobbled as the US Dollar gained after a temporary burst of risk aversion. Sentiment seems to be on the mend. Gold and crude oil prices appear to be aiming higher. Will still-dovish Fe...,2021-05-16
22,-0.1154,https://www.forbes.com/sites/tomaspray/2021/05/16/why-dip-buyers-need-a-method/,Why Dip Buyers Need A Method,The selling last week was ugly as there were high profile analysts who were selling near the mid-week lows. That was just in time for a sharp two day rally where some dip buyers were rewarded but the Viper Reports Tom Aspray thinks dip buyers need a method.,2021-05-16
23,0.9413,https://www.fool.com.au/2021/05/16/2-fantastic-etfs-for-asx-growth-investors-to-buy/,2 fantastic ETFs for ASX growth investors to buy,"BetaShares NASDAQ 100 ETF (ASX:NDQ) and this ETF could be perfect for ASX investors looking for growth options. Here's why...
The post 2 fantastic ETFs for ASX growth investors to buy appeared first on The Motley Fool Australia.",2021-05-16
24,0.8074,https://www.fool.com.au/2021/05/17/2-top-etfs-to-buy-for-growth-monday-17-may-2021/,2 top ETFs to buy for growth,"These 2 exchange-traded funds (ETFs) are top ideas to think about for growth, including Betashares Global Cybersecurity ETF (ASX:HACK). 
The post 2 top ETFs to buy for growth appeared first on The Motley Fool Australia.",2021-05-16
25,0.6369,https://www.fool.com.au/2021/05/17/us-market-bounces-back-asx-200-tech-shares-on-watch/,"US market bounces back, ASX 200 tech shares on watch","The tech-heavy Nasdaq rebounded 2.32% on Friday. This could put ASX 200 tech shares like Afterpay Ltd (ASX: APT) on watch this morning.
The post US market bounces back, ASX 200 tech shares on watch appeared first on The Motley Fool Australia.",2021-05-16
26,0.0,https://seekingalpha.com/article/4429189-chargepoint-energy-the-thread-that-weaves-the-ev-infrastructure-revolution,ChargePoint Holdings: The Thread That Weaves The EV Infrastructure Revolution,The rapidly rising number of EVs on the road and lack of sufficient charging infrastructure to meet demand mean the electric charging station business is ready to take off.,2021-05-16
27,0.8555,https://seekingalpha.com/article/4429131-chinas-april-ev-sales-noise-is-the-only-constant,China's April EV Sales: Noise Is The Only Constant,I present select data on the 102 EVs with positive sales in April. The market remains volatile and competitive. There's no clear evidence yet on who will do well. One clear trend: new entry.,2021-05-16
28,-0.0772,https://www.channelnewsasia.com/news/business/asia-shares-cautious-ahead-of-china-data-test-14824996,Asia shares cautious ahead of China data test,"Asian shares edged cautiously higher on Monday catching the tailwind from a bounce on Wall Street and ahead of what are expected to be upbeat readings on the Chinese economy, though any disappointment could quickly chill the mood.",2021-05-16
29,0.9282,https://seekingalpha.com/article/4429169-kroger-puts-the-growth-in-dividend-growth-stock,Kroger Puts The 'Growth' In Dividend Growth Stock,"Kroger has a strong balance sheet, excellent free cash flow, low payout ratio, and a very high dividend growth rate. I am a long-term bull on The Kroger Co. stock.",2021-05-16
30,-0.6808,https://www.bloomberg.com/news/articles/2021-05-16/china-battery-maker-eve-denies-media-report-on-tesla-supply-deal,China Battery Maker Eve Denies Media Report on Tesla Supply Deal - Bloomberg,China Battery Maker Eve Denies Media Report on Tesla Supply Deal  Bloomberg,2021-05-16
31,-0.8402,https://www.bloombergquint.com/markets/no-pipeline-no-problem-as-energy-leads-the-stock-market-higher,"No Pipeline, No Problem as Energy Leads the Stock Market Higher - BloombergQuint","No Pipeline, No Problem as Energy Leads the Stock Market Higher  BloombergQuint",2021-05-16
32,0.2263,https://www.cnbc.com/2021/05/16/why-elon-musks-bitcoin-thinking-is-wrong-for-most-companies.html,Why Elon Musk's bitcoin thinking is wrong for most companies,"Should more companies hold bitcoin like Tesla, or stay away due to cryptocurrency mining climate concerns like those Elon Musk just raised? Maybe neither.",2021-05-16
33,-0.2023,https://www.bloomberg.com/opinion/articles/2021-05-16/personal-finance-why-i-pay-for-my-kid-s-chores-in-bitcoin,Personal Finance: Why I Pay for My Kid's Chores in Bitcoin,Personal Finance: Why I Pay for My Kid's Chores in Bitcoinbloomberg.com,2021-05-16
34,0.0,https://seekingalpha.com/article/4429158-weekly-commentary-un-anchored,Weekly Commentary: Un-Anchored,April CPI was reported up 0.8% versus estimates of 0.2%. The University of Michigan consumer survey’s One-Year Inflation Expectations component jumped to 4.6% from April’s 3.4%.,2021-05-16
35,-0.2885,https://www.techtimes.com/articles/260304/20210516/tesla-model-s-plaid-debuts-retractable-spoiler-hides-trunk—heres-first.htm,Tesla Model S Plaid Debuts a Retractable Spoiler That Hides on Its Trunk—Here's Its First-Look,Peek-a-boo! I am a spoiler which can help in looks and aerodynamics for this ludicrous machine.,2021-05-16
