,Sentiment,URL,Title,Description,Date
79,0.7998,https://finance.yahoo.com/news/avoid-companhia-paranaense-energia-copel-191542973.html,Should I Avoid Companhia Paranaense de Energia – COPEL (ELP)?,Is Companhia Paranaense de Energia – COPEL (NYSE:ELP) a good place to invest some of your money right now? We can gain invaluable insight to help us answer...,2021-06-23
80,0.8555,https://finance.yahoo.com/news/hedge-funds-love-farmland-partners-012447063.html,Do Hedge Funds Love Farmland Partners Inc (FPI)?,"As we already know from media reports and hedge fund investor letters, hedge funds delivered their best returns in a decade. Most investors who decided to...",2021-06-23
81,0.5423,https://finance.yahoo.com/news/where-hedge-funds-stand-electrocore-014857641.html,"Where Do Hedge Funds Stand On electroCore, Inc. (ECOR)?","Our extensive research has shown that imitating the smart money can generate significant returns for retail investors, which is why we track nearly 900...",2021-06-23
82,0.4404,https://finance.yahoo.com/news/hedge-funds-think-freeline-therapeutics-023456798.html,Here is What Hedge Funds Think About Freeline Therapeutics Holdings plc (FRLN),In this article we will take a look at whether hedge funds think Freeline Therapeutics Holdings plc (NASDAQ:FRLN) is a good investment right now. We check...,2021-06-23
83,-0.6808,https://finance.yahoo.com/news/hedge-funds-think-cel-sci-022535735.html,Here is What Hedge Funds Think About CEL-SCI Corporation (CVM),"Although the masses and most of the financial media blame hedge funds for their exorbitant fee structure and disappointing performance, these investors have ...",2021-06-23
84,0.4767,https://finance.yahoo.com/news/avoid-streamline-health-solutions-inc-185828114.html,Should I Avoid Streamline Health Solutions Inc. (STRM)?,In this article we will take a look at whether hedge funds think Streamline Health Solutions Inc. (NASDAQ:STRM) is a good investment right now. We check...,2021-06-23
85,0.0,https://finance.yahoo.com/news/phillips-66-partners-lp-psxp-191610590.html,Phillips 66 Partners LP (PSXP): Hedge Funds Are Nibbling,"The latest 13F reporting period has come and gone, and Insider Monkey is again at the forefront when it comes to making use of this gold mine of data. We at ...",2021-06-23
86,0.4404,https://finance.yahoo.com/news/buy-western-england-bancorp-inc-023505405.html,"Should I Buy Western New England Bancorp, Inc. (WNEB)?","In this article we are going to use hedge fund sentiment as a tool and determine whether Western New England Bancorp, Inc. (NASDAQ:WNEB) is a good investment...",2021-06-23
87,0.3612,https://finance.yahoo.com/news/where-hedge-funds-stand-metalla-012455814.html,Where Do Hedge Funds Stand On Metalla Royalty & Streaming Ltd. (MTA)?,A whopping number of 13F filings filed with U.S. Securities and Exchange Commission has been processed by Insider Monkey so that individual investors can...,2021-06-23
88,0.0,https://finance.yahoo.com/news/buy-meridian-corporation-mrbk-015901578.html,Should I Buy Meridian Corporation (MRBK)?,In this article we will check out the progression of hedge fund sentiment towards Meridian Corporation (NASDAQ:MRBK) and determine whether it is a good...,2021-06-23
89,0.8074,https://finance.yahoo.com/news/hedge-funds-think-eastern-company-190737866.html,Here is What Hedge Funds Think About The Eastern Company (EML),Insider Monkey has processed numerous 13F filings of hedge funds and successful value investors to create an extensive database of hedge fund holdings. The...,2021-06-23
90,0.6369,https://finance.yahoo.com/news/hedge-funds-love-gsi-technology-023512841.html,"Do Hedge Funds Love GSI Technology, Inc. (GSIT)?","The 800+ hedge funds and famous money managers tracked by Insider Monkey have already compiled and submitted their 13F filings for the first quarter, which...",2021-06-23
91,0.7269,https://finance.yahoo.com/news/buy-orbital-energy-group-inc-012459247.html,"Should I Buy Orbital Energy Group, Inc. (OEG)?","In this article we will check out the progression of hedge fund sentiment towards Orbital Energy Group, Inc. (NASDAQ:OEG) and determine whether it is a good ...",2021-06-23
92,-0.1027,https://finance.yahoo.com/news/hedge-funds-never-less-bullish-190733669.html,Hedge Funds Never Been Less Bullish On Pampa Energia S.A. (PAM),"Most investors tend to think that hedge funds and other asset managers are worthless, as they cannot beat even simple index fund portfolios. In fact, most...",2021-06-23
93,0.0,https://finance.yahoo.com/news/hedge-funds-think-atento-sa-191602946.html,Here is What Hedge Funds Think About Atento SA (ATTO),After several tireless days we have finished crunching the numbers from nearly 900 13F filings issued by the elite hedge funds and other investment firms...,2021-06-23
94,0.6369,https://finance.yahoo.com/news/hedge-funds-love-nanobiotix-nbtx-192329472.html,Do Hedge Funds Love Nanobiotix S.A. (NBTX)?,"The latest 13F reporting period has come and gone, and Insider Monkey is again at the forefront when it comes to making use of this gold mine of data...",2021-06-23
95,0.5859,https://finance.yahoo.com/news/hedge-funds-love-millicom-international-191556464.html,Do Hedge Funds Love Millicom International Cellular S.A. (TIGO)?,"Most investors tend to think that hedge funds and other asset managers are worthless, as they cannot beat even simple index fund portfolios. In fact, most...",2021-06-23
96,0.5267,https://finance.yahoo.com/news/plug-power-surges-14-q1-075601101.html,Plug Power Surges 14% on Q1 Earnings Results,Shares of Plug Power (PLUG) witnessed a surge post the company’s reporting of its first quarter results. Shares jumped almost 14% to close at $34.02 on June ...,2021-06-23
97,0.6808,https://finance.yahoo.com/news/where-hedge-funds-stand-united-023523259.html,"Where Do Hedge Funds Stand On United Fire Group, Inc. (UFCS)?","As we already know from media reports and hedge fund investor letters, hedge funds delivered their best returns in a decade. Most investors who decided to...",2021-06-23
98,0.4404,https://finance.yahoo.com/news/buy-allegiance-bancshares-inc-abtx-022516499.html,"Should I Buy Allegiance Bancshares, Inc. (ABTX)?","In this article we will analyze whether Allegiance Bancshares, Inc. (NASDAQ:ABTX) is a good investment right now by following the lead of some of the best...",2021-06-23
99,0.4019,https://finance.yahoo.com/news/omega-flex-inc-oflx-fell-185825144.html,"Omega Flex, Inc. (OFLX) Fell Out Of Favor With Hedge Funds",After several tireless days we have finished crunching the numbers from nearly 900 13F filings issued by the elite hedge funds and other investment firms...,2021-06-23
