,Sentiment,URL,Title,Description,Date
0,0.25,https://stockmarket.com/featured/stock-trading-guide-for-beginners-2021-2021-06-21,Stock Trading Guide For Beginners 2021,Here is a comprehensive guide for beginners who are looking to start trading stocks in 2021.,2021-06-21
1,0.25,https://www.bloomberg.com/news/newsletters/2021-06-21/money-stuff-lordstown-executives-had-good-timing,Money Stuff: Lordstown Executives Had Good Timing,"The basic problem is that, if you are a senior executive at a public company, you always know stuff about your company that the public doesn’t know, but you might want to sell stock sometimes. The main reason that you might want to sell stock is that you are …",2021-06-21
2,0.0,https://www.barrons.com/articles/ge-reverse-stock-split-51624282282,It’s Official. GE Set the Date for Its Reverse Stock Split.,"Investors have known about the plan for months, but on Friday, GE said it will take place on July 30, after the market closes.",2021-06-21
3,0.34,https://finance.yahoo.com/news/tesla-tsla-stock-sinks-market-214509963.html,Tesla (TSLA) Stock Sinks As Market Gains: What You Should Know,"In the latest trading session, Tesla (TSLA) closed at $620.83, marking a -0.4% move from the previous day.",2021-06-21
4,0.7783,https://finance.yahoo.com/news/10-stocks-elon-musk-put-110036143.html,10 Stocks Elon Musk Has Put in the Spotlight — Are They Worth Your Investment?,"Elon Musk, the outspoken CEO and co-founder of Tesla, is nothing if not newsworthy. Musk is fond of making grand and oftentimes cryptic statements both in...",2021-06-21
5,0.5789,https://www.thestreet.com/investing/surprising-thing-that-could-threaten-teslas-profitability,Tesla's Profitability and the Surprising Thing That Could Threaten It,"Rising competition in the electric vehicle space could not only put a crimp in Tesla’s growth rate, but diminish a big source of income as well.",2021-06-21
6,-0.128,https://www.forbes.com/sites/jonathanponciano/2021/06/21/bitcoins-biggest-corporate-backer-invests-another-500-million-as-crypto-prices-crash/,Bitcoin's Biggest Corporate Backer Invests Another $500 Million As Crypto Prices Crash,MicroStrategy shares sank 7% in pre-market trading and are now down nearly 50% from a mid-February high.,2021-06-21
7,0.5256,https://www.forbes.com/sites/stephenmcbride1/2021/06/21/an-investing-truth-roughly-80-of-stocks-are-duds/,An Investing Truth: Roughly 80% Of Stocks Are “Duds”,Today I’m spilling the beans on something very important. It’s a “truth” about investing almost nobody understands.,2021-06-21
8,0.875,https://finance.yahoo.com/news/dsm-net-asset-value-102900642.html,DSM: Net Asset Value(s),"Downing Strategic Micro-Cap Investment Trust Plc LEI Code: 213800QMYPUW4POFFX69 Net Asset Values The Company announces the following, all of which is...",2021-06-21
9,0.6808,https://finance.yahoo.com/news/net-asset-value-085500789.html,Net Asset Value(s),WisdomTree Issuer plc – Daily Fund Prices 18-June-21 WisdomTree Artificial Intelligence UCITS ETF - USD Acc18/06...,2021-06-21
10,0.0,https://finance.yahoo.com/news/finnish-digital-asset-lender-tesseract-070000989.html,Finnish Digital-Asset Lender Tesseract Raises $25M in Series A Funding,The round was led by Augmentum Fintech.,2021-06-21
11,0.0772,https://finance.yahoo.com/news/icelandair-group-hf-major-shareholder-101600657.html,Icelandair Group hf.: Major Shareholder Announcement,Attached is a major shareholder announcement from Lífeyrissjóður starfsmanna ríkisins confirming that its number of voting rights in Icelandair Group is now ...,2021-06-21
12,0.0,https://www.barrons.com/articles/former-tesla-executive-sells-274-million-of-stock-51624290826,Former Tesla Executive Sells $274 Million of Stock,"Jerome Guillen, former head of trucking at the electric-vehicle company, left the company in early June.",2021-06-21
13,0.0,https://www.cnbc.com/2021/06/21/jerome-guillen-ex-tesla-exec-stock-sales-after-june-3-departure.html,Tesla's former automotive chief sold more than $270 million of stock after leaving on June 3,"Guillen became President of Automotive in the third quarter of 2018, overseeing all of Tesla's automotive business.",2021-06-21
14,0.0,https://finance.yahoo.com/news/opra-stock-buy-214901762.html,Is OPRA Stock A Buy Here?,"The 800+ hedge funds and famous money managers tracked by Insider Monkey have already compiled and submitted their 13F filings for the first quarter, which...",2021-06-21
15,0.0,https://finance.yahoo.com/news/bsbr-stock-buy-214909432.html,Is BSBR Stock A Buy Here?,"Hedge funds and large money managers usually invest with a focus on the long-term horizon and, therefore, short-lived dips or bumps on the charts usually...",2021-06-21
16,0.0,https://finance.yahoo.com/news/fet-stock-buy-214839012.html,Is FET Stock A Buy Here?,"Hedge funds and large money managers usually invest with a focus on the long-term horizon and, therefore, short-lived dips or bumps on the charts usually...",2021-06-21
17,-0.9153,https://www.cnbc.com/2021/06/21/what-to-watch-today-dow-set-to-bounce-after-its-worst-weekly-loss-since-october.html,What to watch today: Dow set to bounce after its worst weekly loss since October,"Dow futures bounced Monday, after the 30-stock average posted its worst weekly loss since October.",2021-06-21
18,0.0,https://finance.yahoo.com/news/ayro-stock-buy-214843749.html,Is AYRO Stock A Buy Here?,After several tireless days we have finished crunching the numbers from nearly 900 13F filings issued by the elite hedge funds and other investment firms...,2021-06-21
19,0.6369,https://finance.yahoo.com/news/lfvn-stock-buy-213007817.html,Is LFVN Stock A Buy Here?,With the first-quarter round of 13F filings behind us it is time to take a look at the stocks in which some of the best money managers in the world preferred...,2021-06-21
20,0.4404,https://finance.yahoo.com/news/rezolute-inc-rzlt-good-stock-194815631.html,"Is Rezolute, Inc. (RZLT) A Good Stock To Buy?",After several tireless days we have finished crunching the numbers from nearly 900 13F filings issued by the elite hedge funds and other investment firms...,2021-06-21
21,0.7964,https://finance.yahoo.com/news/ondas-holdings-inc-onds-good-225950925.html,Is Ondas Holdings Inc. (ONDS) A Good Stock To Buy?,"As we already know from media reports and hedge fund investor letters, hedge funds delivered their best returns in a decade. Most investors who decided to...",2021-06-21
22,0.7351,https://finance.yahoo.com/news/izea-worldwide-inc-izea-good-225957135.html,Is IZEA Worldwide Inc. (IZEA) A Good Stock To Buy?,"We know that hedge funds generate strong, risk-adjusted returns over the long run, therefore imitating the picks that they are collectively bullish on can be...",2021-06-21
23,0.3612,https://finance.yahoo.com/news/aquestive-therapeutics-inc-aqst-good-225042450.html,"Is Aquestive Therapeutics, Inc. (AQST) A Good Stock To Buy?","Most investors tend to think that hedge funds and other asset managers are worthless, as they cannot beat even simple index fund portfolios. In fact, most...",2021-06-21
24,0.4404,https://finance.yahoo.com/news/electromed-inc-elmd-good-stock-225035635.html,"Is Electromed, Inc. (ELMD) A Good Stock To Buy?","Hedge funds and large money managers usually invest with a focus on the long-term horizon and, therefore, short-lived dips or bumps on the charts usually...",2021-06-21
25,0.9054,https://finance.yahoo.com/news/arcimoto-inc-fuv-good-stock-194811052.html,"Is Arcimoto, Inc. (FUV) A Good Stock To Buy?","Is Arcimoto, Inc. (NASDAQ:FUV) a good place to invest some of your money right now? We can gain invaluable insight to help us answer that question by...",2021-06-21
26,0.8074,https://finance.yahoo.com/news/provident-bancorp-inc-pvbc-good-213715291.html,"Is Provident Bancorp, Inc. (PVBC) A Good Stock To Buy?","In this article you are going to find out whether hedge funds think Provident Bancorp, Inc. (NASDAQ:PVBC) is a good investment right now. We like to check...",2021-06-21
27,0.9118,https://finance.yahoo.com/news/gain-therapeutics-inc-ganx-good-214905297.html,"Is Gain Therapeutics, Inc. (GANX) A Good Stock To Buy?","In this article we will analyze whether Gain Therapeutics, Inc. (NASDAQ:GANX) is a good investment right now by following the lead of some of the best...",2021-06-21
28,-0.5574,https://finance.yahoo.com/news/sify-technologies-limited-sify-good-225025046.html,Is Sify Technologies Limited (SIFY) A Good Stock To Buy?,"Although the masses and most of the financial media blame hedge funds for their exorbitant fee structure and disappointing performance, these investors have ...",2021-06-21
29,0.743,https://finance.yahoo.com/news/profire-energy-inc-pfie-good-212959552.html,"Is Profire Energy, Inc. (PFIE) A Good Stock To Buy?",We at Insider Monkey have gone over 866 13F filings that hedge funds and prominent investors are required to file by the SEC. The 13F filings show the funds’...,2021-06-21
30,0.8481,https://finance.yahoo.com/news/sabine-royalty-trust-sbr-good-214847228.html,Is Sabine Royalty Trust (SBR) A Good Stock To Buy?,"While the market driven by short-term sentiment influenced by the accommodative interest rate environment in the US, virus news and stimulus spending, many...",2021-06-21
31,0.7351,https://finance.yahoo.com/news/fonar-corporation-fonr-good-stock-194750187.html,Is Fonar Corporation (FONR) A Good Stock To Buy?,"We know that hedge funds generate strong, risk-adjusted returns over the long run, therefore imitating the picks that they are collectively bullish on can be...",2021-06-21
32,0.7351,https://finance.yahoo.com/news/intrusion-inc-intz-good-stock-194818095.html,Is Intrusion Inc. (INTZ) A Good Stock To Buy?,"We know that hedge funds generate strong, risk-adjusted returns over the long run, therefore imitating the picks that they are collectively bullish on can be...",2021-06-21
33,0.4404,https://finance.yahoo.com/news/citius-pharmaceuticals-inc-ctxr-good-225045401.html,"Is Citius Pharmaceuticals, Inc. (CTXR) A Good Stock To Buy?","The latest 13F reporting period has come and gone, and Insider Monkey is again at the forefront when it comes to making use of this gold mine of data. We...",2021-06-21
34,0.4404,https://finance.yahoo.com/news/cootek-cayman-inc-ctk-good-225947808.html,Is CooTek (Cayman) Inc. (CTK) A Good Stock To Buy?,"The latest 13F reporting period has come and gone, and Insider Monkey is again at the forefront when it comes to making use of this gold mine of data. We...",2021-06-21
35,0.9087,https://www.businessinsider.com/contextlogic-stock-price-redditors-highlight-it-as-a-meme-stock-play-for-the-week-2021-6,ContextLogic jumps 22% as Redditors highlight it as a meme-stock play for the week,The WISH ticker has surged in interest on Reddit investing threads as traders target a $14-$16 share price.,2021-06-21
36,0.4215,https://www.carscoops.com/2021/06/at-90000-will-this-1970-dodge-challenger-restomod-have-you-going-plum-crazy/,"At $90,000, Will This 1970 Dodge Challenger Restomod Have You Going Plum Crazy?",The 903-mile car comes with the desirable 440ci V8 engine under its hood.,2021-06-21
37,0.3612,https://finance.yahoo.com/news/hedge-funds-think-tompkins-financial-212952201.html,Here is What Hedge Funds Think About Tompkins Financial Corporation (TMP),"Before we spend countless hours researching a company, we like to analyze what insiders, hedge funds and billionaire investors think of the stock first. This...",2021-06-21
38,0.3612,https://finance.yahoo.com/news/hedge-funds-think-htg-molecular-212955878.html,"Here is What Hedge Funds Think About HTG Molecular Diagnostics, Inc. (HTGM)","Before we spend countless hours researching a company, we like to analyze what insiders, hedge funds and billionaire investors think of the stock first. This...",2021-06-21
39,0.4215,https://finance.yahoo.com/news/robinhood-traders-keep-buying-stocks-125038479.html,"Robinhood Traders Keep Buying These Stocks, What do the Pros Say About Them?","Since the outset of the COVID-19 pandemic in early 2020, the stock market has embarked on a journey with ups and downs, the likes of which had been...",2021-06-21
40,0.0,https://finance.yahoo.com/news/hedge-funds-buying-zepp-health-213722811.html,Hedge Funds Are Buying Zepp Health Corporation (ZEPP),"How do you pick the next stock to invest in? One way would be to spend days of research browsing through thousands of publicly traded companies. However, an ...",2021-06-21
41,0.9274,https://finance.yahoo.com/news/10-best-alternative-energy-stocks-142417104.html,10 Best Alternative Energy Stocks to Buy Now,"In this article, we will take a look at the 10 best alternative energy stocks to buy now. You can skip our comprehensive analysis of these companies, and go ...",2021-06-21
42,0.6369,https://finance.yahoo.com/news/montauk-renewables-inc-mntk-hedge-212941308.html,"Montauk Renewables, Inc. (MNTK): Are Hedge Funds Right About This Stock?",With the first-quarter round of 13F filings behind us it is time to take a look at the stocks in which some of the best money managers in the world preferred...,2021-06-21
43,0.7351,https://finance.yahoo.com/news/stock-yards-bancorp-inc-sybt-212948520.html,"Stock Yards Bancorp, Inc. (SYBT) Fell Out Of Favor With Hedge Funds","Our extensive research has shown that imitating the smart money can generate significant returns for retail investors, which is why we track nearly 900...",2021-06-21
44,0.7506,https://seekingalpha.com/news/3708120-alset-ehome-rallies-47-on-strategic-agreement-with-tesla-for-delivering-first-20-ehomes,Alset Ehome rallies 47% on strategic agreement with Tesla for delivering first 20 EHomes,Alset EHome (AEI) stock rallies 54.4% higher premarket on strategic agreement with Tesla,2021-06-21
45,0.5719,https://finance.yahoo.com/news/oxford-square-capital-corp-oxsq-214850688.html,Is Oxford Square Capital Corp. (OXSQ) A Good Stock To Buy?,"At Insider Monkey, we pore over the filings of nearly 866 top investment firms every quarter, a process we have now completed for the latest reporting period...",2021-06-21
46,0.7506,https://finance.yahoo.com/news/reviva-pharmaceuticals-holdings-inc-rvph-225019379.html,"Is Reviva Pharmaceuticals Holdings, Inc. (RVPH) A Good Stock To Buy?","Our extensive research has shown that imitating the smart money can generate significant returns for retail investors, which is why we track nearly 900...",2021-06-21
47,0.2732,https://finance.yahoo.com/news/ngl-energy-partners-lp-ngl-213019536.html,NGL Energy Partners LP (NGL): Are Hedge Funds Right About This Stock?,After several tireless days we have finished crunching the numbers from nearly 900 13F filings issued by the elite hedge funds and other investment firms...,2021-06-21
48,0.4404,https://finance.yahoo.com/news/corbus-pharmaceuticals-holdings-inc-crbp-214858361.html,Is Corbus Pharmaceuticals Holdings Inc (CRBP) A Good Stock To Buy?,In this article we are going to use hedge fund sentiment as a tool and determine whether Corbus Pharmaceuticals Holdings Inc (NASDAQ:CRBP) is a good...,2021-06-21
49,0.4404,https://finance.yahoo.com/news/anavex-life-sciences-corp-avxl-213718931.html,Is Anavex Life Sciences Corp. (AVXL) A Good Stock To Buy?,"The 800+ hedge funds and famous money managers tracked by Insider Monkey have already compiled and submitted their 13F filings for the first quarter, which...",2021-06-21
50,0.0,https://finance.yahoo.com/news/mackinac-financial-corporation-mfnc-going-194808290.html,Is Mackinac Financial Corporation (MFNC) Going to Burn These Hedge Funds?,"The 800+ hedge funds and famous money managers tracked by Insider Monkey have already compiled and submitted their 13F filings for the first quarter, which...",2021-06-21
51,0.0,https://finance.yahoo.com/news/buy-select-bancorp-inc-slct-194803901.html,"Should I Buy Select Bancorp, Inc. (SLCT)?","The latest 13F reporting period has come and gone, and Insider Monkey is again at the forefront when it comes to making use of this gold mine of data. We at ...",2021-06-21
52,-0.2023,https://www.fool.com/investing/2021/06/21/do-your-companies-engage-in-yogababble/,Do Your Companies Engage in 'Yogababble'?,"And we are joined by William Bernstein, the author of ""The Delusions of Crowds: Why People Go Mad in Groups.""",2021-06-21
53,0.4404,https://finance.yahoo.com/news/viacomcbs-viac-good-investment-choice-164821260.html,Is ViacomCBS (VIAC) A Good Investment Choice?,"Bronte Capital, an investment management firm, published its “Amalthea Fund” first quarter 2021 investor letter – a copy of which can be downloaded here. A...",2021-06-21
54,0.8316,https://finance.yahoo.com/news/hedge-funds-love-genesis-energy-194759899.html,"Do Hedge Funds Love Genesis Energy, L.P. (GEL)?",A whopping number of 13F filings filed with U.S. Securities and Exchange Commission has been processed by Insider Monkey so that individual investors can...,2021-06-21
55,0.7269,https://finance.yahoo.com/news/buy-vertex-energy-inc-vtnr-213736266.html,Should I Buy Vertex Energy Inc (VTNR)?,In this article we will take a look at whether hedge funds think Vertex Energy Inc (NASDAQ:VTNR) is a good investment right now. We check hedge fund and...,2021-06-21
56,-0.6808,https://finance.yahoo.com/news/buy-evelo-biosciences-inc-evlo-225021438.html,"Should I Buy Evelo Biosciences, Inc. (EVLO)?","Although the masses and most of the financial media blame hedge funds for their exorbitant fee structure and disappointing performance, these investors have ...",2021-06-21
57,0.0,https://finance.yahoo.com/news/buy-ricebran-technologies-ribt-213003223.html,Should I Buy RiceBran Technologies (RIBT)?,"The latest 13F reporting period has come and gone, and Insider Monkey is again at the forefront when it comes to making use of this gold mine of data. We...",2021-06-21
58,-0.0772,https://finance.yahoo.com/news/hedge-funds-keep-buying-medicenna-213015730.html,Hedge Funds Keep Buying Medicenna Therapeutics Corp. (MDNA),"Many prominent investors, including Warren Buffett, David Tepper and Stan Druckenmiller, have been cautious regarding the current bull market and missed out ...",2021-06-21
59,-0.4215,https://finance.yahoo.com/news/hedge-fund-sentiment-stagnant-phoenix-225953444.html,Hedge Fund Sentiment Is Stagnant On Phoenix New Media Ltd (FENG),Last year we predicted the arrival of the first US recession since 2009 and we told in advance that the market will decline by at least 20% in (Recession is ...,2021-06-21
60,0.2682,https://finance.yahoo.com/news/buy-marine-products-corp-mpx-225028321.html,Should I Buy Marine Products Corp. (MPX)?,"Out of thousands of stocks that are currently traded on the market, it is difficult to identify those that will really generate strong returns. Hedge funds...",2021-06-21
61,-0.6808,https://finance.yahoo.com/news/volt-information-sciences-inc-volt-213706796.html,"Is Volt Information Sciences, Inc. (VOLT) Going to Burn These Hedge Funds?","Although the masses and most of the financial media blame hedge funds for their exorbitant fee structure and disappointing performance, these investors have ...",2021-06-21
62,0.0,https://finance.yahoo.com/news/where-hedge-funds-stand-goldman-213011777.html,"Where Do Hedge Funds Stand On Goldman Sachs BDC, Inc. (GSBD)?","The latest 13F reporting period has come and gone, and Insider Monkey is again at the forefront when it comes to making use of this gold mine of data...",2021-06-21
63,0.8402,https://finance.yahoo.com/news/peoples-bancorp-inc-pebo-hedge-194753204.html,Peoples Bancorp Inc. (PEBO): Hedge Funds In Wait-and-See Mode,Is Peoples Bancorp Inc. (NASDAQ:PEBO) a good place to invest some of your money right now? We can gain invaluable insight to help us answer that question by ...,2021-06-21
64,0.0,https://finance.yahoo.com/news/hedge-fund-sentiment-stagnant-lloyds-225944803.html,Hedge Fund Sentiment Is Stagnant On Lloyds Banking Group PLC (LYG),"The latest 13F reporting period has come and gone, and Insider Monkey is again at the forefront when it comes to making use of this gold mine of data...",2021-06-21
65,0.3612,https://finance.yahoo.com/news/republic-bancorp-inc-rbcaa-going-194756772.html,"Is Republic Bancorp, Inc. (RBCAA) Going to Burn These Hedge Funds?",A whopping number of 13F filings filed with U.S. Securities and Exchange Commission has been processed by Insider Monkey so that individual investors can...,2021-06-21
66,0.2682,https://finance.yahoo.com/news/hedge-funds-buying-caladrius-biosciences-214854403.html,Hedge Funds Are Buying Caladrius Biosciences Inc (CLBS),"Out of thousands of stocks that are currently traded on the market, it is difficult to identify those that will really generate strong returns. Hedge funds...",2021-06-21
67,0.296,https://finance.yahoo.com/news/where-hedge-funds-stand-sonim-213725553.html,"Where Do Hedge Funds Stand On Sonim Technologies, Inc. (SONM)?","Hedge Funds and other institutional investors have just completed filing their 13Fs with the Securities and Exchange Commission, revealing their equity...",2021-06-21
68,0.3612,https://finance.yahoo.com/news/aqua-metals-inc-aqms-hedge-213732107.html,"Aqua Metals, Inc. (AQMS): Hedge Funds Are Snapping Up",A whopping number of 13F filings filed with U.S. Securities and Exchange Commission has been processed by Insider Monkey so that individual investors can...,2021-06-21
69,-0.0772,https://finance.yahoo.com/news/hedge-funds-betting-park-national-213708300.html,Hedge Funds Are Betting On Park National Corporation (PRK),"Many prominent investors, including Warren Buffett, David Tepper and Stan Druckenmiller, have been cautious regarding the current bull market and missed out ...",2021-06-21
70,0.5998,https://seekingalpha.com/article/4435941-komp-cheaper-better-diversified-alternative-to-arkk,"KOMP: Cheaper, Better Diversified Alternative To ARKK","KOMP is a much smaller, less popular but also cheaper alternative to ARKK with a more profound depth of holdings and better risk dispersion.",2021-06-21
71,-0.296,https://finance.yahoo.com/news/avoid-first-community-bancshares-inc-213728072.html,Should I Avoid First Community Bancshares Inc (FCBC)?,"The latest 13F reporting period has come and gone, and Insider Monkey is again at the forefront when it comes to making use of this gold mine of data. We at ...",2021-06-21
72,0.0772,https://finance.yahoo.com/news/avoid-black-stone-minerals-lp-214836613.html,Should I Avoid Black Stone Minerals LP (BSM)?,The financial regulations require hedge funds and wealthy investors that exceeded the $100 million holdings threshold to file a report that shows their...,2021-06-21
73,0.2023,https://finance.yahoo.com/news/hedge-funds-think-tyme-technologies-225038159.html,"Here is What Hedge Funds Think About Tyme Technologies, Inc. (TYME)","At Insider Monkey, we pore over the filings of nearly 866 top investment firms every quarter, a process we have now completed for the latest reporting period...",2021-06-21
74,-0.0772,https://finance.yahoo.com/news/hedge-funds-aren-t-crazy-225032572.html,"Hedge Funds Aren’t Crazy About U.S. Well Services, Inc. (USWS) Anymore","The 800+ hedge funds and famous money managers tracked by Insider Monkey have already compiled and submitted their 13F filings for the first quarter, which...",2021-06-21
75,0.6369,https://finance.yahoo.com/news/hedge-funds-love-bp-midstream-194806190.html,Do Hedge Funds Love BP Midstream Partners LP (BPMP)?,After several tireless days we have finished crunching the numbers from nearly 900 13F filings issued by the elite hedge funds and other investment firms...,2021-06-21
76,0.8402,https://finance.yahoo.com/news/hedge-funds-think-orix-corporation-213712202.html,Here is What Hedge Funds Think About ORIX Corporation (IX),Is ORIX Corporation (NYSE:IX) a good place to invest some of your money right now? We can gain invaluable insight to help us answer that question by studying...,2021-06-21
77,0.765,https://www.freep.com/story/money/cars/ford/2021/06/21/ford-renault-franck-louis-victor/7768013002/,Ford Motor Co. hires former Renault exec Franck Louis-Victor to lead new businesses - Detroit Free Press,Ford Motor Co. hires former Renault exec Franck Louis-Victor to lead new businesses  Detroit Free Press,2021-06-21
78,0.0,https://www.cnbc.com/2021/06/21/stocks-making-the-biggest-moves-in-the-premarket-microstrategy-coinbase-raven-industries-more.html,"Stocks making the biggest moves in the premarket: MicroStrategy, Coinbase, Raven Industries & more","The stocks making the biggest moves in premarket trading include MicroStrategy, Coinbase, Raven Industries, and more.",2021-06-21
79,0.128,https://jalopnik.com/subarus-might-become-hard-to-come-by-1847140255,Subarus Might Become Hard To Come By,Plants making Subarus for the U.S. market are getting idled thanks to the chip shortage.,2021-06-21
80,0.6486,https://finance.yahoo.com/news/state-crypto-driving-meteoric-rise-163056348.html,State of Crypto: What’s Driving Its Meteoric Rise and Who’s Really Investing in Crypto Now,"It seems like the world has been in a crypto state of mind in the past few months, and cryptocurrencies have become easier to access for the average investor...",2021-06-21
81,0.6705,https://www.businessinsider.com/stock-strategies-investing-influencer-1-million-youtube-subscribers-strategies-trading-2021-6,26-year-old Ricky Gutierrez is one of YouTube's biggest investing influencers with nearly 1 million subscribers. He told us his top 3 strategies for trading blue-chip stocks like Twitter and Tesla.,"Summary List PlacementRicky Gutierrez first dabbled in trading when he was 17 years old, using money he earned mainly from buying and selling phones on Craigslist, and from creating and selling fingerboards, which are mini skateboards for your fingers.
""My pa…",2021-06-21
