,Sentiment,URL,Title,Description,Date
0,0.5106,https://www.reuters.com/business/tesla-lifts-nasdaq-record-high-2021-06-23/,Tesla lifts Nasdaq to record high - Reuters,"The Nasdaq rose to an all-time high on Wednesday, fueled by a rally in Tesla Inc (TSLA.O), with investors cheering data that showed a record peak for U.S. factory activity in June.",2021-06-23
1,0.5994,https://www.reuters.com/article/usa-stocks-idUSL2N2O52CA,US STOCKS-Tesla lifts Nasdaq to record-high close - Reuters,"* Retail darlings Alfi, Torchlight extend declines (Updates with details at end of session)",2021-06-23
2,0.5106,https://www.reuters.com/business/tesla-lifts-nasdaq-record-high-close-2021-06-23/,Tesla lifts Nasdaq to record-high close - Reuters,"The Nasdaq climbed to a record-high close on Wednesday, fueled by a rally in Tesla Inc (TSLA.O), with investors cheering data that showed a record peak for U.S. factory activity in June.",2021-06-23
3,0.5106,https://www.reuters.com/article/us-usa-stocks-idUSKCN2DZ15C,US STOCKS-Tesla lifts Nasdaq to record high - Reuters,"The Nasdaq rose to an all-time high on Wednesday, fueled by a rally in Tesla Inc, with investors cheering data that showed a record peak for U.S. factory activity in June.",2021-06-23
4,0.7184,https://www.reuters.com/business/autos-transportation/chinas-ev-maker-xpeng-gets-approval-list-hong-kong-source-2021-06-23/,China's EV maker Xpeng gets approval to list in Hong Kong -source - Reuters,"The listing committee of Hong Kong Stock Exchange has approved Chinese electric vehicle maker Xpeng Inc (XPEV.N) for a dual primary listing in the Asian financial hub, a source with direct knowledge of the matter told Reuters.",2021-06-23
5,0.5106,https://www.reuters.com/business/tesla-lifts-nasdaq-record-high-close-sp-500-dips-2021-06-23/,"Tesla lifts Nasdaq to record-high close, S&P 500 dips - Reuters","The Nasdaq climbed to a record-high close on Wednesday, fueled by a rally in Tesla Inc (TSLA.O), while the S&P 500 dipped, even as investors cheered data that showed a record peak for U.S. factory activity in June.",2021-06-23
6,0.4767,https://www.marketwatch.com/story/xpeng-stock-jumps-as-chinese-tesla-rival-reportedly-gets-approval-for-hong-kong-ipo-11624445868,: XPeng stock jumps as Chinese Tesla rival reportedly gets approval for Hong Kong IPO,"Xpeng’s American depositary receipts jumped more than 5% in U.S. premarket trading, following the reports on Wednesday.",2021-06-23
7,0.7269,https://www.marketwatch.com/story/dow-and-sp-500-snap-2-day-win-streak-but-nasdaq-books-16th-record-close-of-year-2021-06-23,"NewsWatch: Dow and S&P 500 snap 2-day win streak, but Nasdaq books 16th record close of year","U.S. stock benchmarks end mostly lower Wednesday, but with the Nasdaq Composite scoring its 16th record close in 2021, as investors focus on inflation and the Federal Reserve's promise to go slow in scaling back its support.",2021-06-23
8,0.5267,https://hypebeast.com/2021/6/gamestop-gain-1-billion-selling-stock-info,GameStop Rises After $1 Billion USD Stock Sale,"In a new SEC filing, GameStop announced that the company has sold 5,000,000 shares of its common stock and made approximately $1,126,000,000 USD.This mass sell-off follows the 3.5 million shares of stock the company sold back in April for $551 million USD. Du…",2021-06-23
9,0.0,https://www.fool.com/investing/2021/06/23/why-tesla-stock-jumped-on-wednesday/,Why Tesla Stock Jumped on Wednesday,Is a rebound in Bitcoin on Wednesday impacting the electric-car maker's stock?,2021-06-23
10,0.5859,https://www.fool.com/investing/2021/06/23/teslas-not-the-only-ev-stock-climbing-wednesday/,Tesla's Not the Only EV Stock Climbing Wednesday,There's plenty of excitement about electric vehicles on a solid market day.,2021-06-23
11,0.0,https://www.marketwatch.com/story/morgan-stanley-workers-will-need-to-be-fully-vaccinated-to-enter-offices-reports-2021-06-23,NewsWatch: Morgan Stanley workers will need to be fully vaccinated to enter offices: reports,"Morgan Stanley employees will need to be fully vaccinated against COVID-19 before they can return to their offices in New York City, according to reports Tuesday.",2021-06-23
12,0.4767,https://www.nytimes.com/2021/06/23/technology/no-end-to-whiplash-in-meme-stocks-crypto-and-more.html,"No End to Whiplash in Meme Stocks, Crypto and More","With the pandemic starting to ease in the United States, many had expected a year of wild investments to slow. It hasn’t. Yet.",2021-06-23
13,0.0,https://www.barrons.com/articles/tesla-stock-volatility-snoozer-trading-51624459223,Tesla Stock Has Become a Snoozer. Here’s Why.,"Tesla's stock volatility is way down. For traders expecting more wild stock swings, it takes some getting used to.",2021-06-23
14,0.0,https://finance.yahoo.com/news/why-tesla-stock-5-today-154044743.html,Why Tesla Stock Is Up By 5% Today,The stock is trying to settle above the $650 level.,2021-06-23
15,0.3597,https://www.investors.com/market-trend/stock-market-today/dow-jones-slips-meme-stock-clover-health-stock-pops-after-warning-amc-stock-gains-tesla-retakes-key-level/,"Dow Jones Flat; Meme Stock Pops After Warning, AMC Stock Gains; Tesla Retakes Key Level - Investor's Business Daily","<ol><li>Dow Jones Flat; Meme Stock Pops After Warning, AMC Stock Gains; Tesla Retakes Key Level  Investor's Business Daily
</li><li>S&P 500 closes slightly lower, snaps two-day winning streak  CNBC
</li><li>Market Recap: Tuesday, June 22: Nasdaq has record …",2021-06-23
16,0.0,https://www.forbes.com/sites/jonathanponciano/2021/06/23/as-nasdaq-hits-new-high-these-are-the-tech-stocks-leading-the-market/,"As Nasdaq Hits New High, These Are The Tech Stocks Leading The Market","Tesla, Applied Materials and Micron Technology lead a resurgent crop of Nasdaq stocks.",2021-06-23
17,0.0,https://www.fool.com/investing/2021/06/23/why-fisker-jumped-9-on-wednesday/,Why Fisker Jumped 9% on Wednesday,"The electric vehicle start-up just upped its (Wall) street cred, but plenty of fundamental pitfalls lie ahead.",2021-06-23
18,0.0,https://www.investors.com/market-trend/stock-market-today/dow-jones-rallies-as-tesla-stock-jumps-apple-nears-new-buy-point/,Dow Jones Reverses As Tesla Stock Surges; Apple Approaches New Buy Point - Investor's Business Daily,"<ol><li>Dow Jones Reverses As Tesla Stock Surges; Apple Approaches New Buy Point  Investor's Business Daily
</li><li>S&P 500 rises for a third day as comeback rally continues  CNBC
</li><li>Dow, S&P 500 trade mixed but Nasdaq Composite aims for 16th record …",2021-06-23
19,0.2023,https://seekingalpha.com/article/4436277-palantir-not-mega-cap-stock-in-next-5-10-years,Palantir Will Not Be A Mega-Cap Stock In The Next 5-10 Years,Palantir is a stock for long-term investors that believe in its growth path. But I don't see it becoming a Mega-cap stock in the next 5-10 years. Here's why.,2021-06-23
20,-0.3136,https://www.bloomberg.com/news/newsletters/2021-06-23/money-stuff-supreme-court-won-t-help-gse-shareholders-much,Money Stuff: Supreme Court Won't Help GSE Shareholders Much,"During the 2008 financial crisis, Fannie Mae and Freddie Mac, the giant mortgage companies, blew up. These were strange companies: They were publicly traded corporations owned by shareholders, but they were called “government-sponsored enterprises” (or “GSEs”…",2021-06-23
21,0.7615,https://www.kiplinger.com/investing/stocks/603027/stock-market-today-stocks-sluggish-but-nasdaq-high-tsla-f,"Stock Market Today: Stocks Sluggish, But Nasdaq Claws Out a Fresh High","Mixed signals on the economic front mostly muted the broader indexes, but a strong day from Tesla helped get the Nasdaq over the hump yet again.",2021-06-23
22,0.7096,https://finance.yahoo.com/news/chinas-ev-maker-xpeng-gets-062149529.html,China's EV maker Xpeng gets approval to list in Hong Kong -source,BEIJING (Reuters) -The listing committee of Hong Kong Stock Exchange has approved Chinese electric vehicle maker Xpeng Inc for a dual primary listing in the ...,2021-06-23
23,0.296,https://finance.yahoo.com/news/fxcm-may-single-share-stock-142600451.html,FXCM May Single Share & Stock Baskets Report,"LONDON, June 23, 2021 (GLOBE NEWSWIRE) -- FXCM Group, LLC (""FXCM Group"" or ""FXCM""), the leading international provider of online foreign exchange trading...",2021-06-23
24,0.3612,https://finance.yahoo.com/news/cidm-stock-buy-015841637.html,Is CIDM Stock A Buy Here?,"Before we spend countless hours researching a company, we like to analyze what insiders, hedge funds and billionaire investors think of the stock first. This...",2021-06-23
25,0.3612,https://finance.yahoo.com/news/pac-stock-buy-191551268.html,Is PAC Stock A Buy Here?,The financial regulations require hedge funds and wealthy investors that exceeded the $100 million holdings threshold to file a report that shows their...,2021-06-23
26,0.0,https://finance.yahoo.com/news/scyx-stock-buy-014846229.html,Is SCYX Stock A Buy Here?,The Insider Monkey team has completed processing the quarterly 13F filings for the March quarter submitted by the hedge funds and other money managers...,2021-06-23
27,0.6369,https://finance.yahoo.com/news/qiwi-stock-buy-023526478.html,Is QIWI Stock A Buy Here?,With the first-quarter round of 13F filings behind us it is time to take a look at the stocks in which some of the best money managers in the world preferred...,2021-06-23
28,0.8555,https://www.forbes.com/sites/qai/2021/06/23/bank-of-hawaii-named-top-buy-today-by-ai-as-comeback-rally-continues/,Bank Of Hawaii Named Top Buy Today By AI As Comeback Rally Continues,"What a difference a week can make. As of today, we have the S&P 500 trading within 0.1% of its record high. For investors looking to find the best opportunities, the deep learning algorithms at Q.ai have crunched the data to give you a set of Top Buys.",2021-06-23
29,0.4404,https://finance.yahoo.com/news/ferguson-plc-ferg-good-stock-192335426.html,Is Ferguson plc (FERG) A Good Stock To Buy?,"The latest 13F reporting period has come and gone, and Insider Monkey is again at the forefront when it comes to making use of this gold mine of data. We...",2021-06-23
30,0.3612,https://finance.yahoo.com/news/sanara-medtech-inc-smti-good-015857615.html,Is Sanara MedTech Inc. (SMTI) A Good Stock To Buy?,"Most investors tend to think that hedge funds and other asset managers are worthless, as they cannot beat even simple index fund portfolios. In fact, most...",2021-06-23
31,0.7964,https://finance.yahoo.com/news/volitionrx-vnrx-good-stock-buy-015844542.html,Is VolitionRX (VNRX) A Good Stock To Buy?,With the first-quarter round of 13F filings behind us it is time to take a look at the stocks in which some of the best money managers in the world preferred...,2021-06-23
32,0.8074,https://finance.yahoo.com/news/polypid-ltd-pypd-good-stock-015851086.html,Is PolyPid Ltd. (PYPD) A Good Stock To Buy?,In this article you are going to find out whether hedge funds think PolyPid Ltd. (NASDAQ:PYPD) is a good investment right now. We like to check what the...,2021-06-23
33,0.6249,https://finance.yahoo.com/news/kaixin-auto-holdings-kxin-good-015848361.html,Is Kaixin Auto Holdings (KXIN) A Good Stock To Buy?,"Hedge Funds and other institutional investors have just completed filing their 13Fs with the Securities and Exchange Commission, revealing their equity...",2021-06-23
34,0.7964,https://finance.yahoo.com/news/investors-title-company-itic-good-191548782.html,Is Investors Title Company (ITIC) A Good Stock To Buy?,"As we already know from media reports and hedge fund investor letters, hedge funds delivered their best returns in a decade. Most investors who decided to...",2021-06-23
35,0.7003,https://finance.yahoo.com/news/xoma-corp-xoma-good-stock-191607696.html,Is XOMA Corp (XOMA) A Good Stock To Buy?,In this article we will check out the progression of hedge fund sentiment towards XOMA Corp (NASDAQ:XOMA) and determine whether it is a good investment right...,2021-06-23
36,0.7964,https://finance.yahoo.com/news/agrify-corporation-agfy-good-stock-022513920.html,Is Agrify Corporation (AGFY) A Good Stock To Buy?,"As we already know from media reports and hedge fund investor letters, hedge funds delivered their best returns in a decade. Most investors who decided to...",2021-06-23
37,0.6096,https://finance.yahoo.com/news/usio-inc-usio-good-stock-022522313.html,"Is Usio, Inc. (USIO) A Good Stock To Buy?","Out of thousands of stocks that are currently traded on the market, it is difficult to identify those that will really generate strong returns. Hedge funds...",2021-06-23
38,0.6597,https://finance.yahoo.com/news/cambridge-bancorp-catc-good-stock-022529618.html,Is Cambridge Bancorp (CATC) A Good Stock To Buy?,A whopping number of 13F filings filed with U.S. Securities and Exchange Commission has been processed by Insider Monkey so that individual investors can...,2021-06-23
39,0.7351,https://finance.yahoo.com/news/o2micro-international-limited-oiim-good-190710955.html,Is O2Micro International Limited (OIIM) A Good Stock To Buy?,With the first-quarter round of 13F filings behind us it is time to take a look at the stocks in which some of the best money managers in the world preferred...,2021-06-23
40,0.9313,https://finance.yahoo.com/news/10-best-ev-startups-watch-151009440.html,10 Best EV Startups to Watch,"In this article, we discuss the 10 best EV startups to watch. If you want to skip our detailed analysis of these startups, go directly to the 5 Best EV...",2021-06-23
41,0.91,https://finance.yahoo.com/news/nio-chip-shortage-won-t-072610709.html,Nio: Chip Shortage Won’t Chip Away at Market Gains,"A recent piece highlighted why Nio (NIO) may be a better long-term growth play than Tesla (TSLA). Certainly, that sentiment appears to be holding true, at...",2021-06-23
42,0.6124,https://finance.yahoo.com/news/3d-systems-gains-28-partnership-152209349.html,3D Systems Gains 28% on Partnership with CollPlant,"3D Systems (DDD) partnered with Israel-based regenerative medicine giant CollPlant (CLGN) Biotechnologies. Following the deal, 3D Systems gained 27.7%, while...",2021-06-23
43,-0.3736,https://finance.yahoo.com/news/avoid-velocity-financial-inc-vel-185838696.html,"Should I Avoid Velocity Financial, Inc. (VEL)?","How do you pick the next stock to invest in? One way would be to spend days of research browsing through thousands of publicly traded companies. However, an ...",2021-06-23
44,0.7269,https://www.bloomberg.com/news/features/2021-06-23/spac-stocks-wall-street-billionaires-make-millions-while-investors-lose-money,The SPAC Man Method: Inside the Billionaire Rush for Riches,"As insiders have raced to push businesses into the public’s hands, they’ve employed a range of maneuvers to boost their fortunes.",2021-06-23
45,0.6597,https://finance.yahoo.com/news/high-growth-stocks-come-back-231211057.html,High-Growth Stocks Come Back Into Investors' Favor,"The short-term bottom for next-generation enterprises is in, and high multiple stocks are returning to investors' favor.",2021-06-23
46,0.3182,https://www.moneycontrol.com/news/business/cryptocurrency/cryptocurrency-coinbase-shares-hovering-around-222-mark-near-all-time-low-7075011.html,"Cryptocurrency: Coinbase shares hovering around $222 mark, near all-time low","The shares have been range bound around $220 levels since Monday, when it slumped by 49 percent from its all-time high of $430 at listing in April this year.",2021-06-23
47,0.4215,https://finance.yahoo.com/news/mideast-joins-bitcoin-craze-first-080550121.html,Mideast Joins Bitcoin Craze With First Crypto Listing in Dubai,"(Bloomberg) -- The Bitcoin Fund listed on the Nasdaq Dubai exchange Wednesday, the first of its kind to trade in the Middle East as cryptocurrencies grab...",2021-06-23
48,0.7964,https://finance.yahoo.com/news/kura-sushi-usa-inc-krus-023515266.html,"Is Kura Sushi USA, Inc. (KRUS) A Good Stock To Buy?","As we already know from media reports and hedge fund investor letters, hedge funds delivered their best returns in a decade. Most investors who decided to...",2021-06-23
49,-0.4019,https://finance.yahoo.com/news/intercorp-financial-services-inc-ifs-190730300.html,Is Intercorp Financial Services Inc. (IFS) A Good Stock To Buy?,"Although the masses and most of the financial media blame hedge funds for their exorbitant fee structure and disappointing performance, these investors have ...",2021-06-23
50,0.0258,https://finance.yahoo.com/news/acres-commercial-realty-corp-acr-022532685.html,Is ACRES Commercial Realty Corp. (ACR) A Good Stock To Buy?,Last year we predicted the arrival of the first US recession since 2009 and we told in advance that the market will decline by at least 20% in (Recession is ...,2021-06-23
51,0.4404,https://finance.yahoo.com/news/centrais-eletricas-brasileiras-sa-ebr-014903105.html,Is Centrais Eletricas Brasileiras SA (EBR.B) A Good Stock To Buy?,In this article we will check out the progression of hedge fund sentiment towards Centrais Eletricas Brasileiras SA (NYSE:EBR) and determine whether it is a ...,2021-06-23
52,0.3182,https://finance.yahoo.com/news/crestwood-equity-partners-lp-ceqp-015837039.html,Crestwood Equity Partners LP (CEQP): Are Hedge Funds Right About This Stock?,We at Insider Monkey have gone over 866 13F filings that hedge funds and prominent investors are required to file by the SEC. The 13F filings show the funds’...,2021-06-23
53,0.4588,https://finance.yahoo.com/news/where-hedge-funds-stand-battalion-191558435.html,Where Do Hedge Funds Stand On Battalion Oil Corporation (BATL)?,"While the market driven by short-term sentiment influenced by the accommodative interest rate environment in the US, virus news and stimulus spending, many...",2021-06-23
54,-0.4215,https://finance.yahoo.com/news/hedge-funds-buying-fidus-investment-015854229.html,Hedge Funds Are Buying Fidus Investment Corp (FDUS),Last year we predicted the arrival of the first US recession since 2009 and we told in advance that the market will decline by at least 20% in (Recession is ...,2021-06-23
55,0.6808,https://finance.yahoo.com/news/twin-disc-incorporated-twin-fell-185834570.html,"Twin Disc, Incorporated (TWIN) Fell Out Of Favor With Hedge Funds?","In this article we will take a look at whether hedge funds think Twin Disc, Incorporated (NASDAQ:TWIN) is a good investment right now. We check hedge fund...",2021-06-23
56,0.8176,https://finance.yahoo.com/news/hedge-funds-love-investors-real-191604768.html,Do Hedge Funds Love Investors Real Estate Trust (CSR)?,After several tireless days we have finished crunching the numbers from nearly 900 13F filings issued by the elite hedge funds and other investment firms...,2021-06-23
57,-0.9465,https://finance.yahoo.com/news/t-ramps-fight-against-spam-095220641.html,AT&T Ramps up Fight against Spam Calls; Blocks 1B Robocalls,AT&T (T) has bolstered its efforts in the fight against calls initiated by fraudsters. The carrier is now blocking more than 1 billion spam calls a month as ...,2021-06-23
58,0.8271,https://finance.yahoo.com/news/hedge-funds-love-wpp-plc-185845004.html,Do Hedge Funds Love WPP Plc (WPP)?,"Our extensive research has shown that imitating the smart money can generate significant returns for retail investors, which is why we track nearly 900...",2021-06-23
59,0.0,https://finance.yahoo.com/news/hedge-funds-nibbling-compass-diversified-185849369.html,Hedge Funds Are Nibbling On Compass Diversified (CODI),"The latest 13F reporting period has come and gone, and Insider Monkey is again at the forefront when it comes to making use of this gold mine of data. We at ...",2021-06-23
60,0.4939,https://www.valuewalk.com/chris-browns-short-pitch-on-tesla/,Chris Brown’s Short Pitch On Tesla,"Whitney Tilson’s email to investors discussing Chris Brown’s short pitch on Tesla Inc (NASDAQ:TSLA). Q1 2021 hedge fund letters, conferences and more Chris Brown’s Short Pitch On Tesla 1) My friend Chris Brown of Aristides Capital, who’s put up one of the bes…",2021-06-23
61,0.7964,https://finance.yahoo.com/news/drdgold-ltd-drd-fell-favor-023508003.html,DRDGOLD Ltd. (DRD) Fell Out Of Favor With Hedge Funds?,In this article you are going to find out whether hedge funds think DRDGOLD Ltd. (NYSE:DRD) is a good investment right now. We like to check what the smart...,2021-06-23
62,-0.6808,https://finance.yahoo.com/news/hedge-funds-think-investar-holding-022542194.html,Here is What Hedge Funds Think About Investar Holding Corporation (ISTR),"Although the masses and most of the financial media blame hedge funds for their exorbitant fee structure and disappointing performance, these investors have ...",2021-06-23
63,0.4404,https://finance.yahoo.com/news/hedge-funds-think-heritage-financial-022519775.html,Here is What Hedge Funds Think About Heritage Financial Corporation (HFWA),In this article we will analyze whether Heritage Financial Corporation (NASDAQ:HFWA) is a good investment right now by following the lead of some of the best...,2021-06-23
64,0.811,https://finance.yahoo.com/news/smart-money-never-less-bullish-015834054.html,Smart Money Never Been Less Bullish On BEST Inc. (BEST),The Insider Monkey team has completed processing the quarterly 13F filings for the March quarter submitted by the hedge funds and other money managers...,2021-06-23
65,0.4404,https://finance.yahoo.com/news/where-hedge-funds-stand-beyond-185821485.html,"Where Do Hedge Funds Stand On Beyond Air, Inc. (XAIR)?","In this article we are going to use hedge fund sentiment as a tool and determine whether Beyond Air, Inc. (NASDAQ:XAIR) is a good investment right now. We...",2021-06-23
66,0.0,https://finance.yahoo.com/news/where-hedge-funds-stand-nephros-185852599.html,"Where Do Hedge Funds Stand On Nephros, Inc. (NEPH)?",The Insider Monkey team has completed processing the quarterly 13F filings for the March quarter submitted by the hedge funds and other money managers...,2021-06-23
67,0.6486,https://finance.yahoo.com/news/gamestop-gme-still-worthy-investment-162323995.html,Is GameStop (GME) Still A Worthy Investment Pick?,"Boyar Value Group, an investment management firm, published its first quarter 2021 investor letter – a copy of which can be downloaded here. In its Q1 letter...",2021-06-23
68,0.4019,https://finance.yahoo.com/news/watsco-wso-smart-long-term-162807244.html,Is Watsco (WSO) A Smart Long-Term Buy?,"Qualivian Investment Partners, an investment management firm, published its first quarter 2021 investor letter – a copy of which can be downloaded here. In...",2021-06-23
69,-0.6808,https://finance.yahoo.com/news/where-hedge-funds-stand-magic-023519454.html,Where Do Hedge Funds Stand On Magic Software Enterprises Ltd. (MGIC)?,"Although the masses and most of the financial media blame hedge funds for their exorbitant fee structure and disappointing performance, these investors have ...",2021-06-23
70,0.5106,https://finance.yahoo.com/news/where-hedge-funds-stand-vtv-014853423.html,Where Do Hedge Funds Stand On vTv Therapeutics Inc (VTVT)?,"We know that hedge funds generate strong, risk-adjusted returns over the long run, therefore imitating the picks that they are collectively bullish on can be...",2021-06-23
71,0.1531,https://finance.yahoo.com/news/hedge-funds-dumping-mcewen-mining-185831675.html,Hedge Funds Are Dumping McEwen Mining Inc (MUX),In this article we will check out the progression of hedge fund sentiment towards McEwen Mining Inc (NYSE:MUX) and determine whether it is a good investment ...,2021-06-23
72,0.6369,https://finance.yahoo.com/news/hedge-fund-sentiment-stagnant-ramaco-012450100.html,"Hedge Fund Sentiment Is Stagnant On Ramaco Resources, Inc. (METC)","As we already know from media reports and hedge fund investor letters, hedge funds delivered their best returns in a decade. Most investors who decided to...",2021-06-23
73,-0.4215,https://finance.yahoo.com/news/neovasc-inc-nvcn-hedge-funds-014850746.html,Neovasc Inc. (NVCN): Hedge Funds Are Snapping Up,Last year we predicted the arrival of the first US recession since 2009 and we told in advance that the market will decline by at least 20% in (Recession is ...,2021-06-23
74,0.7964,https://finance.yahoo.com/news/hedge-fund-sentiment-stagnant-imara-185841660.html,Hedge Fund Sentiment Is Stagnant On IMARA Inc. (IMRA),In this article we will analyze whether IMARA Inc. (NASDAQ:IMRA) is a good investment right now by following the lead of some of the best investors in the...,2021-06-23
75,0.802,https://finance.yahoo.com/news/hedge-funds-love-lawson-products-190718370.html,"Do Hedge Funds Love Lawson Products, Inc. (LAWS)?","While the market driven by short-term sentiment influenced by the accommodative interest rate environment in the US, virus news and stimulus spending, many...",2021-06-23
76,0.4588,https://finance.yahoo.com/news/hedge-funds-aren-t-crazy-190725738.html,Hedge Funds Aren’t Crazy About Luna Innovations Incorporated (LUNA) Anymore,In this article you are going to find out whether hedge funds think Luna Innovations Incorporated (NASDAQ:LUNA) is a good investment right now. We like to...,2021-06-23
77,-0.6808,https://finance.yahoo.com/news/where-hedge-funds-stand-colony-022539508.html,Where Do Hedge Funds Stand On Colony Bankcorp Inc (CBAN)?,"Although the masses and most of the financial media blame hedge funds for their exorbitant fee structure and disappointing performance, these investors have ...",2021-06-23
78,0.5829,https://finance.yahoo.com/news/goodrich-petroleum-corporation-gdp-fell-023459040.html,Goodrich Petroleum Corporation (GDP) Fell Out Of Favor With Hedge Funds,"Out of thousands of stocks that are currently traded on the market, it is difficult to identify those that will really generate strong returns. Hedge funds...",2021-06-23
